{"headline": "From Canada to Meetup.com, the Journey of a Protest Meme", "keywords": [{"rank": "4", "name": "organizations", "value": "Adbusters"}, {"rank": "3", "name": "subject", "value": "Demonstrations, Protests, and Riots"}, {"rank": "2", "name": "subject", "value": "Computers and the Internet"}, {"rank": "1", "name": "type_of_material", "value": "News"}], "lead_paragraph": "It began with an e-mail on July 13.", "pub_date": "2011-10-13T18:25:23Z"}
{"headline": "Protesting The Establishment", "keywords": [{"value": "Atlanta", "is_major": "N", "rank": "3", "name": "unknown"}, {"value": "Tea Party Movement", "is_major": "N", "rank": "1", "name": "subject"}, {"value": "Occupy Wall Street", "is_major": "N", "rank": "2", "name": "organizations"}, {"value": "Lewis, John R", "is_major": "N", "rank": "4", "name": "persons"}], "lead_paragraph": "Their politics differ, but the Occupy Wall Street and Tea Party movements agree on one thing.", "pub_date": "2011-10-13T18:40:33Z"}
{"headline": "Protesting the Establishment", "keywords": [{"rank": "4", "name": "organizations", "value": "Occupy Wall Street"}, {"rank": "3", "name": "subject", "value": "United States Politics and Government"}, {"rank": "2", "name": "subject", "value": "Tea Party Movement"}, {"rank": "5", "name": "glocations", "value": "Atlanta (Ga)"}, {"rank": "1", "name": "type_of_material", "value": "News"}], "lead_paragraph": "Their politics differ, but the Occupy Wall Street and Tea Party movements agree on one thing. Kate Zernike reports from Atlanta.", "pub_date": "2011-10-13T18:45:26Z"}
{"headline": "TimesCast | October 14, 2011", "keywords": [{"value": "Berlusconi, Silvio", "is_major": "N", "rank": "1", "name": "persons"}, {"value": "Cain, Herman", "is_major": "N", "rank": "2", "name": "persons"}], "lead_paragraph": "Italy\u2019s prime minister survives a close confidence vote; Occupy Wall Street protesters dig in; and criticism grows for the Republican candidate Herman Cain\u2019s tax-reform plan.", "pub_date": "2011-10-14T00:00:00Z"}
{"headline": "Tidying Up, Pre-emptively, But Showdown May Loom", "keywords": [], "lead_paragraph": "Updated, 9:21 p.m.| Young people in knit hats and jeans scurried around Thursday wielding brooms and trash bags, moving mountains of sleeping bags, backpacks and jackets out of the way. By cleaning up Zuccotti Park on their own, they were trying to persuade the park's owner, Brookfield Properties, to back down from its plan to send in cleanup crews Friday morning and begin to enforce new rules on the use of the park that would end the Occupy Wall Street protest, at least in its current form.", "pub_date": "2011-10-14T00:00:00Z"}
{"headline": "With Cleanup Postponed, Joy and Tension in Zuccotti Park", "keywords": [{"rank": "3", "is_major": "N", "value": "Demonstrations, Protests, and Riots", "name": "subject"}, {"rank": "1", "is_major": "N", "value": "Occupy Wall Street", "name": "organizations"}, {"rank": "2", "is_major": "N", "value": "New York City", "name": "glocations"}], "lead_paragraph": "After fears of eviction, Occupy Wall Street protesters celebrated, marched and continued their protest in Downtown Manhattan.", "pub_date": "2011-10-14T00:00:00Z"}
{"headline": "DealBook Online", "keywords": [], "lead_paragraph": "ICAHN'S STAKE The activist investor Carl C. Icahn, below, disclosed on Thursday that he had built up a 9.8 percent stake in Navistar International, a maker of trucks and buses. In a securities filing, Mr. Icahn said he had already held discussions with management, including about potentially adding members to the board. Mr. Icahn did not say anything more about his intentions. His playbook has ranged from pushing a company to explore a potential sale to making his own takeover bid, though with the hope that someone else will come in with a higher price. MICHAEL J. de la MERCED CITADEL CHARGES A former employee of the hedge fund Citadel has been arrested and charged by federal authorities in Chicago with stealing trade secrets from the firm.", "pub_date": "2011-10-14T00:00:00Z"}
{"headline": "Occupy San Francisco Is Nothing Like the Old Days", "keywords": [{"name": "glocations", "value": "SAN FRANCISCO (CALIF)"}, {"name": "organizations", "value": "OCCUPY WALL STREET"}, {"name": "subject", "value": "SOCIAL NETWORKING (INTERNET)"}, {"name": "subject", "value": "DEMONSTRATIONS, PROTESTS, AND RIOTS"}], "lead_paragraph": "Call it occupation envy. The first wave of Occupy San Francisco protesters made their way down to the financial district a month ago to take a stand against what they perceived to be a financial system run amok.", "pub_date": "2011-10-14T00:00:00Z"}
{"headline": "Privately Owned Park, Open to the Public, May Make Its Own Rules", "keywords": [{"name": "glocations", "value": "FINANCIAL DISTRICT (NYC)"}, {"name": "organizations", "value": "BROOKFIELD OFFICE PROPERTIES"}, {"name": "organizations", "value": "OCCUPY WALL STREET"}, {"name": "subject", "value": "ZONING"}], "lead_paragraph": "Zuccotti Park, the half-acre plaza in Lower Manhattan now synonymous with Occupy Wall Street, exists in a strange category of New York parkland, identified by a seeming oxymoron: a privately owned public space. The park was established in a wave of development that spurred corporate plazas after changes were made to the city's zoning laws in the early 1960s. The laws generally give real estate developers zoning concessions in exchange for public space. There are now at least 520 such parks, arcades and plazas in New York City, both indoors and out, providing a total of 3.5 million square feet of space.", "pub_date": "2011-10-14T00:00:00Z"}
{"headline": "What's On Today", "keywords": [], "lead_paragraph": "10 P.M. (ABC) A HIDDEN AMERICA: CHILDREN OF THE PLAINS In this edition of ''20/20,'' Diane Sawyer, second from right above, travels to Pine Ridge Indian Reservation in South Dakota, where young members of the Oglala Lakota tribe -- among them a girl with dreams of participating in ''American Idol'' and a star middle-school quarterback -- are desperately trying to hold on amid alcoholism and poverty. Of the estimated 40,000 residents on Pine Ridge's 2.2 million acres, 47 percent live below the federal poverty level, and 65 to 80 percent of adults are thought to be unemployed. This episode is the latest installment in Ms. Sawyer's ongoing report about people living on the margins of society in the United States. 8:30 A.M. (HBO) SOMETHING THE LORD MADE (2004) In this adaptation of a true story, Alan Rickman plays Dr. Alfred Blalock, who pioneered open-heart surgery. Mos Def, at left below with Mr. Rickman, is Vivien Thomas, a janitor who became Dr. Blalock's technician. As a black man in the Depression-era South, he had his medical insights go largely uncredited. The movie ''is supposed to be an uplifting tear-jerker about two men who defy racism to accomplish miracles,'' Virginia Heffernan wrote in The New York Times. ''Fortunately, it's much, much better than that.''", "pub_date": "2011-10-14T00:00:00Z"}
{"headline": "Inside the Times", "keywords": [], "lead_paragraph": "International MILITANTS FINANCED BY IRAN", "pub_date": "2011-10-14T00:00:00Z"}
{"headline": "'Christopher D'Arcangelo': 'On the Work of ChristopherD'Arcangelo (1975-1979)'", "keywords": [{"name": "subject", "value": "ART"}], "lead_paragraph": "Artists Space 38 Greene Street, SoHo", "pub_date": "2011-10-14T00:00:00Z"}
{"headline": "'Occupy' Protests Standing Up to Reaganism", "keywords": [], "lead_paragraph": "NEW YORK -- On a drizzly evening in Zuccotti Park this week, where the Occupy Wall Street protesters are camped out with the modern revolutionary's gear of iPhone, blue tarp and cappuccino, I spotted one young man wearing a T-shirt with an image of Ronald Reagan and the words ''Bad Religion.'' It was the right outfit for the occasion. That's because the greatest significance of the wave of leftist demonstrations that started in Lower Manhattan and rippled across the United States over the past few weeks is the potential challenge it poses to the Reagan Revolution.", "pub_date": "2011-10-14T00:00:00Z"}
{"headline": "The Listings", "keywords": [{"name": "subject", "value": "SCULPTURE"}, {"name": "subject", "value": "SEPTEMBER 11 (2001)"}, {"name": "subject", "value": "PHOTOGRAPHY"}, {"name": "subject", "value": "MUSEUMS"}], "lead_paragraph": "Art Museums and galleries are in Manhattan unless otherwise noted. Full reviews of recent art shows: nytimes.com/art.", "pub_date": "2011-10-14T00:00:00Z"}
{"headline": "The Week in Pictures for Oct. 14", "keywords": [{"name": "subject", "value": "PHOTOGRAPHY"}, {"name": "organizations", "value": "OCCUPY WALL STREET"}, {"name": "glocations", "value": "NEW YORK CITY"}, {"name": "glocations", "value": "BOWERY (NYC)"}, {"name": "persons", "value": ""}, {"name": "creative_works", "value": ""}], "lead_paragraph": "Photographs from the past week in New York City and the region. Subjects include a Bowery hotel that houses two different worlds, a legendary comedian who panhandles in Midtown, and a cleanup in Zuccotti Park.", "pub_date": "2011-10-14T00:00:00Z"}
{"headline": "With Cleanup Postponed, Joy and Tension in Zuccotti Park", "keywords": [{"name": "subject", "value": "DEMONSTRATIONS, PROTESTS, AND RIOTS"}, {"name": "organizations", "value": "OCCUPY WALL STREET"}, {"name": "glocations", "value": "NEW YORK CITY"}, {"name": "persons", "value": ""}, {"name": "creative_works", "value": ""}], "lead_paragraph": "After fears of eviction, Occupy Wall Street protesters celebrated, marched and continued their protest in Downtown Manhattan.", "pub_date": "2011-10-14T00:00:00Z"}
{"headline": "The Week in Pictures for Oct. 14", "keywords": [{"rank": "3", "is_major": "N", "value": "Bowery (NYC)", "name": "glocations"}, {"rank": "1", "is_major": "N", "value": "New York City", "name": "glocations"}, {"rank": "4", "is_major": "N", "value": "Occupy Wall Street", "name": "organizations"}, {"rank": "2", "is_major": "N", "value": "Photography", "name": "subject"}], "lead_paragraph": "Photographs from the past week in New York City and the region. Subjects include a Bowery hotel that houses two different worlds, a legendary comedian who panhandles in Midtown, and a cleanup in Zuccotti Park.", "pub_date": "2011-10-14T00:00:00Z"}
{"headline": "Iran Scoffs at U.S. Account of Alleged Assassination Plot", "keywords": [{"name": "persons", "value": "ARBABSIAR, MANSOUR J"}, {"name": "persons", "value": "SHAKURI, GHOLAM"}, {"name": "persons", "value": "FAISAL, SAUD AL-"}, {"name": "persons", "value": "KHAMENEI, ALI"}, {"name": "persons", "value": "SALEHI, ALI AKBAR"}, {"name": "glocations", "value": "IRAN"}, {"name": "glocations", "value": "UNITED STATES"}, {"name": "glocations", "value": "SAUDI ARABIA"}, {"name": "organizations", "value": "ISLAMIC REVOLUTIONARY GUARDS CORPS"}, {"name": "subject", "value": "UNITED STATES INTERNATIONAL RELATIONS"}, {"name": "subject", "value": "DIPLOMATIC SERVICE, EMBASSIES AND CONSULATES"}, {"name": "subject", "value": "TERRORISM"}], "lead_paragraph": "The government of Iran on Thursday escalated its rebuttal of American criminal charges that it was behind a murder conspiracy in Washington, calling the claims that Iranian agents had plotted to kill the Saudi ambassador with the help of a Mexican drug gang so ludicrous that even politicians and press in the United States were expressing skepticism about such a scheme. The latest rejoinder added to the response of Iran's top leader, Ayatollah Ali Khamenei, and his subordinates, who said on Wednesday that the suspected plot was concocted in Washington to distract Americans from their own traumatic economic problems, highlighted by the Occupy Wall Street movement.", "pub_date": "2011-10-14T00:00:00Z"}
{"headline": "Why Republicans Killed the Jobs Bill", "keywords": [{"name": "organizations", "value": "SENATE"}, {"name": "organizations", "value": "REPUBLICAN PARTY"}, {"name": "subject", "value": "UNITED STATES POLITICS AND GOVERNMENT"}, {"name": "subject", "value": "UNITED STATES ECONOMY"}, {"name": "subject", "value": "LABOR AND JOBS"}], "lead_paragraph": "To the Editor: Re ''No Jobs Bill, and No Ideas'' (editorial, Oct. 13):", "pub_date": "2011-10-14T00:00:00Z"}
{"headline": "The Unemployed Don't Care Whether It's Structural or Cyclical", "keywords": [{"name": "persons", "value": "EMANUEL, RAHM"}, {"name": "glocations", "value": "CHICAGO (ILL)"}, {"name": "subject", "value": "UNEMPLOYMENT"}, {"name": "subject", "value": "ECONOMIC CONDITIONS AND TRENDS"}], "lead_paragraph": "James Warren writes a column for the Chicago News Cooperative. As Rahm Emanuel unveiled his first budget Wednesday morning, Deborah Benford stood at 43rd Street and Cottage Grove Avenue and personified the economic context in which the mayor operates.", "pub_date": "2011-10-14T00:00:00Z"}
{"headline": "Cleanup of Zuccotti Park Is Postponed", "keywords": [{"rank": "4", "name": "subject", "value": "Demonstrations, Protests, and Riots"}, {"rank": "3", "name": "persons", "value": "Kelly, Raymond W"}, {"rank": "2", "name": "persons", "value": "Bloomberg, Michael R"}, {"rank": "5", "name": "subject", "value": "Police"}, {"rank": "1", "name": "type_of_material", "value": "News"}, {"rank": "6", "name": "organizations", "value": "Occupy Wall Street"}, {"rank": "7", "name": "organizations", "value": "Police Department (NYC)"}, {"rank": "8", "name": "glocations", "value": "Manhattan (NYC)"}], "lead_paragraph": "Updated, 2:38 p.m. | The cleanup of the Lower Manhattan park that has been occupied by protesters for nearly a month was postponed Friday shortly before it was supposed to begin, averting a feared showdown between the police and demonstrators, who had vowed to resist any efforts to evict them from their encampment.", "pub_date": "2011-10-14T07:04:16Z"}
{"headline": "The Soft Drink Summit", "keywords": [{"value": "Demonstrations, Protests, and Riots", "is_major": "N", "rank": "3", "name": "subject"}, {"value": "Occupy Wall Street", "is_major": "N", "rank": "1", "name": "organizations"}, {"value": "Wall Street", "is_major": "N", "rank": "2", "name": "unknown"}], "lead_paragraph": "A stockbroker and an Occupy Wall Street protester face off at a cafe table over the ongoing demonstrations in Zuccotti Park.", "pub_date": "2011-10-14T10:05:06Z"}
{"headline": "Morning Take-Out", "keywords": [{"rank": "1", "name": "type_of_material", "value": "News"}], "lead_paragraph": "The Road Ahead for Raj Rajaratnam \u00a0|\u00a0 Raj Rajaratnam is entering the next phase of his insider trading case.", "pub_date": "2011-10-14T10:08:10Z"}
{"headline": "Protestors Get The News", "keywords": [{"value": "Wall Street Journal", "is_major": "N", "rank": "3", "name": "organizations"}, {"value": "Demonstrations, Protests, and Riots", "is_major": "N", "rank": "1", "name": "subject"}, {"value": "Occupy Wall Street", "is_major": "N", "rank": "2", "name": "organizations"}], "lead_paragraph": "A cheer erupts after a the announcement that Brookfield Properties, which owns Zuccotti Park, will not require protesters to leave.", "pub_date": "2011-10-14T10:26:08Z"}
{"headline": "Wall Street Protest Finds a Seoul Sister", "keywords": [{"rank": "4", "name": "glocations", "value": "Seoul (South Korea)"}, {"rank": "1", "name": "type_of_material", "value": "News"}, {"rank": "3", "name": "organizations", "value": "Occupy Wall Street"}, {"rank": "2", "name": "subject", "value": "Demonstrations, Protests, and Riots"}], "lead_paragraph": "\"Occupy Yoido\" may have an unfamiliar ring, but Yoido is the neighborhood in Seoul where South Korea's biggest financial institutions are based. A rally by labor unions and civic groups inspired by the Occupy Wall Street protests is planned for this weekend in Yoido, The Financial Times' beyondbrics blog reports. Read more \u00bb", "pub_date": "2011-10-14T10:30:30Z"}
{"headline": "Opposite Sides of the Protest Come Together, Briefly", "keywords": [{"rank": "4", "name": "subject", "value": "Economic Conditions and Trends"}, {"rank": "3", "name": "subject", "value": "Demonstrations, Protests, and Riots"}, {"rank": "2", "name": "subject", "value": "Banking and Financial Institutions"}, {"rank": "5", "name": "organizations", "value": "Occupy Wall Street"}, {"rank": "1", "name": "type_of_material", "value": "News"}], "lead_paragraph": "Two men at Zuccotti Park in Lower Manhattan on Thursday could hardly have looked more different.", "pub_date": "2011-10-14T12:29:13Z"}
{"headline": "Holding Zuccotti Park", "keywords": [{"value": "Demonstrations, Protests, and Riots", "is_major": "N", "rank": "1", "name": "subject"}, {"value": "Occupy Wall Street", "is_major": "N", "rank": "2", "name": "organizations"}], "lead_paragraph": "Cheers erupted after an announcement was read from the Bloomberg administration that Brookfield properties, which owns Zuccotti Park, would not require protesters to leave.", "pub_date": "2011-10-14T14:00:25Z"}
{"headline": "Pair of Police-Protester Incidents Adds Fuel to Occupy Wall St.", "keywords": [{"rank": "4", "name": "organizations", "value": "Police Department (NYC)"}, {"rank": "3", "name": "organizations", "value": "Occupy Wall Street"}, {"rank": "2", "name": "organizations", "value": "National Lawyers Guild"}, {"rank": "5", "name": "glocations", "value": "Manhattan (NYC)"}, {"rank": "1", "name": "type_of_material", "value": "News"}], "lead_paragraph": "Updated, 8:11 p.m. | Amid the chaos in Lower Manhattan on Friday morning as the Occupy Wall Street protesters marched through the streets, there were two encounters between protesters and the police that were captured, however imperfectly, on video and then ricocheted across the Internet.", "pub_date": "2011-10-14T14:24:14Z"}
{"headline": "Pair of Police-Protester Incidents Adds Fuel to Occupy Wall St.", "keywords": [{"rank": "1", "name": "glocations", "value": "Manhattan (NYC)"}, {"rank": "1", "name": "organizations", "value": "National Lawyers Guild"}, {"rank": "2", "name": "organizations", "value": "Occupy Wall Street"}, {"rank": "3", "name": "organizations", "value": "Police Department (NYC)"}], "lead_paragraph": null, "pub_date": "2011-10-14T14:24:14Z"}
{"headline": "As Calls for Protests Go Global, Italy Jumps the Gun", "keywords": [{"rank": "4", "name": "organizations", "value": "Goldman Sachs Group Inc"}, {"rank": "3", "name": "subject", "value": "Demonstrations, Protests, and Riots"}, {"rank": "2", "name": "subject", "value": "Banking and Financial Institutions"}, {"rank": "5", "name": "glocations", "value": "Italy"}, {"rank": "1", "name": "type_of_material", "value": "News"}, {"rank": "6", "name": "unknown", "value": "Goldman Sachs Group Inc|GS|NYSE"}], "lead_paragraph": "Online organizers have set Saturday as the date to spread the Occupy Wall Street protests to cities around the world.", "pub_date": "2011-10-14T15:03:04Z"}
{"headline": "TimesCast | Protesters Dig In", "keywords": [{"value": "Wall Street", "is_major": "N", "rank": "1", "name": "unknown"}, {"value": "Occupy Wall Street", "is_major": "N", "rank": "2", "name": "organizations"}], "lead_paragraph": "A scheduled cleanup of Zuccotti Park was postponed, and Occupy Wall Street protesters dig in.", "pub_date": "2011-10-14T18:29:03Z"}
{"headline": "Bloggingheads: Conservative Class War?", "keywords": [{"value": "Occupy Wall Street", "is_major": "N", "rank": "1", "name": "organizations"}], "lead_paragraph": "Bill Scher, left, of the Campaign for America's Future and Kristen Soltis of the Independent Women's Forum debate conservative reaction to Occupy Wall Street.", "pub_date": "2011-10-14T20:43:38Z"}
{"headline": "Police Clear Camp of Offshoot Demonstrators in Denver", "keywords": [{"value": "Colorado", "is_major": "N", "rank": "5", "name": "glocations"}, {"value": "Demonstrations, Protests, and Riots", "is_major": "N", "rank": "3", "name": "subject"}, {"value": "Occupy Wall Street", "is_major": "Y", "rank": "1", "name": "organizations"}, {"value": "Denver (Colo)", "is_major": "Y", "rank": "2", "name": "glocations"}, {"value": "Police", "is_major": "N", "rank": "4", "name": "subject"}], "lead_paragraph": "At a Colorado offshoot of the Occupy Wall Street movement, the police met little resistance, though two dozen arrests were made.", "pub_date": "2011-10-15T00:00:00Z"}
{"headline": "Calls Flood In, City Backs Off and Protesters Stay", "keywords": [{"value": "Zuccotti Park (NYC)", "is_major": "Y", "rank": "3", "name": "glocations"}, {"value": "Occupy Wall Street", "is_major": "Y", "rank": "1", "name": "organizations"}, {"value": "Demonstrations, Protests, and Riots", "is_major": "N", "rank": "2", "name": "subject"}, {"value": "Bloomberg, Michael R", "is_major": "Y", "rank": "4", "name": "persons"}], "lead_paragraph": "The abrupt reversal of plans to empty Zuccotti Park averted a clash at the southern tip of Manhattan.", "pub_date": "2011-10-15T00:00:00Z"}
{"headline": "The 1930s Sure Sound Familiar", "keywords": [{"value": "Great Depression (1930's)", "is_major": "Y", "rank": "1", "name": "subject"}, {"value": "United States Economy", "is_major": "Y", "rank": "3", "name": "subject"}, {"value": "Recession and Depression", "is_major": "N", "rank": "2", "name": "subject"}], "lead_paragraph": "Many of the lessons of the Great Depression seem more relevant than ever today.", "pub_date": "2011-10-15T00:00:00Z"}
{"headline": "Be Careful Just Whom You Decide to Interrupt", "keywords": [{"value": "Klein, Calvin", "is_major": "N", "rank": "5", "name": "persons"}, {"value": "New York City", "is_major": "N", "rank": "1", "name": "glocations"}, {"value": "Art", "is_major": "N", "rank": "7", "name": "subject"}, {"value": "Parties (Social)", "is_major": "Y", "rank": "3", "name": "subject"}, {"value": "Celebrities", "is_major": "N", "rank": "2", "name": "subject"}, {"value": "Cosby, Bill", "is_major": "N", "rank": "4", "name": "persons"}], "lead_paragraph": "A lesson in interrupting a legend, the consequences of holding a party for a worthy cause in an enviable apartment, and a fast way to raise a lot of money.", "pub_date": "2011-10-15T00:00:00Z"}
{"headline": "The 1930s Sure Sound Familiar", "keywords": [{"name": "subject", "value": "RECESSION AND DEPRESSION"}, {"name": "subject", "value": "UNITED STATES ECONOMY"}, {"name": "subject", "value": "GREAT DEPRESSION (1930'S)"}], "lead_paragraph": "Not long ago, someone suggested that I read ''Since Yesterday,'' a book by Frederick Lewis Allen, a popular historian of the 1930s and 1940s. Published in 1940, it turned out to be a shrewd, concise, wonderfully written account of America in the '30s. It also turned out to be something else: a reminder of why history matters. It is impossible to read ''Since Yesterday'' without reflecting, again and again, on the parallels between then and now. The Great Depression, of course, dominates the book -- and is far worse than anything we've been through. Still, when Allen writes about Ivar Kreuger, the industrialist who built an empire that some considered a Ponzi scheme, you instantly think of Bernie Madoff. The country's fixation with the Lindbergh kidnapping seems strikingly similar to the country's fixation with Casey Anthony.", "pub_date": "2011-10-15T00:00:00Z"}
{"headline": "A Golden Touch Turns Leaden", "keywords": [{"name": "persons", "value": "PAULSON, JOHN A"}, {"name": "subject", "value": "GOLD"}, {"name": "subject", "value": "HEDGE FUNDS"}], "lead_paragraph": "No wonder Occupy Wall Street took its protest this week to East 86th Street and the 28,500-square-foot limestone mansion owned by the billionaire hedge fund manager John A. Paulson. What better symbol of the excesses of Wall Street than Mr. Paulson, who made billions betting on the real estate collapse and whose opulent surroundings stand in such contrast to the million of Americans who have lost their homes? Mr. Paulson made more than $15 billion for his hedge funds by betting on the collapse of the mortgage-backed securities market in 2007 and 2008, then followed up with an equally well-timed bet that large banks would survive the financial crisis and that the price of gold would soar. Last year he personally earned what has been estimated as the largest single payday in Wall Street history: $4.9 billion.", "pub_date": "2011-10-15T00:00:00Z"}
{"headline": "Rallies Across the Globe Protest Economic Policies", "keywords": [{"rank": "1", "is_major": "N", "value": "Occupy Wall Street", "name": "organizations"}, {"rank": "2", "is_major": "N", "value": "Demonstrations, Protests, and Riots", "name": "subject"}], "lead_paragraph": "Hundreds and in some cases thousands of people expressed discontent with the economy in Asia, the Americas and Europe.", "pub_date": "2011-10-15T00:00:00Z"}
{"headline": "Near Zuccotti Park, a Momentary D\u00e9tente for 2 Representatives of Opposing Views", "keywords": [], "lead_paragraph": "Two men at Zuccotti Park in Lower Manhattan on Thursday could hardly have looked more different. One, Edward T. Hall III, 25, was barefoot and dressed in loud, multicolored tights. He wore a beaded American Indian necklace and New Age jewelry, with a baseball cap pulled sideways over his long hair.", "pub_date": "2011-10-15T00:00:00Z"}
{"headline": "In Private, Wall St. Bankers Dismiss Protesters as Unsophisticated", "keywords": [{"name": "glocations", "value": "NEW YORK CITY"}, {"name": "organizations", "value": "OCCUPY WALL STREET"}, {"name": "subject", "value": "BANKING AND FINANCIAL INSTITUTIONS"}, {"name": "subject", "value": "DEMONSTRATIONS, PROTESTS, AND RIOTS"}], "lead_paragraph": "Publicly, bankers say they understand the anger at Wall Street -- but believe they are misunderstood by the protesters camped on their doorstep. But when they speak privately, it is often a different story.", "pub_date": "2011-10-15T00:00:00Z"}
