occupy+wall+street,20110101,20111123
{"headline": "The 41 Places to Go in 2011", "keywords": [{"name": "subject", "value": "TRAVEL AND VACATIONS"}], "lead_paragraph": "From the beaches of Mexico to the wilds of Kurdistan, the places on this year's list take you to the end of the world and back. 1. Santiago, Chile Undaunted by an earthquake, a city embraces modern culture.", "pub_date": "2011-01-09T00:00:00Z"}
{"headline": "The 41 Places to Go in 2011", "keywords": [], "lead_paragraph": "From the beaches of Mexico to the wilds of Kurdistan, the places on this year's list take you to the end of the world and back. 1. Santiago, Chile Undaunted by an earthquake, a city embraces modern culture.", "pub_date": "2011-01-09T00:00:00Z"}
{"headline": "Not All Sweetness in a Honeycomb Museum", "keywords": [{"name": "persons", "value": "BROAD, ELI"}, {"name": "glocations", "value": "LOS ANGELES (CALIF)"}, {"name": "organizations", "value": "DILLER SCOFIDIO & RENFRO"}, {"name": "subject", "value": "ARCHITECTURE"}, {"name": "subject", "value": "MUSEUMS"}], "lead_paragraph": "Experience tells us that it would be unwise to build up expectations for Eli Broad's proposed new museum, whose design was unveiled at a ceremony in downtown Los Angeles last week. Despite the tens of millions he has poured into the city's art institutions, Mr. Broad's reputation as a cultural patron is, to put it politely, subpar. Among architects he is known as someone with a gift for getting the worst buildings from the most highly regarded talents -- a reputation that was pretty much cemented with the opening of the $50 million Broad Contemporary Art Museum at the Los Angeles County Museum of Art, a bland, uninspired travertine box by Renzo Piano that ranks somewhere near the bottom of that architect's achievements.", "pub_date": "2011-01-12T00:00:00Z"}
{"headline": "Mom, You're One Tough Art Critic", "keywords": [{"name": "subject", "value": "PARENTING"}, {"name": "subject", "value": "CHILDREN AND YOUTH"}, {"name": "subject", "value": "ART"}, {"name": "subject", "value": "FAMILIES AND FAMILY LIFE"}], "lead_paragraph": "AFTER careful consideration, Jessica Hanff has found the ideal spot for the art that her 4-year-old daughter, Elisabeth, brings home from preschool: the trash can. ''We're getting two to four pieces of crayon drawing a day,'' said Ms. Hanff, a 36-year-old operations manager for an academic research institute. On a recent Tuesday, Ms. Hanff began sorting through a few dozen of Elisabeth's drawings, stacked in the mudroom of the family's Washington home.", "pub_date": "2011-01-27T00:00:00Z"}
{"headline": "Russian Ennui, American Idiom", "keywords": [{"value": "Maxwell, Roberta", "is_major": "N", "rank": "11", "name": "persons"}, {"value": "Hecht, Jessica", "is_major": "N", "rank": "5", "name": "persons"}, {"value": "Ireland, Marin", "is_major": "N", "rank": "9", "name": "persons"}, {"value": "Pendleton, Austin", "is_major": "N", "rank": "7", "name": "persons"}, {"value": "Chekhov, Anton", "is_major": "N", "rank": "3", "name": "persons"}, {"value": "Sarsgaard, Peter", "is_major": "N", "rank": "6", "name": "persons"}, {"value": "Schmidt, Paul", "is_major": "N", "rank": "14", "name": "persons"}, {"value": "Rylance, Juliet", "is_major": "N", "rank": "8", "name": "persons"}, {"value": "Hamilton, Josh", "is_major": "N", "rank": "10", "name": "persons"}, {"value": "Theater", "is_major": "N", "rank": "1", "name": "subject"}, {"value": "Lazar, Paul", "is_major": "N", "rank": "12", "name": "persons"}, {"value": "Classic Stage Company", "is_major": "N", "rank": "2", "name": "organizations"}, {"value": "Gyllenhaal, Maggie", "is_major": "N", "rank": "4", "name": "persons"}], "lead_paragraph": "A fresh and affecting Classic Stage Company production of Chekhov\u2019s \u201cThree Sisters\u201d features Jessica Hecht, Maggie Gyllenhaal and Peter Sarsgaard.", "pub_date": "2011-02-04T00:00:00Z"}
{"headline": "Russian Ennui, American Idiom", "keywords": [{"name": "creative_works", "value": "THREE SISTERS (PLAY)"}, {"name": "persons", "value": "CHEKHOV, ANTON"}, {"name": "persons", "value": "LAZAR, PAUL"}, {"name": "persons", "value": "SCHMIDT, PAUL"}, {"name": "persons", "value": "SARSGAARD, PETER"}, {"name": "persons", "value": "HECHT, JESSICA"}, {"name": "persons", "value": "RYLANCE, JULIET"}, {"name": "persons", "value": "IRELAND, MARIN"}, {"name": "persons", "value": "HAMILTON, JOSH"}, {"name": "persons", "value": "PENDLETON, AUSTIN"}, {"name": "persons", "value": "GYLLENHAAL, MAGGIE"}, {"name": "persons", "value": "MAXWELL, ROBERTA"}, {"name": "organizations", "value": "CLASSIC STAGE COMPANY"}, {"name": "organizations", "value": "CLASSIC STAGE CO"}, {"name": "subject", "value": "THEATER"}], "lead_paragraph": "It takes a long time to take a picture in the Russian provinces of the late 19th century, when cameras are novelties and exposures are slow. So when the characters of the Classic Stage Company's wonderfully fresh and affecting production of Chekhov's ''Three Sisters'' gather for a group portrait, they hold their poses for what feels like an unblinking eternity. How quaint and self-conscious they look, frozen in stiff postures and solemn expressions. And to think that this is how these people, who are so preoccupied with posterity, will be seen -- if they are seen at all -- in the years to come.", "pub_date": "2011-02-04T00:00:00Z"}
{"headline": "Goldman's Buyout Unit Nears Deal for Applebee's Operator", "keywords": [{"rank": "4", "name": "organizations", "value": "Applebee's Internatonal"}, {"rank": "3", "name": "subject", "value": "Restaurants"}, {"rank": "2", "name": "subject", "value": "Mergers, Acquisitions and Divestitures"}, {"rank": "5", "name": "organizations", "value": "Goldman Sachs Group Inc"}, {"rank": "1", "name": "type_of_material", "value": "News"}, {"rank": "6", "name": "organizations", "value": "Weston Presidio Capital"}, {"rank": "7", "name": "unknown", "value": "Goldman Sachs Group Inc|GS|NYSE"}], "lead_paragraph": "Goldman Sachs's private equity unit is nearing a deal to buy Apple American Group, the biggest franchisee of Applebee's Neighborhood Grill and Bar, a person briefed on the matter said Friday.", "pub_date": "2011-02-04T18:11:19Z"}
{"headline": "The Work of Art in the Age of Google", "keywords": [{"name": "organizations", "value": "GOOGLE INC"}, {"name": "subject", "value": "ART"}, {"name": "subject", "value": "COMPUTERS AND THE INTERNET"}], "lead_paragraph": "If art is among your full-blown obsessions or just a budding interest, Google, which has already altered the collective universe in so many ways, changed your life last week. It unveiled its Art Project, a Web endeavor that offers easy, if not yet seamless, access to some of the art treasures and interiors of 17 museums in the United States and Europe. It is very much a work in progress, full of bugs and information gaps, and sometimes blurry, careering virtual tours. But it is already a mesmerizing, world-expanding tool for self-education. You can spend hours exploring it, examining paintings from far off and close up, poking around some of the world's great museums all by your lonesome. I have, and my advice is: Expect mood swings. This adventure is not without frustrations.", "pub_date": "2011-02-07T00:00:00Z"}
{"headline": "Morning Take-Out", "keywords": [{"rank": "4", "name": "subject", "value": "Initial Public Offerings"}, {"rank": "3", "name": "subject", "value": "Hedge Funds"}, {"rank": "2", "name": "subject", "value": "Banking and Financial Institutions"}, {"rank": "5", "name": "subject", "value": "Mergers, Acquisitions and Divestitures"}, {"rank": "1", "name": "type_of_material", "value": "News"}, {"rank": "6", "name": "subject", "value": "Private Equity"}], "lead_paragraph": "MERGERS & ACQUISITIONS", "pub_date": "2011-02-15T08:30:37Z"}
{"headline": "Restaurant Plan Approved for Lower Manhattan Pier", "keywords": [{"rank": "1", "name": "type_of_material", "value": "News"}], "lead_paragraph": "The directors of the Battery Park City Authority voted on Tuesday to approve a 25-year lease of Pier A in Lower Manhattan to the Poulakakos family and a partner who plan to turn it into a 40,000-square-foot restaurant complex in New York Harbor.", "pub_date": "2011-03-08T17:19:00Z"}
{"headline": "March 9: Updates on Libya's Revolt and Middle East Protests", "keywords": [{"rank": "1", "name": "type_of_material", "value": "News"}], "lead_paragraph": "On Wednesday, The Lede is following the uprising in Libya and protest movements across North Africa and the Middle East. Updates below mix alerts on breaking news with reports from bloggers and journalists on the ground. Readers can also follow some of the discussion of the region on Twitter in this blog's right column.", "pub_date": "2011-03-09T08:13:15Z"}
{"headline": "At Met, New Leadership (and Direction) for Asian Art", "keywords": [], "lead_paragraph": "The Metropolitan Museum of Art's Asian art galleries are some of the most reposeful spaces in New York City. It's hard to imagine that they were banged into place, room by room, from practically nothing over the last 40 years, though they were. Or that they continue to mirror changing times, a changing museum and a changing Asia, though they do. A few months from now they'll be the scene of another change, a shift in stewardship, when the museum's longtime curator of Chinese art, Maxwell K. Hearn, replaces James C. Y. Watt as head of the Asian art department.", "pub_date": "2011-03-17T00:00:00Z"}
{"headline": "At Met, New Leadership (and Direction) for Asian Art", "keywords": [{"name": "glocations", "value": "FAR EAST, SOUTH AND SOUTHEAST ASIA AND PACIFIC AREAS"}, {"name": "organizations", "value": "METROPOLITAN MUSEUM OF ART"}, {"name": "subject", "value": "ART"}], "lead_paragraph": "The Metropolitan Museum of Art's Asian art galleries are some of the most reposeful spaces in New York City. It's hard to imagine that they were banged into place, room by room, from practically nothing over the last 40 years, though they were. Or that they continue to mirror changing times, a changing museum and a changing Asia, though they do. A few months from now they'll be the scene of another change, a shift in stewardship, when the museum's longtime curator of Chinese art, Maxwell K. Hearn, replaces James C. Y. Watt as head of the Asian art department.", "pub_date": "2011-03-17T00:00:00Z"}
{"headline": "The Joys Of Ping-Pong In the Open", "keywords": [{"name": "persons", "value": "MELIN, JEFF"}, {"name": "glocations", "value": "TOMPKINS SQUARE PARK (NYC)"}, {"name": "glocations", "value": "NEW YORK CITY"}, {"name": "glocations", "value": "BRYANT PARK (NYC)"}, {"name": "glocations", "value": "LOWER EAST SIDE (NYC)"}, {"name": "subject", "value": "TENNIS, TABLE"}, {"name": "subject", "value": "PARKS AND OTHER RECREATION AREAS"}, {"name": "subject", "value": "TABLE TENNIS"}], "lead_paragraph": "Furniture makers are prone to grand claims about their designs, but few go quite as far as Alan Good. ''I'm offering it less as an object,'' he says of his Henge T40 model, the institutional price of which is $3,490. ''It's more about the people who come by and just hang out, and watch each other. It slows down passers-by. It makes for a little lingering spot where you pause what you're doing, linger, talk with a stranger. The random rubbing of shoulders: that's how I put my table forward.'' By the way, it's a Ping-Pong table.", "pub_date": "2011-03-27T00:00:00Z"}
{"headline": "SYRIA INTENSIFIES MILITARY ATTACKS TO CRUSH DISSENT", "keywords": [{"name": "persons", "value": "ASSAD, BASHAR AL-"}, {"name": "glocations", "value": "SYRIA"}, {"name": "glocations", "value": "DARA'A (SYRIA)"}, {"name": "subject", "value": "DEMONSTRATIONS, PROTESTS AND RIOTS"}, {"name": "subject", "value": "MIDDLE EAST AND NORTH AFRICA UNREST (2010- )"}], "lead_paragraph": "BEIRUT, Lebanon -- The Syrian Army stormed the restive city of Dara'a with tanks and soldiers and helped detain dozens in towns across the country Monday in an escalation of the crackdown on Syria's five-week-old uprising, according to residents and human rights activists. They said at least 25 people had been killed in Dara'a, with reports of bodies strewn in the streets. The military's move into the town seemed to signal a new, harrowing chapter in a crackdown that has already killed nearly 400 people. Until now the government has been hewing to a mix of concessions and brute force, but its actions Monday indicated that it had chosen the latter, seeking to crush a wave of dissent in virtually every province that has shaken the once uncontested rule of President Bashar al-Assad, 45.", "pub_date": "2011-04-26T00:00:00Z"}
{"headline": "International Outcry Grows Over Syria Crackdown", "keywords": [{"rank": "2", "name": "subject", "value": "Middle East and North Africa Unrest (2010- )"}, {"rank": "1", "name": "glocations", "value": "Syria"}], "lead_paragraph": "Gunfire continued in the city of Dara\u2019a Tuesday as European leaders called for an end to the violence.", "pub_date": "2011-04-27T00:00:00Z"}
{"headline": "Off the Menu", "keywords": [{"name": "glocations", "value": "NEW YORK CITY"}, {"name": "subject", "value": "RESTAURANTS"}], "lead_paragraph": "Opening THE LEOPARD AT DES ARTISTES Gianfranco Sorrentino and Paula Bolla Sorrentino, who own Il Gattopardo in Midtown, have spent nearly a year on a mega-renovation of the former Caf\u00e9 des Artistes, including restoration of the nine Howard Chandler Christy murals. ''Il Gattopardo'' (''The Leopard'' in Italian) is also a novel about Sicily by Giuseppe Tomasi di Lampedusa. The theme has led the Sorrentinos to serve food from southern Italy, especially Sicily and Sardinia. Regional dishes include eggplant and smoked buffalo mozzarella timbale, bucatini with sardines and wild fennel and shellfish ragout with couscous. (Opens Monday): 1 West 67th Street, (212) 787-8767.", "pub_date": "2011-04-27T00:00:00Z"}
{"headline": "Live Blog: The 2011 N.F.L. Draft", "keywords": [{"rank": "4", "name": "subject", "value": "Television"}, {"rank": "3", "name": "subject", "value": "Draft and Recruitment (Sports)"}, {"rank": "2", "name": "persons", "value": "Ingram, Mark"}, {"rank": "5", "name": "organizations", "value": "National Football League"}, {"rank": "1", "name": "type_of_material", "value": "News"}], "lead_paragraph": "If you want real N.F.L draft wisdom, do not ask a team executive. Do not ask a prospect, reporter, or \"draftnik\" either.", "pub_date": "2011-04-28T19:35:23Z"}
{"headline": "Embassy Suite", "keywords": [{"rank": "1", "name": "type_of_material", "value": "News"}], "lead_paragraph": "For a high-powered money manager, being the wife of the American ambassador to France is gilt-edged.", "pub_date": "2011-04-29T13:30:33Z"}
{"headline": "EMBASSY SUITE", "keywords": [{"name": "persons", "value": "RIVKIN, CHARLES"}, {"name": "persons", "value": "TOLSON, SUSAN"}, {"name": "glocations", "value": "FRANCE"}, {"name": "glocations", "value": "PARIS (FRANCE)"}, {"name": "subject", "value": "FASHION AND APPAREL"}, {"name": "subject", "value": "INTERIOR DESIGN AND FURNISHINGS"}, {"name": "subject", "value": "MODELS (PROFESSIONAL)"}, {"name": "subject", "value": "DIPLOMATIC SERVICE, EMBASSIES AND CONSULATES"}], "lead_paragraph": "For a high-powered money manager, being the wife of the American ambassador to France is gilt-edged. The residence of the American ambassador to France is not the kind of place you'd expect to find young, scantily clad models - not on the record, anyway. But there they were in droves one evening in March, when Ambassador Charles Rivkin and his wife, Susan Tolson, welcomed the fashion crowd into their home to celebrate Michael Kors's 30th anniversary and his new store on the Rue St.-Honore. An enormous tent erected in the garden set the scene for a seated dinner for 200 that culminated in a performance by Mary J. Blige, who belted out ''Stairway to Heaven,'' ''One Love'' and ''Happy Birthday'' in honor of Tolson's 49th.", "pub_date": "2011-05-01T00:00:00Z"}
{"headline": "The Joys Of Staying Put", "keywords": [{"name": "glocations", "value": "NEW YORK CITY"}, {"name": "subject", "value": "HOUSING AND REAL ESTATE"}, {"name": "subject", "value": "MOVING AND MOVING INDUSTRY"}, {"name": "subject", "value": "REAL ESTATE AND HOUSING (RESIDENTIAL)"}], "lead_paragraph": "IN 1973, a few years out of college, Esther Cohen and a friend named Emily rented a little two-bedroom apartment on West 77th Street overlooking the American Museum of Natural History. Ms. Cohen, who had grown up near New Haven, fell in love with the crosshatch shadows made by the fire escape and the view of the museum's turrets. She painted a rainbow atop the archway that led to the Creamsicle-orange hallway. When Emily moved out a few months later, Ms. Cohen found a roommate named Harry, and at one of many parties held in the apartment -- Ms. Cohen was wearing a blue wig and Harry had made blanquette de veau -- she met a filmmaker named Peter Odabashian. Nearly four decades later, Ms. Cohen can still remember what his face looked like in the shadowy hallway. Within days Mr. Odabashian moved in, and the two have been together in the apartment for 37 years. Their son, Noah, whom they adopted from Chile in 1986, is currently living under the family roof, sometimes with his girlfriend, Chesray Dolpha, a student at New York University.", "pub_date": "2011-05-15T00:00:00Z"}
{"headline": "Countries Start Push for Their I.M.F. Picks", "keywords": [], "lead_paragraph": "PARIS -- Now that Dominique Strauss-Kahn has resigned as the chief of the International Monetary Fund, the choice of his successor is quickly turning into a battle between Europeans determined to keep the job for one of their own and leaders of emerging economic powers like China, India and South Africa that hope to break Europe's historic grip on the post. Mr. Strauss-Kahn stepped down late Wednesday after explosive charges that he had sexually attacked a housekeeper at a New York hotel. U.S. Treasury Secretary Timothy F. Geithner and others pushed to seek a new interim leader for the fund quickly.", "pub_date": "2011-05-20T00:00:00Z"}
{"headline": "A Shaken Agency Looks to the Future: Emerging Economies See a Chance To Break a European Monopoly", "keywords": [{"name": "persons", "value": "STRAUSS-KAHN, DOMINIQUE"}, {"name": "glocations", "value": "EUROPE"}, {"name": "glocations", "value": "INDIA"}, {"name": "glocations", "value": "CHINA"}, {"name": "organizations", "value": "INTERNATIONAL MONETARY FUND"}, {"name": "subject", "value": "SUSPENSIONS, DISMISSALS AND RESIGNATIONS"}], "lead_paragraph": "European officials moved quickly to assert their claim over the leadership of the International Monetary Fund on Thursday, suggesting a serious challenge is being mounted by emerging economic powers like China and India that believe the time has come to break Europe's historic grip on the post. The abrupt resignation of Dominique Strauss-Kahn late Wednesday night has brought tensions long simmering beneath the surface at the powerful organization to a boil.", "pub_date": "2011-05-20T00:00:00Z"}
{"headline": "The Defense Can't Afford To Rest", "keywords": [{"name": "persons", "value": "BLOOMBERG, MICHAEL R"}, {"name": "persons", "value": "VOGEL, IVAN"}, {"name": "glocations", "value": "NEW YORK CITY"}, {"name": "subject", "value": "LEGAL AID FOR THE POOR (CIVIL)"}, {"name": "subject", "value": "LEGAL AID FOR THE POOR"}, {"name": "subject", "value": "PUBLIC DEFENDERS"}, {"name": "subject", "value": "CRIME AND CRIMINALS"}], "lead_paragraph": "WHEN clients call Ivan Vogel's cellphone, they are treated to an unintentional, 13-second economic truth. ''This,'' the recorded message says, ''is the law office of Ivan A. Vogel. Leave your name and number. I'll get back to you as soon as I can.'' Mr. Vogel, a veteran defense lawyer who works mainly in Brooklyn, operates what can only be described as a telephonic practice, advising the accused wherever he may find himself. Not unlike the mobile hustler in the recent legal thriller ''The Lincoln Lawyer'' (who ran his practice from the back seat of a Town Car), his situation is somewhat unconventional, though it is also reflective of the increasingly troubled plight of a specific breed of New York lawyer, assigned-counsel -- or 18-B -- attorneys who represent the poor.", "pub_date": "2011-05-22T00:00:00Z"}
{"headline": "In Novel by Mayor's Daughter, Hints of Family Life", "keywords": [{"name": "creative_works", "value": "A CIRCUIT, THE (BOOK)"}, {"name": "persons", "value": "BLOOMBERG, MICHAEL R"}, {"name": "persons", "value": "BLOOMBERG, GEORGINA"}, {"name": "glocations", "value": "NEW YORK CITY"}, {"name": "subject", "value": "WRITING AND WRITERS"}, {"name": "subject", "value": "BOOKS AND LITERATURE"}], "lead_paragraph": "Those who inhabit the rarefied world of Michael R. Bloomberg, with all its perquisites and payouts, have long adhered to a strict code of silence about his personal life: jaunts to Bermuda are cloaked in secrecy, tax returns are heavily redacted and even his golf handicap is off limits. But perhaps no single sphere of Mr. Bloomberg's life has been as thoroughly walled off as his family. They occupy a realm that seems, even after the mayor's 10 years in public life, unknowable.", "pub_date": "2011-06-01T00:00:00Z"}
{"headline": "'For the Dogs' Has a Whole New Meaning", "keywords": [{"name": "subject", "value": "PETS"}, {"name": "subject", "value": "SALES"}], "lead_paragraph": "ORLANDO, Fla. LISA CORNISH is rattling off today's menu:", "pub_date": "2011-06-05T00:00:00Z"}
{"headline": "Spare Times", "keywords": [], "lead_paragraph": "PIRATES OF THE HUDSON Forget the pirates of the Caribbean. In honor of this patriotic weekend, why not celebrate plundering and profiteering that took place closer to home?", "pub_date": "2011-07-01T00:00:00Z"}
{"headline": "One Mouth Too Many", "keywords": [{"name": "glocations", "value": "KENYA"}, {"name": "glocations", "value": "NAIROBI (KENYA)"}, {"name": "organizations", "value": "UNITED NATIONS"}, {"name": "subject", "value": "REFUGEES AND DISPLACED PERSONS"}], "lead_paragraph": "One day each month in Eastleigh, a run-down suburb of Nairobi with dirt roads and rivering sewers, a young Kenyan woman named Dorothy Gakii starts calling out numbers. ''Numbaa one!'' she shouts, using slow and deliberate English. ''Numbaa two!'' Gathered before her on long wooden benches in a church meeting hall are several dozen refugees holding scraps of paper that mark their place in line. They are waiting for food -- for the sacks of dried beans and rice and maize flour piled against one wall. For the seriously malnourished, there is a nutritional porridge mix labeled, ''Pure Wimbi.'' Seven, eight, nine. Gakii calls numbers, and they approach. She has 74 families on her list today. The Congolese sit together by the windows. The Somalis have clustered on the left. The Ethiopians mostly occupy the middle. The women wear floor-length abayas and frayed sandals. Sometimes they hold out their arms and show scars from their hometown wars, telling stories about roving militias and lost children.", "pub_date": "2011-07-03T00:00:00Z"}
{"headline": "S.E.C. Spending Questioned", "keywords": [{"rank": "4", "name": "subject", "value": "Budgets and Budgeting"}, {"rank": "3", "name": "persons", "value": "Schapiro, Mary L"}, {"rank": "2", "name": "persons", "value": "Kotz, H David"}, {"rank": "5", "name": "subject", "value": "Dodd-Frank Wall Street Reform and Consumer Protection Act (2010)"}, {"rank": "1", "name": "type_of_material", "value": "News"}, {"rank": "6", "name": "subject", "value": "Inspectors General"}, {"rank": "7", "name": "organizations", "value": "Securities and Exchange Commission"}], "lead_paragraph": "The Securities and Exchange Commission's fight for more money, an effort opposed by many Republican lawmakers, has met a new obstacle: the regulator's own questionable spending.", "pub_date": "2011-07-07T17:19:20Z"}
