{"headline": "A Petri Dish of Activism, and Germs", "keywords": [{"value": "New York City", "is_major": "N", "rank": "5", "name": "glocations"}, {"value": "Demonstrations, Protests, and Riots", "is_major": "N", "rank": "1", "name": "subject"}, {"value": "Zuccotti Park (NYC)", "is_major": "N", "rank": "3", "name": "glocations"}, {"value": "Occupy Wall Street", "is_major": "Y", "rank": "2", "name": "organizations"}, {"value": "Medicine and Health", "is_major": "Y", "rank": "4", "name": "subject"}], "lead_paragraph": "Volunteers at a medical tent and on a sanitation team are trying to combat the conditions at Zuccotti Park, which have left Occupy Wall Street demonstrators susceptible to viruses.", "pub_date": "2011-11-11T00:00:00Z"}
{"headline": "New to City, Statue Seeks Resting Place", "keywords": [{"value": "Zuccotti Park (Manhattan, NY)", "is_major": "Y", "rank": "11", "name": "glocations"}, {"value": "Veterans Day (US)", "is_major": "N", "rank": "12", "name": "subject"}, {"value": "Monuments and Memorials", "is_major": "N", "rank": "5", "name": "subject"}, {"value": "Sculpture", "is_major": "N", "rank": "1", "name": "subject"}, {"value": "Occupy Wall Street", "is_major": "N", "rank": "8", "name": "organizations"}, {"value": "Afghanistan War (2001- )", "is_major": "Y", "rank": "6", "name": "subject"}, {"value": "Art", "is_major": "Y", "rank": "7", "name": "subject"}, {"value": "Veterans", "is_major": "N", "rank": "3", "name": "subject"}, {"value": "World Financial Center", "is_major": "N", "rank": "2", "name": "organizations"}, {"value": "Monuments and Memorials (Structures)", "is_major": "Y", "rank": "10", "name": "subject"}, {"value": "Manhattan (NYC)", "is_major": "N", "rank": "4", "name": "glocations"}], "lead_paragraph": "After a sculpture makes its public debut in the Veterans Day Parade, it will head to a temporary home a block from the World Trade Center site.", "pub_date": "2011-11-11T00:00:00Z"}
{"headline": "Vermont: Suicide at &#8216;Occupy&#8217; Camp", "keywords": [{"value": "Occupy Wall Street", "is_major": "Y", "rank": "2", "name": "organizations"}, {"value": "Oakland (Calif)", "is_major": "N", "rank": "1", "name": "glocations"}, {"value": "Suicides and Suicide Attempts", "is_major": "N", "rank": "3", "name": "subject"}], "lead_paragraph": "A 35-year-old military veteran apparently shot himself Thursday at an Occupy Wall Street encampment in Burlington, fellow protesters said.", "pub_date": "2011-11-11T00:00:00Z"}
{"headline": "Time and Again, Big Multiples Fall", "keywords": [{"value": "Stocks and Bonds", "is_major": "N", "rank": "1", "name": "subject"}, {"value": "Sotheby's", "is_major": "N", "rank": "3", "name": "organizations"}, {"value": "Green Mountain Coffee Roasters Inc", "is_major": "Y", "rank": "2", "name": "organizations"}, {"value": "Art", "is_major": "Y", "rank": "4", "name": "subject"}], "lead_paragraph": "Green Mountain Coffee Roasters\u2019s shares are the latest to crash from a nose-bleed trading multiple after the company grew less than analysts expected.", "pub_date": "2011-11-11T00:00:00Z"}
{"headline": "Thanksgiving As Day to Shop Meets Rejection", "keywords": [{"name": "subject", "value": "THANKSGIVING DAY"}, {"name": "subject", "value": "SHOPPING AND RETAIL"}, {"name": "subject", "value": "BLACK FRIDAY (SHOPPING)"}, {"name": "subject", "value": "LABOR AND JOBS"}], "lead_paragraph": "For the first time in years, Michelle Nyberg probably will not be standing in line when stores open for their Black Friday sales. She still loves a good deal -- last year she spent a couple of thousand dollars on markdowns that day, the Friday after Thanksgiving -- but Ms. Nyberg says that she does not want retailers to ruin the holiday for her or their own employees.", "pub_date": "2011-11-11T00:00:00Z"}
{"headline": "A Petri Dish Of Activism, And Germs", "keywords": [{"name": "glocations", "value": "NEW YORK CITY"}, {"name": "glocations", "value": "ZUCCOTTI PARK (NYC)"}, {"name": "organizations", "value": "OCCUPY WALL STREET"}, {"name": "subject", "value": "MEDICINE AND HEALTH"}, {"name": "subject", "value": "DEMONSTRATIONS, PROTESTS, AND RIOTS"}], "lead_paragraph": "The chorus began quietly at a recent strategy session inside Zuccotti Park, with a single cough from a security team member, a muffled hack between puffs on his cigarette. Then a colleague followed. Then another. Soon the discussion had devolved into a fit of wheezing, with one protester blowing his nose into the mulch between clusters of tents.", "pub_date": "2011-11-11T00:00:00Z"}
{"headline": "Time and Again, Big Multiples Fall", "keywords": [{"name": "organizations", "value": "GREEN MOUNTAIN COFFEE ROASTERS INC"}, {"name": "organizations", "value": "SOTHEBY'S"}, {"name": "subject", "value": "STOCKS AND BONDS"}, {"name": "subject", "value": "ART"}], "lead_paragraph": "Green Mountain Coffee Roasters just showed how momentum works both ways in the stock market. Its shares are the latest to crash from a nose-bleed trading multiple after the company grew less than analysts expected. Green Mountain joins the former investor darlings Netflix and OpenTable, each of which traded well over 50 times estimated earnings this summer before losing over half its market capitalization. Fast growth can help paper over valuation or accounting worries, but in time they usually catch up.", "pub_date": "2011-11-11T00:00:00Z"}
{"headline": "The Listings", "keywords": [{"name": "organizations", "value": "ROSE THEATER"}, {"name": "organizations", "value": "MERKIN CONCERT HALL"}, {"name": "organizations", "value": "METROPOLITAN OPERA"}, {"name": "organizations", "value": "MILLER THEATER AT COLUMBIA UNIVERSITY"}], "lead_paragraph": "Classical Full reviews of recent classical performances: nytimes.com/classical.", "pub_date": "2011-11-11T00:00:00Z"}
{"headline": "New to City, Statue Seeks Resting Place", "keywords": [{"name": "glocations", "value": "MANHATTAN (NYC)"}, {"name": "organizations", "value": "WORLD FINANCIAL CENTER"}, {"name": "subject", "value": "SCULPTURE"}, {"name": "subject", "value": "AFGHANISTAN WAR (2001- )"}, {"name": "subject", "value": "MONUMENTS AND MEMORIALS"}, {"name": "subject", "value": "VETERANS"}], "lead_paragraph": "One of the guest stars in the Veterans Day Parade on Friday is a 5,000-pound statue that just arrived in New York and still needs a permanent home. The statue, a 16-foot-tall bronze of a Special Forces soldier on horseback, may wind up in Zuccotti Park in Lower Manhattan once the protesters camped there depart. But for now, it is bound for a temporary spot in a building a block from the World Trade Center site.", "pub_date": "2011-11-11T00:00:00Z"}
{"headline": "Poster Boy", "keywords": [{"rank": "1", "name": "type_of_material", "value": "News"}], "lead_paragraph": "Shepard Fairey, the influential street artist who last month designed an invitation for an Occupy Wall Street party in Times Square, is once again unfurling the income equality banner, this time to raise money for the homeless. The Robert Rauschenberg Foundation selected Fairey to inaugurate its Artist as Activist series; 100 signed prints of the new Fairey poster, \"The Future is Unwritten,\" will be available for purchase later today at artnet.com/auctions, starting at $1,250. Almost all of the proceeds benefit the nonprofit organization Coalition for the Homeless, which provides soup kitchens and job training for destitute New Yorkers. Fairey said that his poster references Depression-era styles like Art Deco, and that its title comes from Joe Strummer of the Clash, whom he called \"a dedicated advocate for the working class.\"", "pub_date": "2011-11-11T09:00:59Z"}
{"headline": "Mayor Calls for Occupy Oakland Protesters to Clear Camp 'Voluntarily' After Shooting", "keywords": [{"rank": "4", "name": "glocations", "value": "Oakland (Calif)"}, {"rank": "3", "name": "organizations", "value": "Occupy Wall Street"}, {"rank": "2", "name": "persons", "value": "Quan, Jean"}, {"rank": "1", "name": "type_of_material", "value": "News"}], "lead_paragraph": "Updated | 7:09 p.m. After a fatal shooting near the Occupy Oakland encampment in California on Thursday night, Mayor Jean Quan called for an end to the protest. Hours after the shooting, the mayor said at a news conference, \"I'm calling on the campers to please leave voluntarily tonight.\"", "pub_date": "2011-11-11T09:57:51Z"}
{"headline": "Teaching the Penn State Scandal", "keywords": [{"rank": "4", "name": "organizations", "value": "Pennsylvania State University"}, {"rank": "3", "name": "subject", "value": "Sex Crimes"}, {"rank": "2", "name": "persons", "value": "Paterno, Joe"}, {"rank": "1", "name": "type_of_material", "value": "News"}], "lead_paragraph": "November 16 | Updated", "pub_date": "2011-11-11T14:42:03Z"}
{"headline": "#OccupyWallSt Roundup, Day 56", "keywords": [{"rank": "4", "name": "organizations", "value": "Occupy Wall Street"}, {"rank": "3", "name": "subject", "value": "Demonstrations, Protests, and Riots"}, {"rank": "2", "name": "persons", "value": "Baez, Joan"}, {"rank": "5", "name": "glocations", "value": "New York City"}, {"rank": "1", "name": "type_of_material", "value": "News"}, {"rank": "6", "name": "glocations", "value": "Zuccotti Park (NYC)"}], "lead_paragraph": "Although many veterans have joined Occupy Wall Street, some believe the 99 percent\u00a0 are \"blissfully unaware of the daily triumphs and tragedies\" of those serving abroad in the military. [Washington Post]", "pub_date": "2011-11-11T16:09:05Z"}
{"headline": "For Joan Baez, Another Protest", "keywords": [{"rank": "4", "name": "subject", "value": "Music"}, {"rank": "3", "name": "subject", "value": "Demonstrations, Protests, and Riots"}, {"rank": "2", "name": "persons", "value": "Baez, Joan"}, {"rank": "5", "name": "subject", "value": "Veterans"}, {"rank": "1", "name": "type_of_material", "value": "News"}, {"rank": "6", "name": "organizations", "value": "Occupy Wall Street"}], "lead_paragraph": "After Occupy Wall Street protesters received permission from the city to hold a Veterans Day concert in Foley Square, not far from Zuccotti Park, the organizer of the event, Aaron Black, had to improvise in finding an area to serve as a green room, where musicians could stay warm before performing.", "pub_date": "2011-11-11T16:51:10Z"}
{"headline": "DealBook's Week in Review", "keywords": [{"rank": "1", "name": "type_of_material", "value": "News"}], "lead_paragraph": "A look back on our reporting of the past week's highs and lows in finance.", "pub_date": "2011-11-11T18:01:01Z"}
{"headline": "Podcast: Europe, Pensions, Wealth and Phone Bills", "keywords": [{"rank": "4", "name": "subject", "value": "Income Inequality"}, {"rank": "10", "name": "glocations", "value": "Saranac Lake (NY)"}, {"rank": "3", "name": "subject", "value": "Federal Budget (US)"}, {"rank": "2", "name": "subject", "value": "European Sovereign Debt Crisis (2010- )"}, {"rank": "5", "name": "subject", "value": "Pensions and Retirement Plans"}, {"rank": "1", "name": "type_of_material", "value": "News"}, {"rank": "6", "name": "subject", "value": "Prices (Fares, Fees and Rates)"}, {"rank": "7", "name": "subject", "value": "Shopping and Retail"}, {"rank": "8", "name": "subject", "value": "Telephones and Telecommunications"}, {"rank": "9", "name": "organizations", "value": "Occupy Wall Street"}], "lead_paragraph": "For much of the past week, financial markets have fretted more about Italy than about Greece, which had been the main focus of worries for many weeks.", "pub_date": "2011-11-11T20:15:37Z"}
{"headline": "At &#8216;Occupy&#8217; Protests, Bearing Christian Witness Without Preaching", "keywords": [{"value": "Religion and Belief", "is_major": "N", "rank": "1", "name": "subject"}, {"value": "Christians and Christianity", "is_major": "Y", "rank": "3", "name": "subject"}, {"value": "Occupy Wall Street", "is_major": "Y", "rank": "2", "name": "organizations"}], "lead_paragraph": "When liberal activists hear \u201cChristian,\u201d they often think \u201cconservative.\u201d So committed Christians at Occupy Wall Street events have different answers to the question, \u201cHow Christian should we seem?\u201d", "pub_date": "2011-11-12T00:00:00Z"}
{"headline": "Rich Subsidies Powering Solar and Wind Projects", "keywords": [{"name": "organizations", "value": "NRG ENERGY INC"}, {"name": "subject", "value": "AMERICAN RECOVERY AND REINVESTMENT ACT (2009)"}, {"name": "subject", "value": "SOLAR ENERGY"}, {"name": "subject", "value": "ALTERNATIVE AND RENEWABLE ENERGY"}, {"name": "subject", "value": "WIND POWER"}, {"name": "subject", "value": "FEDERAL AID (US)"}], "lead_paragraph": "WASHINGTON -- Halfway between Los Angeles and San Francisco, on a former cattle ranch and gypsum mine, NRG Energy is building an engineering marvel: a compound of nearly a million solar panels that will produce enough electricity to power about 100,000 homes. The project is also a marvel in another, less obvious way: Taxpayers and ratepayers are providing subsidies worth almost as much as the entire $1.6 billion cost of the project. Similar subsidy packages have been given to 15 other solar- and wind-power electric plants since 2009.", "pub_date": "2011-11-12T00:00:00Z"}
{"headline": "At 'Occupy' Protests, Bearing Christian Witness Without Preaching", "keywords": [], "lead_paragraph": "The old leftist dream was for everyone to abandon regional and ethnic allegiances to play for a common team, the working class. But as anyone attending a demonstration knows, many activists demand to be counted as representatives of smaller groups: home teams. At Occupy Wall Street and the allied events, there are police officers in the symbolic 99 percent, wearing uniforms. There are self-proclaimed mothers in the 99 percent. There are Marines. There are Muslims and Jews, yoginis and puppeteers. Sometimes they proclaim their tribes on signs in protest-movement Magic Marker; other times their meaningful headgear speaks loud enough: firefighter's hat, bus driver's cap, yarmulke.", "pub_date": "2011-11-12T00:00:00Z"}
{"headline": "An Elder Maestro Shows Students How to Be Strident", "keywords": [{"value": "Classical Music", "is_major": "N", "rank": "1", "name": "subject"}, {"value": "Opera", "is_major": "Y", "rank": "3", "name": "subject"}, {"value": "Davies, Peter Maxwell", "is_major": "Y", "rank": "2", "name": "persons"}, {"value": "Royal Academy of Music", "is_major": "N", "rank": "4", "name": "organizations"}], "lead_paragraph": "The new opera \u201cKommilitonen! (Young Blood!)\u201d by Peter Maxwell Davies, to be presented by Juilliard this week, was written about and for students.", "pub_date": "2011-11-13T00:00:00Z"}
{"headline": "Spotlight Fixed on Geithner, a Man Obama Fought to Keep", "keywords": [{"value": "European Sovereign Debt Crisis (2010- )", "is_major": "N", "rank": "5", "name": "subject"}, {"value": "Geithner, Timothy F", "is_major": "Y", "rank": "1", "name": "persons"}, {"value": "United States Economy", "is_major": "Y", "rank": "3", "name": "subject"}, {"value": "Obama, Barack", "is_major": "N", "rank": "2", "name": "persons"}, {"value": "United States Politics and Government", "is_major": "N", "rank": "4", "name": "subject"}], "lead_paragraph": "For President Obama, Treasury Secretary Timothy F. Geithner has been the indispensable economic adviser who has outlasted every other member of the original inner circle.", "pub_date": "2011-11-13T00:00:00Z"}
{"headline": "Show of Hands, Please: Who Can Buy Art?", "keywords": [{"name": "subject", "value": "COLLECTORS AND COLLECTIONS"}, {"name": "subject", "value": "PHILANTHROPY"}, {"name": "subject", "value": "FINANCES"}, {"name": "subject", "value": "AUCTIONS"}, {"name": "subject", "value": "PRICES (FARES, FEES AND RATES)"}, {"name": "subject", "value": "PARTIES (SOCIAL)"}, {"name": "subject", "value": "ECONOMIC CONDITIONS AND TRENDS"}, {"name": "subject", "value": "ART"}], "lead_paragraph": "THE artist Cindy Sherman stood underneath ''Bangkok II,'' a new large-scale photograph by Andreas Gursky that was being unveiled Nov. 4 at the fortress-like Gagosian Gallery in Chelsea. Ms. Sherman stared in amusement as Mr. Gursky and Klaus Biesenbach, the MoMA P.S. 1 director, fawned over her sequined Marni handbag. ''Oooh, nice,'' cooed Larry Gagosian, the super gallerist. ''Are you coming by later?'' Mr. Gagosian was circling shark-like amid the well-coiffed art patrons, recruiting for a private dinner he was holding later at his Upper East Side house. ''Make sure they know how to get there,'' he yelled across the room to a blond woman in black.", "pub_date": "2011-11-13T00:00:00Z"}
{"headline": "Who Is Occupy Wall Street?", "keywords": [{"name": "persons", "value": "FIEDLER, TOM"}, {"name": "persons", "value": "ABRAMSON, JILL"}, {"name": "organizations", "value": "OCCUPY WALL STREET"}, {"name": "organizations", "value": "NEW YORK TIMES"}, {"name": "subject", "value": "PUBLIC EDITOR (TIMES COLUMN)"}, {"name": "subject", "value": "NEWS AND NEWS MEDIA"}, {"name": "subject", "value": "DEMONSTRATIONS, PROTESTS, AND RIOTS"}], "lead_paragraph": "OCCUPY WALL STREET has proved to be a difficult, sprawling story to report. Almost immediately after protesters began arriving at Zuccotti Park in downtown New York on Sept. 17, Times readers weighed in with concerns about the coverage. Too little, some said, and soon added: too late. Condescending, said others, as Times writers delivered analytical columns and articles questioning the protests' absence of demands, of leaders, of a clear path ahead. Other readers pronounced a different line: The Times was giving too much and too favorable treatment to hodgepodge encampments that were disrupting New York and the other cities in the United States and abroad where the protests had spread.", "pub_date": "2011-11-13T00:00:00Z"}
{"headline": "Poster Boy", "keywords": [{"name": "persons", "value": "FAIREY, SHEPARD"}, {"name": "organizations", "value": "COALITION FOR THE HOMELESS"}, {"name": "subject", "value": "PHILANTHROPY"}, {"name": "subject", "value": "ART"}], "lead_paragraph": "SHEPARD FAIREY, the influential street artist who last month designed an invitation for an Occupy Wall Street party in Times Square, is once again unfurling the income equality banner, this time to raise money for the homeless. The Robert Rauschenberg Foundation selected Mr. Fairey to inaugurate its Artist as Activist series; 100 signed prints of the new Fairey poster, ''The Future Is Unwritten,'' are available for purchase at artnet.com/auctions, starting at $1,250. Almost all the proceeds benefit the nonprofit organization Coalition for the Homeless, which provides soup kitchens and job training for destitute New Yorkers. Mr. Fairey said that his poster references Depression-era styles like Art Deco, and that its title comes from Joe Strummer of the Clash, whom he called ''a dedicated advocate for the working class.'' STEPHEN HEYMAN", "pub_date": "2011-11-13T00:00:00Z"}
{"headline": "Data-Crunching Mayor Now Sees Power in Words", "keywords": [{"name": "persons", "value": "BLOOMBERG, MICHAEL R"}, {"name": "glocations", "value": "NEW YORK CITY"}, {"name": "subject", "value": "SPEECHES AND STATEMENTS"}, {"name": "subject", "value": "POLITICS AND GOVERNMENT"}, {"name": "subject", "value": "PUBLIC SPEAKING"}], "lead_paragraph": "MAYOR MICHAEL R. BLOOMBERG is not, by his own admission, much of a wordsmith. He is forever mispronouncing names -- even those of his own commissioners. He is impatient with speechwriters. And he rarely, if ever, practices his remarks. ''His mentality,'' concedes his top speechwriter, Francis S. Barry, ''is not one of rehearsal.''", "pub_date": "2011-11-13T00:00:00Z"}
{"headline": "Buying Underwear, Along With the Whole Store", "keywords": [{"name": "glocations", "value": "SARANAC LAKE (NY)"}, {"name": "organizations", "value": "WAL-MART STORES INC"}, {"name": "organizations", "value": "SARANAC LAKE COMMUNITY STORE"}, {"name": "subject", "value": "SHOPPING AND RETAIL"}], "lead_paragraph": "SARANAC LAKE, N.Y. THE residents of Saranac Lake, a picturesque town in the Adirondacks, are a hardy lot -- they have to be to withstand winter temperatures that can drop to 30 below zero. But since the local Ames department store went out of business in 2002 -- a victim of its corporate parent's bankruptcy -- residents have had to drive to Plattsburgh, 50 miles away, to buy basics like underwear or bed linens. And that was simply too much.", "pub_date": "2011-11-13T00:00:00Z"}
{"headline": "Spotlight Fixed on Geithner, A Man Obama Fought to Keep", "keywords": [{"name": "persons", "value": "OBAMA, BARACK"}, {"name": "persons", "value": "GEITHNER, TIMOTHY F"}, {"name": "subject", "value": "UNITED STATES POLITICS AND GOVERNMENT"}, {"name": "subject", "value": "UNITED STATES ECONOMY"}, {"name": "subject", "value": "EUROPEAN SOVEREIGN DEBT CRISIS (2010- )"}], "lead_paragraph": "WASHINGTON -- As friends, donors, cabinet members and celebrities like Tom Hanks, Jay-Z and Stevie Wonder partied at the White House one evening last August to celebrate President Obama's 50th birthday, the president tapped a lesser-known guest on the shoulder. ''Take a walk with me,'' he said to Carole Sonnenfeld Geithner, within earshot of others.", "pub_date": "2011-11-13T00:00:00Z"}
{"headline": "Police in Denver Move on Protesters", "keywords": [{"name": "glocations", "value": "DENVER (COLO)"}, {"name": "organizations", "value": "OCCUPY WALL STREET"}, {"name": "subject", "value": "POLICE"}, {"name": "subject", "value": "DEMONSTRATIONS, PROTESTS, AND RIOTS"}], "lead_paragraph": "DENVER -- The Denver police cleared a protest encampment allied with the Occupy Wall Street movement in a downtown square Saturday evening. Sixteen people were arrested, according to the police. ''We warned the individuals about blocking right of way and setting up tents,'' said a police spokesman, Sonny Jackson. ''We asked them to take some of the items down, and they refused.''", "pub_date": "2011-11-13T00:00:00Z"}
{"headline": "Will This Election Be the Mormon Breakthrough?", "keywords": [{"name": "persons", "value": "OBAMA, BARACK"}, {"name": "persons", "value": "PERRY, RICK"}, {"name": "persons", "value": "SMITH, JOSEPH"}, {"name": "persons", "value": "ROMNEY, MITT"}, {"name": "subject", "value": "MORMONS (CHURCH OF JESUS CHRIST OF LATTER-DAY SAINTS)"}, {"name": "subject", "value": "RELIGION AND BELIEF"}, {"name": "subject", "value": "UNITED STATES POLITICS AND GOVERNMENT"}, {"name": "subject", "value": "PRESIDENTIAL ELECTION OF 2012"}], "lead_paragraph": "THIS fall, we behold omens that will darken a year hence in the final phase of President Obama's campaign for a second term. His likely opponent, the Mormon Mitt Romney, will be a pioneer figure whatever the outcome, since no previous member of that very American church, the Church of Jesus Christ of Latter-day Saints, has ever secured a major-party nomination. Even should Mr. Obama triumph, a crucial precedent will have been established. Mr. Romney, earnest and staid, who is deep within the labyrinthine Mormon hierarchy, is directly descended from an early follower of the founding prophet Joseph Smith, whose highly original revelation was as much a departure from historical Christianity as Islam was and is. But then, so in fact are most manifestations of what is now called religion in the United States, including the Southern Baptist Convention, the Assemblies of God Pentecostalists and even our mainline Protestant denominations.", "pub_date": "2011-11-13T00:00:00Z"}
{"headline": "An Elder Maestro Shows Students How to Be Strident", "keywords": [{"name": "creative_works", "value": "KOMMILITONEN! (YOUNG BLOOD!) (OPERA)"}, {"name": "creative_works", "value": "KOMMILITONEN] (YOUNG BLOOD]) (OPERA)"}, {"name": "persons", "value": "DAVIES, PETER MAXWELL"}, {"name": "organizations", "value": "ROYAL ACADEMY OF MUSIC"}, {"name": "subject", "value": "CLASSICAL MUSIC"}, {"name": "subject", "value": "OPERA"}], "lead_paragraph": "LONDON WHEN a new opera written specifically for student singers opened at the Royal Academy of Music here in March, many in the audience feared the worst.", "pub_date": "2011-11-13T00:00:00Z"}
{"headline": "Nuns Who Won't Stop Nudging", "keywords": [{"name": "persons", "value": "BLANKFEIN, LLOYD C"}, {"name": "glocations", "value": "PHILADELPHIA (PA)"}, {"name": "organizations", "value": "ROMAN CATHOLIC CHURCH"}, {"name": "organizations", "value": "INTERFAITH CENTER ON CORPORATE RESPONSIBILITY"}, {"name": "organizations", "value": "SISTERS OF ST FRANCIS OF PHILADELPHIA"}, {"name": "organizations", "value": "GOLDMAN SACHS GROUP INC"}, {"name": "subject", "value": "BOARDS OF DIRECTORS"}, {"name": "subject", "value": "NUNS"}], "lead_paragraph": "ASTON, Pa. NOT long ago, an unusual visitor arrived at the sleek headquarters of Goldman Sachs in Lower Manhattan.", "pub_date": "2011-11-13T00:00:00Z"}
{"headline": "Occupy Oakland and News Media Coexist Uneasily", "keywords": [{"name": "glocations", "value": "OAKLAND (CALIF)"}, {"name": "organizations", "value": "OCCUPY WALL STREET"}, {"name": "subject", "value": "NEWS AND NEWS MEDIA"}, {"name": "subject", "value": "DEMONSTRATIONS, PROTESTS, AND RIOTS"}], "lead_paragraph": "Immediately after a man was shot to death Thursday afternoon near the Occupy Oakland encampment, Randy Davis, a cameraman for KGO-TV, turned his lens on a group of protesters helping the victim. Then part of the crowd turned on him. Protesters formed a chain around the victim. About a dozen men -- some shouting, ''No cameras!'' and ''No media!'' -- punched Mr. Davis in the head and pushed him to the ledge overlooking a BART station stairwell before other protesters intervened, witnesses said.", "pub_date": "2011-11-13T00:00:00Z"}
