{"headline": "A Good Approach on Wall Street", "keywords": [{"name": "persons", "value": "BLOOMBERG, MICHAEL R"}, {"name": "glocations", "value": "ZUCCOTTI PARK (NYC)"}, {"name": "organizations", "value": "OCCUPY WALL STREET"}, {"name": "organizations", "value": "BROOKFIELD PROPERTIES CORPORATION"}, {"name": "subject", "value": "EDITORIALS"}, {"name": "subject", "value": "NOISE"}, {"name": "subject", "value": "LOCAL GOVERNMENT"}, {"name": "subject", "value": "DEMONSTRATIONS, PROTESTS, AND RIOTS"}], "lead_paragraph": "After more than a month of the Occupy Wall Street encampment at Zuccotti Park, the complaints are mounting. Mayor Michael Bloomberg, perhaps reflecting the irritation of his former colleagues on Wall Street, has said ''the Constitution doesn't protect tents. It protects speech and assembly.'' And he suggested last week that the city would start enforcing city rules on marches by the protesters unless they have the required permits. Fortunately, the people most inconvenienced by the encampment, its neighbors, have a more sensible response. Community Board 1, which represents residents and businesses in Lower Manhattan, is expected to vote Tuesday evening on a resolution that endorses the right to protest and opposes ''the use of excessive and unnecessary force by the City of New York'' or the owners of the park, Brookfield Properties. (The resolution also endorses the extension of the ''millionaire's tax'' in New York State to soften cuts to education and other services.)", "pub_date": "2011-10-25T00:00:00Z"}
{"headline": "Vatican Calls for Oversight Of the World's Finances", "keywords": [{"name": "persons", "value": "BENEDICT XVI"}, {"name": "organizations", "value": "ROMAN CATHOLIC CHURCH"}, {"name": "subject", "value": "ECONOMIC CONDITIONS AND TRENDS"}], "lead_paragraph": "VATICAN CITY -- The Vatican called on Monday for an overhaul of the world's financial systems, and again proposed establishment of a supranational authority to oversee the global economy, calling it necessary to bring more democratic and ethical principles to a marketplace run amok. In a report issued by the Pontifical Council for Justice and Peace, the Vatican argued that ''politics -- which is responsible for the common good'' must be given primacy over the economy and finance, and that existing institutions like the International Monetary Fund had not been responding adequately to global economic problems.", "pub_date": "2011-10-25T00:00:00Z"}
{"headline": "A Juggernaut Stumbles", "keywords": [{"name": "persons", "value": "HASTINGS, REED"}, {"name": "organizations", "value": "NETFLIX INC"}, {"name": "organizations", "value": "QWIKSTER"}, {"name": "subject", "value": "CUSTOMER RELATIONS"}, {"name": "subject", "value": "COMPANY REPORTS"}], "lead_paragraph": "Reed Hastings was soaking in a hot tub with a friend last month when he shared a secret: his company, Netflix, was about to announce a plan to divide its movie rental service into two -- one offering streaming movies over the Internet, the other offering old-fashioned DVDs in the mail. ''That is awful,'' the friend, who was also a Netflix subscriber, told him under a starry sky in the Bay Area, according to Mr. Hastings. ''I don't want to deal with two accounts.''", "pub_date": "2011-10-25T00:00:00Z"}
{"headline": "Protesters Briefly Take Over a Gallery", "keywords": [{"name": "glocations", "value": "SOHO (NYC)"}, {"name": "organizations", "value": "OCCUPY WALL STREET"}, {"name": "organizations", "value": "ARTISTS SPACE"}, {"name": "subject", "value": "ART"}, {"name": "subject", "value": "DEMONSTRATIONS, PROTESTS, AND RIOTS"}], "lead_paragraph": "The boundaries of Occupy Wall Street expanded beyond Zuccotti Park over the weekend, as a splinter group briefly took over an art gallery in SoHo. On Saturday, during a talk about conceptual art at the gallery, Georgia Sagri, a Greek artist, suddenly rose and shouted out, ''This is an occupation,'' witnesses said. About a dozen other people joined Ms. Sagri in declaring the gallery, Artists Space, an autonomous zone. They handed out fliers and taped pieces of pink paper to a wall headed ''Rules of the Space.''", "pub_date": "2011-10-25T00:00:00Z"}
{"headline": "Occupy Wall Street Meets Tahrir Square", "keywords": [{"rank": "11", "name": "organizations", "value": "Occupy Wall Street"}, {"rank": "4", "name": "persons", "value": "Said, Khaled"}, {"rank": "10", "name": "subject", "value": "Politics and Government"}, {"rank": "3", "name": "persons", "value": "Mubarak, Hosni"}, {"rank": "2", "name": "persons", "value": "Geller, Pamela"}, {"rank": "5", "name": "subject", "value": "Demonstrations, Protests, and Riots"}, {"rank": "15", "name": "glocations", "value": "Zuccotti Park (NYC)"}, {"rank": "1", "name": "type_of_material", "value": "News"}, {"rank": "6", "name": "subject", "value": "Egyptian-Americans"}, {"rank": "14", "name": "glocations", "value": "Tahrir Square (Cairo)"}, {"rank": "7", "name": "subject", "value": "Middle East and North Africa Unrest (2010- )"}, {"rank": "13", "name": "glocations", "value": "Egypt"}, {"rank": "8", "name": "subject", "value": "Muslim-Americans"}, {"rank": "9", "name": "subject", "value": "Muslims and Islam"}, {"rank": "12", "name": "organizations", "value": "Park51"}], "lead_paragraph": "Occupy Wall Street has been good business for Ehab Sami, who dishes up crisp falafel topped with tender fried eggplant from his cart outside Zuccotti Park.", "pub_date": "2011-10-25T07:15:16Z"}
{"headline": "Awhile and a While", "keywords": [{"rank": "1", "name": "type_of_material", "value": "News"}], "lead_paragraph": "Notes from the newsroom on grammar, usage and style. (Some frequently asked questions are here.)", "pub_date": "2011-10-25T08:00:24Z"}
{"headline": "Credit, Blame and a Heaping Cup of Coincidence", "keywords": [{"rank": "4", "name": "organizations", "value": "Occupy Wall Street"}, {"rank": "3", "name": "subject", "value": "Standard & Poor's 500-Stock Index"}, {"rank": "2", "name": "subject", "value": "Demonstrations, Protests, and Riots"}, {"rank": "5", "name": "glocations", "value": "New York City"}, {"rank": "1", "name": "type_of_material", "value": "News"}], "lead_paragraph": "As an old Roman might have said, post hoc ergo propter hoc.", "pub_date": "2011-10-25T08:38:04Z"}
{"headline": "10 Questions for Rick Perry", "keywords": [{"rank": "4", "name": "subject", "value": "Presidential Election of 2012"}, {"rank": "3", "name": "persons", "value": "Perry, Rick"}, {"rank": "2", "name": "persons", "value": "Harwood, John"}, {"rank": "1", "name": "type_of_material", "value": "News"}], "lead_paragraph": "Gov. Rick Perry of Texas is seeking to jump-start his Republican presidential campaign by proposing a new tax system: a 20 percent flat rate on individual and corporate income, down from the current 35 percent top rate, and elimination of existing taxes on estates, capital gains and dividends. He sat down with John Harwood of The Times and CNBC to discuss the plan, his challenge to a Republican rival, Mitt Romney, and other issues. What follows is a condensed, edited transcript of their conversation.", "pub_date": "2011-10-25T09:20:25Z"}
{"headline": "Say Anything", "keywords": [{"rank": "1", "name": "type_of_material", "value": "News"}], "lead_paragraph": "Over the last couple of days, I've been getting mail accusing me of consorting with Nazis. My immediate reaction was, what the heck? Then it clicked: the right wing is mounting a full-court press to portray Occupy Wall Street as an anti-Semitic movement, based, as far as I can tell, on one guy with a sign.", "pub_date": "2011-10-25T12:55:13Z"}
{"headline": "#OccupyWallSt Roundup, Day 39", "keywords": [{"rank": "1", "name": "type_of_material", "value": "News"}, {"rank": "2", "name": "organizations", "value": "Occupy Wall Street"}], "lead_paragraph": "A Pew survey found that 39 percent of Americans support Occupy Wall Street, slightly higher than the number who oppose it, and that a higher number - 44 percent - oppose the Tea Party. [Pew Research Center]", "pub_date": "2011-10-25T14:56:41Z"}
{"headline": "Banks May Be Target of Their Own Tactic: Advocating a Breakup", "keywords": [{"rank": "3", "name": "subject", "value": "Mergers, Acquisitions and Divestitures"}, {"rank": "2", "name": "subject", "value": "Banking and Financial Institutions"}, {"rank": "1", "name": "type_of_material", "value": "News"}], "lead_paragraph": "Perhaps it is not Occupy Wall Street that the banks should fear, but their latest frothy financial product. Investment bankers are crisscrossing the nation peddling spinoffs. But given the weak stock prices of these banks, they may find themselves under the same pressure to split up from their own investors.", "pub_date": "2011-10-25T18:09:26Z"}
{"headline": "1 Arrested in Zuccotti Park Death Threat", "keywords": [{"rank": "1", "name": "type_of_material", "value": "News"}, {"rank": "3", "name": "glocations", "value": "Zuccotti Park (NYC)"}, {"rank": "2", "name": "organizations", "value": "Occupy Wall Street"}], "lead_paragraph": "2:20 a.m. | Updated Two days after a man accused of assaulting three female protesters in Zuccotti Park was arrested, some friends of his threatened to kill the woman who had filed the complaint that led to the arrest, the police said on Tuesday.", "pub_date": "2011-10-25T19:06:35Z"}
{"headline": "California: Police Officers Break Up Protest", "keywords": [{"value": "Occupy Wall Street", "is_major": "Y", "rank": "1", "name": "organizations"}, {"value": "Demonstrations, Protests, and Riots", "is_major": "N", "rank": "3", "name": "subject"}, {"value": "Police", "is_major": "N", "rank": "2", "name": "subject"}, {"value": "Oakland (Calif)", "is_major": "Y", "rank": "4", "name": "glocations"}], "lead_paragraph": "Police officers in riot gear cleared anti-Wall Street protesters from in front of Oakland City Hall on Tuesday, leaving a sea of overturned tents, protest signs and trash.", "pub_date": "2011-10-26T00:00:00Z"}
{"headline": "President to Ease Student Loan Burden for Low-Income Graduates", "keywords": [{"value": "Tuition", "is_major": "N", "rank": "5", "name": "subject"}, {"value": "Student Loans", "is_major": "Y", "rank": "1", "name": "subject"}, {"value": "Colleges and Universities", "is_major": "N", "rank": "6", "name": "subject"}, {"value": "College Board", "is_major": "N", "rank": "3", "name": "organizations"}, {"value": "Federal Aid (US)", "is_major": "N", "rank": "2", "name": "subject"}, {"value": "Obama, Barack", "is_major": "Y", "rank": "4", "name": "persons"}], "lead_paragraph": "An expansion of the income-based college-loan repayment program is expected on Wednesday, lowering monthly payments and allowing some loan consolidation.", "pub_date": "2011-10-26T00:00:00Z"}
{"headline": "As the Data Show, There\u2019s a Reason the Wall Street Protesters Chose New York", "keywords": [{"value": "New York City", "is_major": "Y", "rank": "5", "name": "glocations"}, {"value": "Income Inequality", "is_major": "Y", "rank": "1", "name": "subject"}, {"value": "High Net Worth Individuals", "is_major": "N", "rank": "7", "name": "subject"}, {"value": "Occupy Wall Street", "is_major": "Y", "rank": "3", "name": "organizations"}, {"value": "Recession and Depression", "is_major": "N", "rank": "2", "name": "subject"}, {"value": "Rockefeller, John D", "is_major": "N", "rank": "4", "name": "persons"}], "lead_paragraph": "With a significant portion of the wealthiest Americans based in New York, the divisions are clear.", "pub_date": "2011-10-26T00:00:00Z"}
{"headline": "TimesCast | October 26, 2011", "keywords": [{"value": "Thailand", "is_major": "N", "rank": "1", "name": "glocations"}, {"value": "Floods", "is_major": "N", "rank": "3", "name": "subject"}, {"value": "Unemployment", "is_major": "N", "rank": "7", "name": "subject"}, {"value": "Demonstrations, Protests, and Riots", "is_major": "N", "rank": "14", "name": "subject"}, {"value": "Providence", "is_major": "N", "rank": "8", "name": "unknown"}, {"value": "Atlanta", "is_major": "N", "rank": "5", "name": "unknown"}, {"value": "CBS Corp", "is_major": "N", "rank": "10", "name": "organizations"}, {"value": "Polls and Public Opinion", "is_major": "N", "rank": "13", "name": "subject"}, {"value": "Bangkok", "is_major": "N", "rank": "2", "name": "unknown"}, {"value": "Oakland", "is_major": "N", "rank": "6", "name": "unknown"}, {"value": "New York Times", "is_major": "N", "rank": "9", "name": "organizations"}, {"value": "Occupy Wall Street", "is_major": "N", "rank": "4", "name": "organizations"}, {"value": "Tear Gas", "is_major": "N", "rank": "15", "name": "subject"}, {"value": "United States Economy", "is_major": "N", "rank": "11", "name": "subject"}, {"value": "Obama, Barack", "is_major": "N", "rank": "12", "name": "persons"}], "lead_paragraph": "Occupy protests in Oakland, Calif., and Atlanta lead to crackdowns and arrests; severe flooding in Bangkok; and almost 90 percent of Americans do not trust the government to turn the economy around.", "pub_date": "2011-10-26T00:00:00Z"}
{"headline": "As the Data Show, There's a Reason the Protesters Chose New York", "keywords": [{"name": "persons", "value": "ROCKEFELLER, JOHN D"}, {"name": "glocations", "value": "NEW YORK CITY"}, {"name": "organizations", "value": "OCCUPY WALL STREET"}, {"name": "subject", "value": "RECESSION AND DEPRESSION"}, {"name": "subject", "value": "HIGH NET WORTH INDIVIDUALS"}, {"name": "subject", "value": "INCOME INEQUALITY"}], "lead_paragraph": "When the federal income tax was first imposed in 1913, the richest 0.1 percent of households reaped 8.6 percent of the nation's income. In 2007, as the recession began, the share going to that sliver of megarich Americans was 12.3 percent. And an even more exclusive club -- the top 0.01 percent of households -- is collecting a greater share of total income than ever before recorded.", "pub_date": "2011-10-26T00:00:00Z"}
{"headline": "Bankers May Be Target Of Their Own Tactic: Advocating a Breakup", "keywords": [], "lead_paragraph": "Perhaps it's not Occupy Wall Street that the banks should fear, but their latest frothy financial product. Investment bankers are crisscrossing the nation peddling spinoffs. But given the weak stock prices of these banks, they may find themselves under pressure from their own investors to break up. Spinoffs are the deal du jour. Abbott Laboratories became the latest on the bandwagon, announcing last week a spinoff of its research-based pharmaceutical business. This year, 59 spinoffs have been completed, totaling about $98 billion, according to Dealogic. The dollar number is up almost 85 percent from the same period last year and does not include planned splits by Sara Lee, McGraw-Hill and Kraft Foods, among others.", "pub_date": "2011-10-26T00:00:00Z"}
{"headline": "President to Ease Student Loan Burden for Low-Income Graduates", "keywords": [{"name": "persons", "value": "OBAMA, BARACK"}, {"name": "organizations", "value": "COLLEGE BOARD"}, {"name": "subject", "value": "STUDENT LOANS"}, {"name": "subject", "value": "TUITION"}, {"name": "subject", "value": "COLLEGES AND UNIVERSITIES"}, {"name": "subject", "value": "FEDERAL AID (US)"}], "lead_paragraph": "President Obama will announce new programs Wednesday to lower monthly loan payments for some students graduating next year and thereafter and to let borrowers who have a mix of direct federal loans and loans under the old Federal Family Education Loan Program consolidate them at a slightly lower interest rate. At a press briefing Tuesday afternoon, Melody Barnes, director of the Domestic Policy Council, said the president would use his executive authority to expand the existing income-based repayment program with a ''Pay as You Earn'' option that would allow graduates to pay 10 percent of their discretionary income for 20 years and have the rest of their federal student loan debt forgiven. That plan would start next year.", "pub_date": "2011-10-26T00:00:00Z"}
{"headline": "For Occupy Protesters and Police, Frustrations Mount", "keywords": [{"rank": "3", "is_major": "N", "value": "Police", "name": "subject"}, {"rank": "1", "is_major": "N", "value": "Occupy Wall Street", "name": "organizations"}, {"rank": "4", "is_major": "N", "value": "Oakland (Calif)", "name": "glocations"}, {"rank": "2", "is_major": "N", "value": "Demonstrations, Protests, and Riots", "name": "subject"}], "lead_paragraph": "After a confrontation in Oakland on Tuesday night, frustrations are mounting for both the Occupy demonstrators and law enforcement in cities around the country.", "pub_date": "2011-10-26T00:00:00Z"}
{"headline": "Crossing a Watershed, Unawares", "keywords": [{"name": "glocations", "value": "FAR EAST, SOUTH AND SOUTHEAST ASIA AND PACIFIC AREAS"}, {"name": "organizations", "value": "EUROPEAN UNION"}, {"name": "subject", "value": "BANKING AND FINANCIAL INSTITUTIONS"}], "lead_paragraph": "A watershed is, by Webster's definition, an aspect of physical geography: an area bounded by water parting and draining down a particular course. The water to the north of this divide runs in one direction, the water to the south of the divide runs the opposite way. But for centuries the term has also been used to describe a historical and political phenomenon: that is, when an array of existing human activities and circumstances pass, irrevocably, from one age to the next, across a great divide. At the time, very few contemporaries sense that they have entered a new era, unless of course the world is coming out of a cataclysmic war, like the Napoleonic wars or World War II. But such abrupt historical transformations are not the focus of this article. My interest is in the slow buildup of forces for change, mainly invisible, almost always unpredictable, that sooner or later will turn one age into another.", "pub_date": "2011-10-26T00:00:00Z"}
{"headline": "New Poll Finds a Deep Distrust of Government", "keywords": [{"name": "persons", "value": "OBAMA, BARACK"}, {"name": "organizations", "value": "OCCUPY WALL STREET"}, {"name": "subject", "value": "UNITED STATES POLITICS AND GOVERNMENT"}, {"name": "subject", "value": "UNITED STATES ECONOMY"}, {"name": "subject", "value": "PRESIDENTIAL ELECTION OF 2012"}, {"name": "subject", "value": "POLLS AND PUBLIC OPINION"}], "lead_paragraph": "With Election Day just over a year away, a deep sense of economic anxiety and doubt about the future hangs over the nation, according to the latest New York Times/CBS News poll, with Americans' distrust of government at its highest level ever. The combustible climate helps explain the volatility of the presidential race and has provided an opening for protest movements like Occupy Wall Street, to highlight grievances about banks, income inequality and a sense that the poor and middle class have been disenfranchised.", "pub_date": "2011-10-26T00:00:00Z"}
{"headline": "For Occupy Protesters and Police, Frustrations Mount", "keywords": [{"name": "subject", "value": "DEMONSTRATIONS, PROTESTS, AND RIOTS"}, {"name": "subject", "value": "POLICE"}, {"name": "organizations", "value": "OCCUPY WALL STREET"}, {"name": "glocations", "value": "OAKLAND (CALIF)"}, {"name": "persons", "value": ""}, {"name": "creative_works", "value": ""}], "lead_paragraph": "After a confrontation in Oakland on Tuesday night, frustrations are mounting for both the Occupy demonstrators and law enforcement in cities around the country.", "pub_date": "2011-10-26T00:00:00Z"}
{"headline": "Police Fire Tear Gas at Occupy Protesters in Oakland", "keywords": [{"rank": "4", "name": "subject", "value": "Tear Gas"}, {"rank": "3", "name": "subject", "value": "Police"}, {"rank": "2", "name": "subject", "value": "Demonstrations, Protests, and Riots"}, {"rank": "5", "name": "organizations", "value": "Occupy Wall Street"}, {"rank": "1", "name": "type_of_material", "value": "News"}, {"rank": "6", "name": "glocations", "value": "Oakland (Calif)"}], "lead_paragraph": "Last Updated 9:48 a.m. Riot police in Oakland dispersed hundreds of protesters with tear gas on Tuesday night as crowds tried to re-enter a plaza outside of City Hall that the authorities had cleared of an encampment earlier in the day.", "pub_date": "2011-10-26T00:22:37Z"}
{"headline": "The Early Word: Anxiety", "keywords": [{"rank": "1", "name": "type_of_material", "value": "News"}], "lead_paragraph": "Today's Times", "pub_date": "2011-10-26T06:00:42Z"}
{"headline": "Occupy Wall Street? Who Will Occupy Main Street?", "keywords": [{"rank": "4", "name": "subject", "value": "Sales and Excise Taxes"}, {"rank": "3", "name": "subject", "value": "Sales"}, {"rank": "2", "name": "subject", "value": "E-Commerce"}, {"rank": "5", "name": "subject", "value": "Shopping and Retail"}, {"rank": "1", "name": "type_of_material", "value": "News"}, {"rank": "6", "name": "subject", "value": "Small Business"}, {"rank": "7", "name": "organizations", "value": "Amazon.com Inc"}, {"rank": "8", "name": "organizations", "value": "Zappos"}, {"rank": "9", "name": "unknown", "value": "Amazon.com Inc|AMZN|NASDAQ"}], "lead_paragraph": "Lots of people enjoy saving money by shopping online. The prices are often lower, and in many cases there is no sales tax and little or no shipping charge. But while free market forces prevail, there are growing problems with the after-effects of this market shift to Internet sales.", "pub_date": "2011-10-26T07:00:32Z"}
{"headline": "Giving Subway Riders the No-Bin Treatment", "keywords": [{"rank": "4", "name": "subject", "value": "Waste Materials and Disposal"}, {"rank": "3", "name": "subject", "value": "Transit Systems"}, {"rank": "2", "name": "subject", "value": "Subways"}, {"rank": "5", "name": "organizations", "value": "Metropolitan Transportation Authority"}, {"rank": "1", "name": "type_of_material", "value": "News"}, {"rank": "6", "name": "organizations", "value": "Taxi and Limousine Commission"}, {"rank": "7", "name": "glocations", "value": "New York City"}], "lead_paragraph": "An old friend named Bob was a serious Roman Catholic, and though he harbored no bias against other religious denominations, he could not contain himself when presented one day with a suggestion that he found singularly awful. \"That's the worst idea since the Reformation,\" he blurted out.", "pub_date": "2011-10-26T08:40:02Z"}
{"headline": "Morning Take-Out", "keywords": [{"rank": "1", "name": "type_of_material", "value": "News"}], "lead_paragraph": "U.S. Is Set to Charge Major Executive in Trading Case \u00a0|\u00a0 Federal prosecutors are expected to file criminal charges on Wednesday against Rajat K. Gupta, the most prominent business executive ensnared in an aggressive insider trading investigation, according to people briefed on the case.", "pub_date": "2011-10-26T09:00:44Z"}
{"headline": "What We're Reading", "keywords": [{"rank": "1", "name": "type_of_material", "value": "News"}], "lead_paragraph": "Grist: To protest chocolate companies' continued use of cacao from countries that use forced child labor, Reverse Trick or Treaters will hand Fair Trade chocolates back to adults. -- Nick Fox", "pub_date": "2011-10-26T09:15:12Z"}
{"headline": "Elizabeth Warren's Influence on Occupy Wall Street", "keywords": [{"rank": "1", "name": "type_of_material", "value": "News"}], "lead_paragraph": "Elizabeth Warren, now running for a United States Senate seat in Massachusetts, is taking some credit for the Occupy Wall Street movement. She told Samuel P. Jacobs of The Daily Beast: \"I created much of the intellectual foundation for what they do. I support what they do.\" Read more \u00bb", "pub_date": "2011-10-26T09:15:15Z"}
{"headline": "The Student Loan Proposal: What It Might Mean for You", "keywords": [{"rank": "1", "name": "type_of_material", "value": "News"}], "lead_paragraph": "Blogger's Note: Tamar Lewin writes on The Times's Web site on Wednesday that President Obama will announce new programs \"to lower monthly loan payments for some students graduating next year and thereafter and to let borrowers who have a mix of direct federal loans and loans under the old Federal Family Education Loan Program consolidate them at a slightly lower interest rate.'' Mark Kantrowitz, the publisher of the financial aid Web sites finaid.org and fastweb, was asked by The Choice to write a quick essay explaining what the proposal might mean for applicants this year, and in the future, for current students and recent graduates. -- Jacques Steinberg", "pub_date": "2011-10-26T11:14:47Z"}
{"headline": "Updates on Occupy Protests Nationwide", "keywords": [{"rank": "4", "name": "glocations", "value": "Oakland (Calif)"}, {"rank": "3", "name": "organizations", "value": "Occupy Wall Street"}, {"rank": "2", "name": "subject", "value": "Demonstrations, Protests, and Riots"}, {"rank": "1", "name": "type_of_material", "value": "News"}], "lead_paragraph": "After a night of violence in Oakland, Calif., where police officers fired tear gas at protesters affiliated with the Occupy Wall Street movement, The Lede is following the response of demonstrators in cities across the country on Wednesday.", "pub_date": "2011-10-26T12:01:33Z"}
