{"pub_date": "2014-03-12T14:26:44Z", "headline": "Kerry Says to Meet Russia's Lavrov in London on Ukraine", "lead_paragraph": "U.S. Secretary of State John Kerry will travel to London to meet with Russian counterpart Sergei Lavrov on Friday to discuss proposals for resolving the Ukrainian crisis days before a referendum in Ukraine's Crimea region on joining Russia.", "keywords": ["Ukraine", "Russia", "Crimea", "State", "Sergei", "Kerry", "London", "Lavrov", "Secret"]}
{"pub_date": "2014-03-12T14:34:03Z", "headline": "White House Told of CIA Move Against Senate Aides", "lead_paragraph": "The White House says the Central Intelligence Agency's top lawyer gave it a \"heads up\" before the CIA filed a criminal complaint with the Justice Department against Senate Intelligence Committee staffers earlier this year. The Senate panel has been investigating the CIA's now-shuttered prison system and harsh interrogation of prisoners.", "keywords": ["Senate", "Justice Department", "Central Intelligence Agency", "Department", "House", "Committee", "White", "Agency", "Justice", "Central", "Intelligence"]}
{"pub_date": "2014-03-12T15:12:30Z", "headline": "The Phony Bill to Help Sick Kids Actually Helps Corporations Extend Their Influence", "lead_paragraph": "A bill approved on Tuesday purports to pay for research by eliminating public money for the two political conventions.", "keywords": ["McConnell, Mitch", "Campaign Finance"]}
{"pub_date": "2014-03-12T15:19:31Z", "headline": "Judge: Decorated Soldier Won't Get Medal of Honor", "lead_paragraph": "Lt. Garlin Murl Conner left the U.S. Army as the second-most decorated soldier during World War II, earning four Silver Stars, four Bronze Stars, seven Purple Hearts and the Distinguished Service Cross for his actions during 28 straight months in combat.", "keywords": ["World", "Service"]}
{"pub_date": "2014-03-12T15:41:12Z", "headline": "AP Among First Amendment Award Winners", "lead_paragraph": "The Radio Television Digital News Foundation is presenting its First Amendment Award to The Associated Press for defending press freedoms against secret government subpoenas for reporters' phone calls.", "keywords": ["News", "Television", "First", "Press", "Foundation"]}
{"pub_date": "2014-03-12T15:58:02Z", "headline": "Obama, Ukraine Premier Outline Potential Opening Over Crimea", "lead_paragraph": "Just days before a referendum in Crimea to decide if it should become part of Russia, President Barack Obama and Ukraine's prime minister outlined a potential diplomatic opening on Wednesday that could give Russians a greater voice in the disputed region.", "keywords": ["Ukraine", "Russia", "Crimea", "Obama", "Barack"]}
{"pub_date": "2014-03-12T16:00:43Z", "headline": "Irish Prime Minister Visiting White House Friday", "lead_paragraph": "Ireland's prime minister is making his traditional visit to the White House for St. Patrick's Day.", "keywords": ["Ireland", "House", "White", "Patrick"]}
{"pub_date": "2014-03-12T16:05:47Z", "headline": "Sebelius Says No Obamacare Mandate Delay, Enrollment Extension", "lead_paragraph": "There will be no delay in the penalty most Americans face under President Barack Obama's healthcare reform law if they fail to obtain health coverage this year, U.S. Health and Human Services Secretary Kathleen Sebelius said on Wednesday.", "keywords": ["Obama", "Barack", "Health", "Human", "American", "Americans", "Services", "America", "Service", "Sebelius", "Kathleen", "Secret"]}
{"pub_date": "2014-03-12T16:10:09Z", "headline": "Comcast Lobbyist Cohen Meets His Match in FCC's Wheeler", "lead_paragraph": "Comcast Corp's top lobbyist David Cohen is known to be a savvy political operator, having pushed through the No. 1 U.S. cable operator's landmark acquisition of media giant NBC Universal in 2011.", "keywords": ["David", "Lobby", "Comcast", "Cohen", "Wheeler", "Universal"]}
{"pub_date": "2014-03-12T16:33:47Z", "headline": "Kerry Says Will Decide Shortly on Resuming Aid to Egypt", "lead_paragraph": "U.S. Secretary of State John Kerry said on Wednesday he will decide \"in the days ahead\" whether to resume U.S. aid to Egypt after suspending the funds last year over the ouster of President Mohamed Mursi and a crackdown against protesters.", "keywords": ["Egypt", "State", "Kerry", "Mohamed", "Secret"]}
{"pub_date": "2014-03-12T16:41:20Z", "headline": "Obama to Raise Money at Qualcomm Founder's Home", "lead_paragraph": "President Barack Obama will travel to California in May to raise money for House Democrats at the home of Qualcomm Inc. founder Irwin Jacobs.", "keywords": ["California", "Obama", "Barack", "House", "Calif", "Money"]}
{"pub_date": "2014-03-12T16:45:33Z", "headline": "GOP Takes Aim at Obamacare to Fund Medicare", "lead_paragraph": "U.S. House Republicans said on Wednesday that they are pushing a plan to delay for five years the penalties for failing to buy health insurance under Obamacare, and to use the savings to spare doctors from a steep cut in Medicare payments.", "keywords": ["Medicare", "Obama", "House", "Republican", "Republic"]}
{"pub_date": "2014-03-12T16:48:08Z", "headline": "U.S. Senate Panel Approves Ukraine Bill With Sanctions, IMF Reforms", "lead_paragraph": "A U.S. Senate panel approved legislation on Wednesday that would impose strict sanctions on Russians involved in Moscow's intervention in Ukraine, provide aid to the new government in Kiev, and implement reforms of the International Monetary Fund.", "keywords": ["Ukraine", "Russia", "Senate", "International Monetary Fund", "International", "Moscow", "Sanctions", "Reform", "Panel", "Monetary"]}
{"pub_date": "2014-03-12T16:48:26Z", "headline": "Mrs. Obama Praises Military Children as 'Heroes'", "lead_paragraph": "Touting them as \"heroes\" who are just as \"strong and brave\" as their parents, Michelle Obama is praising military children who often have to balance homework and caring for siblings with frequent changes of address.", "keywords": ["Military", "Obama", "Michelle", "Children"]}
{"pub_date": "2014-03-12T16:51:16Z", "headline": "White House Tried to Mediate Dispute Between Senate Panel, CIA", "lead_paragraph": "The White House tried to mediate between the CIA and the Senate panel that oversees it after both sides alleged they were spied on by the other over a Bush-era interrogation program, a source familiar with the discussion told Reuters on Wednesday.", "keywords": ["Senate", "Media", "House", "White", "Panel", "Between"]}
{"pub_date": "2014-03-12T17:17:31Z", "headline": "Analysis: Dispute on Obamacare Role in House Race", "lead_paragraph": "Republicans have a new calling card for the midterm elections, same as the old one.", "keywords": ["Obama", "House", "Republican", "Republic"]}
{"pub_date": "2014-03-12T17:21:43Z", "headline": "Interim PM: Ukraine \"will never surrender\"", "lead_paragraph": "Ukraine's acting prime minister, Arseny Yatseniuk, tells President Barack Obama that Ukraine \"will never surrender\" to Russia. Rough Cut (no reporter narration).", "keywords": ["Ukraine", "Russia", "Obama", "Barack"]}
{"pub_date": "2014-03-12T17:22:47Z", "headline": "Interim PM: Ukraine \"will never surrender\"", "lead_paragraph": "Ukraine's acting prime minister, Arseny Yatseniuk, tells President Barack Obama that Ukraine \"will never surrender\" to Russia. Rough Cut (no reporter narration).", "keywords": ["Ukraine", "Russia", "Obama", "Barack"]}
{"pub_date": "2014-03-12T17:35:04Z", "headline": "Big Investors Stay With Fannie, Freddie Despite Lawmakers' Plans", "lead_paragraph": "A Senate proposal for winding down Fannie Mae and Freddie Mac slammed their shares over the last two days, but big investors in the government-owned mortgage agencies aren't running away yet.", "keywords": ["Senate"]}
{"pub_date": "2014-03-12T17:49:02Z", "headline": "Sodexo Food Service Company Pledges Better Meals", "lead_paragraph": "One of the nation's largest food service companies is making a series of changes in support of Michelle Obama's anti-childhood obesity initiative.", "keywords": ["Food", "Company", "Obama", "Michelle", "Service"]}
{"pub_date": "2014-03-12T18:11:43Z", "headline": "Obama to declassify Senate investigation report on CIA", "lead_paragraph": "President Barack Obama says he will declassify a Senate committee report into a Bush-era interrogation and detention program Rough Cut (no reporter narration).", "keywords": ["Senate", "Obama", "Barack"]}
{"pub_date": "2014-03-12T18:16:21Z", "headline": "Business Highlights", "lead_paragraph": "", "keywords": ["Business"]}
{"pub_date": "2014-03-12T18:37:36Z", "headline": "U.S. Calls Guantanamo Hunger Strikes 'Non-Religious Fasting'", "lead_paragraph": "New Guantanamo Bay U.S. prison guidelines describe hunger striking detainees as undergoing \"long term non-religious fasting,\" a copy of the document obtained by Reuters shows.", "keywords": ["Guantanamo"]}
{"pub_date": "2014-03-12T18:47:22Z", "headline": "Diplomats: UN Is Discussing Ukraine Resolution", "lead_paragraph": "The U.N. Security Council is discussing a possible resolution that would reaffirm Ukraine's sovereignty and territorial integrity and address Sunday's referendum on whether its Crimean Peninsula should become part of Russia, a council diplomat said Wednesday.", "keywords": ["Ukraine", "Russia", "Crimea", "Council", "Crimean", "Peninsula", "Security"]}
{"pub_date": "2014-03-12T19:04:32Z", "headline": "Catholics, Evangelicals Press GOP on Immigration", "lead_paragraph": "A group of Catholic bishops, evangelical leaders and advocates pressured top House Republicans to vote this year on overhauling immigration in a series of private meetings on Wednesday.", "keywords": ["House", "Republican", "Immigration", "Republic", "Press", "Catholic"]}
{"pub_date": "2014-03-12T19:53:06Z", "headline": "Ukrainian Premier at the White House", "lead_paragraph": "President Obama, along with Secretary of State John Kerry, met with the interim prime minister, Arseniy P. Yatsenyuk, and vowed to 'stand with Ukraine.'", "keywords": ["United States International Relations", "Kerry, John", "Crimea (Ukraine)", "Ukraine", "Obama, Barack", "Russia", "Yatsenyuk, Arseniy P"]}
{"pub_date": "2014-03-12T19:54:50Z", "headline": "The Assumptions Behind Obama's Initiative", "lead_paragraph": "Does the \"My Brother's Keeper\" program offer hope for young men of color, or reinforce harmful stereotypes?", "keywords": ["News"]}
{"pub_date": "2014-03-12T22:00:20Z", "headline": "Catholic Group Mounts Challenge to Health Care Law", "lead_paragraph": "A group of nearly 200 Catholic employers filed a new lawsuit in Oklahoma against the federal government Wednesday, hoping to stop parts of the federal health care law that force them to provide insurance that covers contraceptives.", "keywords": ["Health", "Group", "Catholic"]}
{"pub_date": "2014-03-12T22:41:43Z", "headline": "Obama meets with Ukraine's PM, shows support", "lead_paragraph": "U.S. President Barack Obama holds face-to-face talks with new Ukrainian Prime Minister Arseny Yatseniuk in the Oval Office and says, \"We will stand with Ukraine.\" Jillian Kitchener reports.", "keywords": ["Ukraine", "Obama", "Barack", "Office"]}
{"pub_date": "2014-03-12T23:11:43Z", "headline": "Obama meets with Ukraine's PM, shows support", "lead_paragraph": "U.S. President Barack Obama holds face-to-face talks with new Ukrainian Prime Minister Arseny Yatseniuk in the Oval Office and says, \"We will stand with Ukraine.\" Jillian Kitchener reports.", "keywords": ["Ukraine", "Obama", "Barack", "Office"]}
{"pub_date": "2014-03-13T00:00:00Z", "headline": "Obama Makes Diplomatic Push to Defuse Crisis in Ukraine", "lead_paragraph": "Pres Obama hosts Ukraine's interim Prime Min Arseniy P Yatsenyuk at the White House and the two open door to a political solution that could lead to more autonomy for Crimea if Russian troops withdraw; meeting comes as the United States embarks on a last-ditch diplomatic effort to defuse a crisis that has reignited tensions between East and West.", "keywords": ["Kerry, John", "Crimea (Ukraine)", "United States International Relations", "United States Politics and Government", "Russia", "Obama, Barack", "Yatsenyuk, Arseniy P", "Ukraine"]}
{"pub_date": "2014-03-13T00:00:00Z", "headline": "Lift the Mideast Roadblocks", "lead_paragraph": "Concurrence on four big issues can be reached if both sides are committed to a two-state solution.", "keywords": ["Netanyahu, Benjamin", "Israel", "Palestinians", "Middle East", "Israeli Settlements"]}
{"pub_date": "2014-03-13T00:00:00Z", "headline": "Working With Iran on Syria", "lead_paragraph": "Obama should reach out to Tehran to push Assad and the rebels to come to an agreement.", "keywords": ["Politics and Government", "Iran", "Middle East and North Africa Unrest (2010- )", "Syria", "International Relations", "Assad, Bashar al-"]}
{"pub_date": "2014-03-13T00:00:00Z", "headline": "Merkel Knows Where Putin Comes From, but Crisis Limits Rapport", "lead_paragraph": "German Chancellor Angela Merkel is facing a perhaps historic decision on whether to take a harder line against Russia over the crisis in Ukraine; Merkel, who grew up in East Germany and speaks fluent Russian, has emerged as a pivotal leader in the crisis as the only one who might sway Pres Vladimir V Putin, but she has so far been unable to do so.", "keywords": ["Russia", "Germany", "Putin, Vladimir V", "Ukraine", "International Relations", "Merkel, Angela", "European Union"]}
{"pub_date": "2014-03-13T00:00:00Z", "headline": "Ukraine's New Premier, the 'Rabbit,' Seems to Be in His Element", "lead_paragraph": "Ukraine's interim Prime Min Arseniy P Yatsenyuk has entered a role that suits him better than that of street revolutionary, given his background as former foreign minister, economics minister, speaker of Parliament and acting central bank chief; Yatsenyuk is now said by some Ukrainians to be the right man at the right moment, despite having been derided as an uninspiring technician during his failed presidential campaign of 2010.", "keywords": ["Obama, Barack", "International Relations", "Yatsenyuk, Arseniy P", "Ukraine", "Demonstrations, Protests, and Riots"]}
{"pub_date": "2014-03-13T00:00:00Z", "headline": "Nominee for Fed Vice Chairman Has Long History as Policy Leader", "lead_paragraph": "Stanley Fischer, nominated by Pres Obama to serve as vice chairman of the Federal Reserve, is expected to move quickly through confirmation process; Fischer is an influential academic who has worked for much of his professional life to improve economic policy in the developing world.", "keywords": ["United States Economy", "Fischer, Stanley", "Federal Reserve System", "Yellen, Janet L"]}
{"pub_date": "2014-03-13T00:00:00Z", "headline": "Kerry Plans 11th-Hour Meeting With Russians Over Crimea", "lead_paragraph": "Secretary of State John Kerry will meet the Russian foreign minister in London two days before Crimeans vote in a referendum on joining Russia.", "keywords": ["Crimea (Ukraine)", "Ukraine", "Russia", "Referendums", "United States International Relations", "Kerry, John", "Lavrov, Sergey V"]}
{"pub_date": "2014-03-13T00:00:00Z", "headline": "Health Mandate Won't Be Delayed, Sebelius Says", "lead_paragraph": "Health and Human Services Secretary Kathleen Sebelius testifies before the House Ways and Means Committee that the deadline for people to sign up for health insurance will not be extended and the requirement for most American to have coverage will not be delayed; declines to say whether the Obama administration is still committed to its original goal of enrolling seven million people in private coverage by March 31.", "keywords": ["House Committee on Ways and Means", "Sebelius, Kathleen", "Patient Protection and Affordable Care Act (2010)", "Health Insurance and Managed Care"]}
{"pub_date": "2014-03-13T00:00:00Z", "headline": "Panel Says Yemeni Man Should Stay in Detention", "lead_paragraph": "Parole-style panel at Guantanamo Bay, Cuba, is recommending that the military continue to hold Yemeni man Abdel Malik al-Rahabi in indefinite wartime detention; decision is the first of its kind for the Obama administration's new Periodic Review Board system.", "keywords": ["Yemen", "Military Tribunals", "Detainees", "Rahabi, Abdel Malik Ahmed Abdel Wahab al-", "Guantanamo Bay Naval Base (Cuba)"]}
{"pub_date": "2014-03-13T00:00:00Z", "headline": "Rainbow-Hued Housing for Gays in Golden Years", "lead_paragraph": "Small but growing number of subsidized apartment complexes are offering a welcoming environment to low- and moderate-income gay seniors, who often face housing discrimination.", "keywords": ["Transgender and Transsexual", "Affordable Housing", "Discrimination", "Real Estate and Housing (Residential)", "Elderly", "Retirement", "Homosexuality", "Philadelphia (Pa)"]}
{"pub_date": "2014-03-13T00:00:00Z", "headline": "General Warns of Perils in Leaving Afghanistan", "lead_paragraph": "Gen Joseph F Dunford Jr, top American commander in Afghanistan, says Al Qaeda will regroup and stage another attack on the West from Afghanistan if international troops completely withdraw from the country at the end of 2014; statement comes during testimony before the Senate Armed Services Committee.", "keywords": ["Taliban", "Obama, Barack", "Manchin, Joe III", "Al Qaeda", "United States Defense and Military Forces", "Karzai, Hamid", "Afghanistan War (2001- )", "Afghanistan", "Dunford, Joseph F Jr", "Senate Committee on Armed Services"]}
{"pub_date": "2014-03-13T00:00:00Z", "headline": "Lunch on the Barricades", "lead_paragraph": "Gail Collins Op-Ed column condemns Republican conservatives' increasing opposition to school lunch programs; faults both the right's rejection of any federal program that gives to poor people and conceit that all mothers should pack lunches as expression of love.", "keywords": ["United States", "Lunch and Breakfast Programs", "United States Politics and Government", "Education (K-12)", "Ryan, Paul D Jr"]}
{"pub_date": "2014-03-13T00:00:00Z", "headline": "Let the Military Run Drone Warfare", "lead_paragraph": "Op-Ed article by Rep Adam B Schiff calls for reforms to increase transparency, accountability and legitimacy of American drone program; urges elimination of several political roadblocks standing in way of such reforms; observes other nations are developing drone capabilities and says reforms will better position United States to counsel responsible use.", "keywords": ["Central Intelligence Agency", "United States Special Operations Command", "United States", "Drones (Pilotless Planes)", "Terrorism", "Yemen", "United States Defense and Military Forces", "Classified Information and State Secrets", "Civilian Casualties", "Targeted Killings", "United States Politics and Government", "Jaber, Faisal bin Ali"]}
{"pub_date": "2014-03-13T00:00:00Z", "headline": "The Unhealthy Meat Market", "lead_paragraph": "Nicholas Kristof Op-Ed column examines detrimental effects of modern meat production practices developed by Tyson foods on both human and animal health and economy; argues structures that benefit agribusiness also contribute to rural poverty and privatize gains while socializing health and environmental costs; says first step is to recognize that industrial food system is unhealthy.", "keywords": ["Antibiotics", "Animal Abuse, Rights and Welfare", "Leonard, Christopher", "United States", "Tyson Foods Inc", "The Meat Racket: The Secret Takeover of America's Food Business (Book)", "Factory Farming", "Meat", "Chickens"]}
{"pub_date": "2014-03-13T00:00:00Z", "headline": "Extra Pay for Extra Work", "lead_paragraph": "Editorial laments erosion of guaranteed time-and-a-half pay for overtime, trend that began in 1970s and was enforced by Bush administration in 2004; applauds Pres Obama's directive to Labor Department to revamp nation's overtime rules and urges department to raise salary threshold.", "keywords": ["Obama, Barack", "Wages and Salaries", "United States", "Editorials", "Overtime", "Labor Department (US)", "United States Politics and Government"]}
{"pub_date": "2014-03-13T00:00:00Z", "headline": "Senator's Simmering Battle With C.I.A. Over Detentions Report", "lead_paragraph": "Sen Dianne Feinstein's accusation that the Central Intelligence Agency had engaged in spying and intimidation of Senate staff has set up a showdown between the executive and legislative branches of government; Feinstein's broadside may have permanently chilled her relations with the spy agency, which she oversees, but even some former CIA officials think the agency could have better handled the standoff with Democrats on the Senate Intelligence Committee.", "keywords": ["Senate", "Interrogations", "Brennan, John O", "Feinstein, Dianne", "Senate Committee on Intelligence", "Graham, Lindsey", "Detainees", "Classified Information and State Secrets", "United States Politics and Government", "Central Intelligence Agency"]}
{"pub_date": "2014-03-13T00:00:00Z", "headline": "In Alabama, College Students Take On Challenge of Health Insurance Sign-Up", "lead_paragraph": "About 600 student volunteers from a dozen colleges in Alabama have been trained to help enroll people for insurance under Pres Obama's health care reform law; all-volunteer group is believed to be the only one doing enrollment entirely made up of college students, and founders hope if they can succeed in the red state, their effort will be replicable across the country.", "keywords": ["Alpha Tau Omega", "Alabama", "Auburn University", "Bama Covered", "Health Insurance and Managed Care", "Colleges and Universities", "Obama, Barack", "Patient Protection and Affordable Care Act (2010)", "University of Alabama at Birmingham", "Alabama State University"]}
{"pub_date": "2014-03-13T00:00:00Z", "headline": "Lawyers Prepare for G.M. Suits With Novel Strategies", "lead_paragraph": "Lawyers across country, preparing to undertake suits against General Motors following recall of 1.6 million vehicles, say some cases could hinge on extraordinary accusations of fraud and novel legal strategies that question the very existence of the company; incidents that occurred before 2009 could call into question restructuring agreement credited with saving automaker from dissolution, potentially sending General Motors back to bankruptcy court.", "keywords": ["Automobile Safety Features and Defects", "General Motors", "Suits and Litigation (Civil)", "Bankruptcies", "Recalls and Bans of Products"]}
{"pub_date": "2014-03-13T00:00:00Z", "headline": "Health Law Tied to Win by G.O.P. in Florida", "lead_paragraph": "Florida's special election in 13th Congressional District shows that Democratic Alex Sink could not outrun the tsunami of advertisements by Republican David Jolly tying her to Pres Obama's health care law.", "keywords": ["Jolly, David", "Obama, Barack", "Sink, Adelaide Alexander", "Democratic Party", "Florida", "Elections, House of Representatives", "Patient Protection and Affordable Care Act (2010)", "Republican Party"]}
{"pub_date": "2014-03-13T00:00:00Z", "headline": "What's On Thursday", "lead_paragraph": "Television highlights.", "keywords": ["Television"]}
{"pub_date": "2014-03-13T00:02:07Z", "headline": "Obama Administration Endorses Cut in Drug Sentences", "lead_paragraph": "The Obama administration on Thursday threw its weight behind a proposal that it says could cut the average prison sentence for a federal drug defendant by 11 months, a change designed to help reduce the massive U.S. prison population.", "keywords": ["Administration", "Obama", "Sentences"]}
{"pub_date": "2014-03-13T01:39:56Z", "headline": "China: US, Beijing Should Stress Mutual Interests", "lead_paragraph": "Common interests between China and the United States far outweigh the countries' differences, Chinese Premier Li Keqiang said Thursday, sounding a cordial note following a minor spat over President Barack Obama's recent meeting with the Dalai Lama.", "keywords": ["United States", "China", "United", "States", "Obama", "Barack", "State", "Beijing", "Chinese"]}
{"pub_date": "2014-03-13T02:57:23Z", "headline": "Hugo Boss Sees Double-Digit Growth in Womenswear in 2014", "lead_paragraph": "German fashion house Hugo Boss expects double-digit percentage growth at its struggling womenswear business this year, Chief Executive Claus-Dietrich Lahrs said at a press conference on Thursday.", "keywords": ["Executive", "Women"]}
{"pub_date": "2014-03-13T03:09:57Z", "headline": "Obama Signs Memo to Strengthen Overtime Pay Rules", "lead_paragraph": "Seeking to influence workers' incomes where possible, President Barack Obama signed a presidential memorandum Thursday directing the Labor Department to devise new overtime rules that would make more workers eligible for time-and-a-half pay for their extra hours of work.", "keywords": ["Overtime", "Obama", "Barack", "Department", "Labor"]}
{"pub_date": "2014-03-13T03:10:58Z", "headline": "GOP Leaders: Skirting Abortion Issue Not an Answer", "lead_paragraph": "Shying away from social issues is not a winning strategy for Republicans, whose rhetoric on those subjects has at times alienated voters and cost the GOP elections, party leaders are telling anti-abortion activists.", "keywords": ["Republican", "Republic"]}
{"pub_date": "2014-03-13T03:13:17Z", "headline": "Why CIA, Senators Still Feuding Over 9/11 Secrets", "lead_paragraph": "The festering dispute between the CIA and Senate investigators that exploded in public this week shows just how hard it can be to learn from the past and move on.", "keywords": ["Senate", "Secrets", "Secret"]}
{"pub_date": "2014-03-13T03:14:17Z", "headline": "Analysis: Dispute on Obamacare Role in House Race", "lead_paragraph": "Republicans have a new calling card for the midterm elections, same as the old one.", "keywords": ["Obama", "House", "Republican", "Republic"]}
