{"pub_date": "2014-03-07T14:56:31Z", "headline": "Netanyahu Says Israel Would Give Up 'Some Settlements' for Peace", "lead_paragraph": "Prime Minister Benjamin Netanyahu said Israel would give up \"some settlements\" in occupied Palestinian land to help secure a peace agreement but would limit as much as he could the number of enclaves removed.", "keywords": ["Israel", "Settlements", "Netanyahu", "Benjamin", "Palestinian"]}
{"pub_date": "2014-03-07T15:03:55Z", "headline": "Netanyahu Says Israel Would Give Up 'Some Settlements' for Peace", "lead_paragraph": "Prime Minister Benjamin Netanyahu said Israel would give up \"some settlements\" in occupied Palestinian land to help secure a peace agreement but would limit as much as he could the number of enclaves removed.", "keywords": ["Israel", "Settlements", "Netanyahu", "Benjamin", "Palestinian"]}
{"pub_date": "2014-03-07T15:11:34Z", "headline": "Santorum: GOP Loses When It Picks Moderates", "lead_paragraph": "Former Sen. Rick Santorum says Republicans lose elections when they nominate moderates.", "keywords": ["Republican", "Republic", "Former"]}
{"pub_date": "2014-03-07T15:41:55Z", "headline": "Pentagon: About 20,000 Russian Troops in Ukraine", "lead_paragraph": "The Pentagon estimates there are now about 20,000 Russian troops in Ukraine, as additional forces have gone into the country over the last week.", "keywords": ["Ukraine", "Russia"]}
{"pub_date": "2014-03-07T15:46:03Z", "headline": "U.S. Special Forces Sent to Train Iraqi Special Forces in Jordan", "lead_paragraph": "The United States recently sent a small number of special forces soldiers to Jordan to train with counterparts from Iraq and Jordan, a new step in the Obama administration's effort to help Baghdad stamp out a resurgent al Qaeda threat, a U.S. defense official said on Friday.", "keywords": ["United States", "Jordan", "Forces", "United", "States", "Obama", "State", "Qaeda", "Special"]}
{"pub_date": "2014-03-07T15:48:57Z", "headline": "Rand Paul: Obama Is Trampling Civil Liberties", "lead_paragraph": "Kentucky Sen. Rand Paul says President Barack Obama is running roughshod over Americans' civil liberties.", "keywords": ["Kentucky", "Obama", "Barack", "Civil", "American", "Americans", "America", "Liberties"]}
{"pub_date": "2014-03-07T16:01:10Z", "headline": "What an Israeli-Palestinian Peace Framework Might Look Like", "lead_paragraph": "After all this time, the core issues have been well staked out. But Israeli and Palestinian leaders have usually not encouraged an open dialogue on the specifics.", "keywords": ["Netanyahu, Benjamin", "Kerry, John", "Kurtzer, Daniel C", "Abbas, Mahmoud", "Gaza Strip", "West Bank", "Jerusalem (Israel)", "Israel", "Jews and Judaism", "Israeli Settlements", "United States International Relations", "Palestinians", "International Relations"]}
{"pub_date": "2014-03-07T17:15:47Z", "headline": "Rand Paul Urges Conservatives to Elect 'Lovers of Liberty'", "lead_paragraph": "Republican Rand Paul, a potential 2016 White House contender, on Friday accused President Barack Obama of restricting civil liberties and urged conservatives to \"stand with me\" in electing a president who would protect personal rights.", "keywords": ["Obama", "Barack", "House", "Republican", "White", "Republic", "Conservative"]}
{"pub_date": "2014-03-07T17:25:47Z", "headline": "Rand Paul's Style", "lead_paragraph": "Mr. Paul, quoting Pink Floyd, talked like a guy in jeans - albeit a guy in jeans in 1975.", "keywords": ["Paul, Rand", "Conservative Political Action Conference", "United States Politics and Government", "Speeches and Statements"]}
{"pub_date": "2014-03-07T17:54:06Z", "headline": "Stocks May Extend Rally After Strong Jobs Data", "lead_paragraph": "Friday's stronger-than-expected payrolls report did more than ease concerns about U.S. economic fundamentals - it also seemed to justify Wall Street's record levels, suggesting the market's uptrend could continue.", "keywords": ["Street", "Stocks", "Stock"]}
{"pub_date": "2014-03-07T17:56:13Z", "headline": "U.S. Extends Terremark Contract as HealthCare.gov Host", "lead_paragraph": "The Obama administration said on Friday Verizon Communications Inc's Terremark unit will remain under contract as host of the federal website HealthCare.gov to better ensure a smooth end to Obamacare's open enrollment period on March 31.", "keywords": ["Obama", "Health", "HealthCare", "Communications"]}
{"pub_date": "2014-03-07T18:25:09Z", "headline": "Obama Phoned Merkel on Friday to Discuss Ukraine Situation: White House", "lead_paragraph": "President Barack Obama telephoned German Chancellor Angela Merkel on Friday from his vacation resort in Key Largo, Florida, to discuss the situation in Ukraine, the White House said.", "keywords": ["Ukraine", "Florida", "Obama", "Barack", "House", "White", "Largo", "Merkel", "Angela"]}
{"pub_date": "2014-03-07T18:47:41Z", "headline": "Obama Visits Florida Ahead of Bellwether Special Election", "lead_paragraph": "President Barack Obama gave a feel-good campaign-style speech at a gymnasium packed with screaming high school students on Friday, sketching out the main points of his populist agenda ahead of a special election in Florida on Tuesday.", "keywords": ["Florida", "Election", "Obama", "Barack", "Special"]}
{"pub_date": "2014-03-07T21:01:57Z", "headline": "Obama, Germany's Merkel Discuss Ukraine", "lead_paragraph": "The White House says President Barack Obama has told German Chancellor Angela Merkel (AHN'-geh-lah MEHR'-kuhl) he welcomes the unified position of the United States and the European Union on Ukraine.", "keywords": ["Ukraine", "European Union", "United States", "Europe", "Germany", "European", "Union", "United", "States", "Obama", "Barack", "State", "House", "White", "Merkel", "Angela"]}
{"pub_date": "2014-03-07T22:39:47Z", "headline": "Daughter of Obama's Former Pastor Convicted in Fraud Case", "lead_paragraph": "The daughter of President Barack Obama's former pastor was convicted on Friday of laundering thousands of dollars from a state grant for a Chicago-area job-training program, federal prosecutors said.", "keywords": ["Obama", "Barack", "Former"]}
{"pub_date": "2014-03-08T00:00:00Z", "headline": "Russia Prepared to Annex Crimea, Deepening Crisis", "lead_paragraph": "Russia signals for first time that it is prepared to annex the Crimea region of Ukraine; move threatens to undermine a system of respect for national boundaries that has helped keep the peace in Europe and elsewhere for decades; action also intensifies confrontation with the West, ignoring threat of sanctions and argument that a vote for secession would violate Ukraine's Constitution and international law.", "keywords": ["Russia", "International Relations", "Crimea (Ukraine)", "Ukraine", "Putin, Vladimir V"]}
{"pub_date": "2014-03-08T00:00:00Z", "headline": "London's Laundry Business", "lead_paragraph": "Op-Ed article by author Ben Judah holds Great Britain is ready to betray the United States in its condemnation of Russian actions in Ukraine because of London's dependence on Russian money; describes how Britain's growth business is laundering foreign oligarchs' dirty billions.", "keywords": ["Great Britain", "London (England)", "Ukraine", "Money Laundering", "Russia", "Putin, Vladimir V", "Banking and Financial Institutions"]}
{"pub_date": "2014-03-08T00:00:00Z", "headline": "America's Natural Gas Lever", "lead_paragraph": "The United States's new gas abundance offers a chance to temper Russia's ability to flout international norms with impunity.", "keywords": ["Natural Gas", "Russia", "Oil (Petroleum) and Gasoline", "Economic Conditions and Trends"]}
{"pub_date": "2014-03-08T00:00:00Z", "headline": "As Kerry Visits Jordan, Abbas Holds His Ground", "lead_paragraph": "Secretary of State John Kerry makes unannounced visit to Jordan to consult King Abdullah II about Israeli-Palestinian peace negotiations, even as Palestinian Authority Pres Mahmoud Abbas reiterates positions that underscore challenge Kerry faces.", "keywords": ["Israel", "United States International Relations", "Abdullah II, King of Jordan", "Jordan", "Abbas, Mahmoud", "Kerry, John", "Palestinian Authority", "International Relations", "Palestinians"]}
{"pub_date": "2014-03-08T00:00:00Z", "headline": "Malaysia Opposition Leader Sentenced in Sodomy Case", "lead_paragraph": "Malaysian appeals court sentences opposition leader Anwar Ibrahim to five years in prison on charges of sodomy, illegal in Malaysia; ruling comes one week before Ibrahim was expected to register for elections; critics argue that conviction is attempt to block opposition's ascendancy at time when governing party's popularity is waning.", "keywords": ["Sex Crimes", "Malaysia", "Sentences (Criminal)", "Ibrahim, Anwar", "Kuala Lumpur (Malaysia)"]}
{"pub_date": "2014-03-08T00:00:00Z", "headline": "Why Russia Can't Afford Another Cold War: Now It's Part of the Global Economy", "lead_paragraph": "James B Stewart Common Sense column on why Russia cannot afford another Cold War; holds that the former Soviet Union was all but impervious to foreign economic or business pressure, but now Russia has a stock market and is entrenched in global economy.", "keywords": ["Putin, Vladimir V", "Russia", "International Trade and World Market", "Talbott, Strobe", "Cold War Era", "Ukraine"]}
{"pub_date": "2014-03-08T00:00:00Z", "headline": "For G.O.P., Hard Line on Immigration Comes at a Cost", "lead_paragraph": "Politcal Memo; top Congressional leaders and White House aides say immigration reform bill is not dead yet and still being debated by House Republicans, largely due to fears of hardening anti-Republican sentiment among a Latino electorate that has quintupled over the last two decades.", "keywords": ["Immigration and Emigration", "Hispanic-Americans", "Republican Party", "United States Politics and Government"]}
{"pub_date": "2014-03-08T00:00:00Z", "headline": "Access to Justice for All", "lead_paragraph": "The New York City Bar Association says even despised defendants are entitled to a lawyer&#8217;s assistance.", "keywords": ["United States Politics and Government", "Democratic Party", "Adegbile, Debo P", "Senate"]}
{"pub_date": "2014-03-08T00:00:00Z", "headline": "Meat Makes the Planet Thirsty", "lead_paragraph": "Op-Ed article by Prof James McWilliams underscores amount of water required to fatten livestock, in light of California's ongoing drought; contends environmental impact of raising cattle in California shows it is a mistake to believe current livestock production is sustainable.", "keywords": ["California", "Water", "Drought", "Livestock"]}
{"pub_date": "2014-03-08T00:00:00Z", "headline": "Snowden Says He Reported Concerns Before Leaks", "lead_paragraph": "Former National Security Agency contractor Edward J Snowden says he raised concerns to more than 10 United States officials, none of whom took action, before he decided to give trove of classified documents to journalists; statement is among newly-released written answers that Snowden provided to members of the European Parliament.", "keywords": ["National Security Agency", "United States Defense and Military Forces", "Snowden, Edward J", "United States", "Surveillance of Citizens by Government", "Classified Information and State Secrets", "Russia", "Espionage and Intelligence Services"]}
{"pub_date": "2014-03-08T00:00:00Z", "headline": "The Self(ie) Generation", "lead_paragraph": "Charles M Blow Op-Ed column examines Pew Research Center survey finding that millennials, defined as ages 18 to 33, are drifting away from tradition political, religious and cultural institutions; explores what impact these Americans will have on the political process, given their views.", "keywords": ["Youth", "Polls and Public Opinion", "Pew Research Center", "United States Politics and Government"]}
{"pub_date": "2014-03-08T00:00:00Z", "headline": "The Sulfur Rule, Tardy but Welcome", "lead_paragraph": "Editorial praises new rule proposed by Obama administration requiring refiners to reduce the sulfur content in gasoline by two-thirds; points out move will further reduce harmful tailpipe emissions from both old and new cars; contends decision on sulfur bodes well for tough and complex decisions administration faces involving greenhouse gas emissions.", "keywords": ["Fuel Efficiency", "Oil (Petroleum) and Gasoline", "Sulfur and Sulfur Compounds", "Editorials", "Air Pollution", "Environmental Protection Agency", "Obama, Barack"]}
{"pub_date": "2014-03-08T00:00:00Z", "headline": "Jobs at a Turning Point", "lead_paragraph": "Editorial laments that policy makers have no intention of passing true economic stimulus even though the economy needs more good jobs; urges Pres Obama and Democrats to at least make the case for stimulus and indulge no illusions that there is some other way to turn conditions around.", "keywords": ["Republican Party", "Labor and Jobs", "Democratic Party", "Infrastructure (Public Works)", "Unemployment", "Editorials", "Obama, Barack", "United States Economy"]}
{"pub_date": "2014-03-08T00:00:00Z", "headline": "Move Into Ukraine Said to Be Born in Shadows", "lead_paragraph": "Examination of events surrounding political implosion in Ukraine reveals that Russia's strategy emerged haphazardly and in secret, as an emotional Russian Pres Vladimir V Putin acted out of a deep sense of betrayal and grievance; decisions, particularly the one to invade Crimea, have unleashed wave of nationalistic fervor for peninsula's reunification with Russia that the Kremlin has so far proved unwilling, or unable, to tamp down.", "keywords": ["Demonstrations, Protests, and Riots", "Russia", "Ukraine", "Yanukovych, Viktor F", "Putin, Vladimir V", "Crimea (Ukraine)"]}
{"pub_date": "2014-03-08T00:00:00Z", "headline": "The President Does Not Drop Out of Sight, but Does Get Out of Town", "lead_paragraph": "President Obama and his family go to oceanfront resort in Key Largo, Fla, to begin a weekend getaway that was in doubt because of the tumultuous events in Crimea and Ukraine; White House says he is keeping close eye on the Ukraine crisis, getting briefed and placing calls to the leaders of Russia, Germany, Britain and Japan.", "keywords": ["Travel and Vacations", "Obama, Barack", "Key Largo (Fla)", "United States Politics and Government"]}
{"pub_date": "2014-03-08T00:00:00Z", "headline": "Behind Clash Between C.I.A. and Congress", "lead_paragraph": "Dispute over classified Central Intelligence Agency report has led to bitter fight between agency and its congressional overseer Senate Intelligence Committee, in which both sides accuse other of spying; CIA officials scoured digital logs of Senate staff members to see how they obtained a copy of an internal report on agency's detention and interrogation program, which was under review at time; issue has led to two parallel inquiries by the Justice Department.", "keywords": ["Udall, Mark", "Interrogations", "Feinstein, Dianne", "United States Politics and Government", "Detainees", "Classified Information and State Secrets", "Panetta, Leon E", "Brennan, John O", "Central Intelligence Agency", "Justice Department", "Senate Committee on Intelligence", "Espionage and Intelligence Services"]}
{"pub_date": "2014-03-08T01:08:58Z", "headline": "Republicans Gain Momentum in Close Fight for U.S. Senate", "lead_paragraph": "Eight months before the November 4 elections, Republicans have expanded the number of competitive races for U.S. Senate seats and have a growing chance of gaining control of that chamber and stalling Democratic President Barack Obama's second-term agenda.", "keywords": ["Senate", "Obama", "Barack", "Democratic", "Republican", "Republic"]}
{"pub_date": "2014-03-08T02:05:24Z", "headline": "Frustration in Afghan Women's Rights Struggle", "lead_paragraph": "In 2009, the United States gave Wazhma Frogh the International Woman of Courage award for her women's rights activism in Afghanistan. Prominently displayed in Frogh's office is a picture of then-Secretary of State Hillary Clinton granting her the award as First Lady Michelle Obama smiles, clapping by her side.", "keywords": ["United States", "Afghanistan", "Clinton", "Hillary", "United", "States", "Obama", "State", "International", "Rights", "Michelle", "First", "Secret", "Women"]}
{"pub_date": "2014-03-08T03:05:35Z", "headline": "Tea Party Challengers Struggle to Continue Success", "lead_paragraph": "Four years after the tea party rocked the political world by ousting several prominent Republicans in Congress, the ultra-conservative movement finds itself with slimmer prospects as it moves into the new election season.", "keywords": ["Party", "Republican", "Republic", "Success"]}
{"pub_date": "2014-03-08T03:19:36Z", "headline": "Obama Warns Party to Focus on 2014, Not 2016", "lead_paragraph": "Democrats could get walloped in the November elections.", "keywords": ["Obama", "Party"]}
{"pub_date": "2014-03-08T04:05:17Z", "headline": "Russia Reinforces Military Presence in Crimea", "lead_paragraph": "Dozens of military trucks transporting heavily armed soldiers rumbled over Crimea's rutted roads Saturday as Russia reinforced its armed presence on the disputed peninsula in the Black Sea. Moscow's foreign minister ruled out any dialogue with Ukraine's new authorities, whom he dismissed as the puppets of extremists.", "keywords": ["Ukraine", "Russia", "Black Sea", "Military", "Crimea", "Moscow", "Black"]}
{"pub_date": "2014-03-08T05:24:07Z", "headline": "Iran President Condemns Hard-Line Media Crackdown", "lead_paragraph": "Iran's moderate-leaning president strongly criticized hard-line judicial officials Saturday for ordering reformist newspapers shut down, highlighting the internal political tensions in the Islamic Republic as it negotiates a final nuclear deal with world powers.", "keywords": ["Iran", "Media", "Republic"]}
{"pub_date": "2014-03-08T06:02:48Z", "headline": "Tee Time Part of Obama's Florida Family Vacation", "lead_paragraph": "President Barack Obama got out on a Florida golf course Saturday with two former professional athletes and the cousin of one of his top advisers.", "keywords": ["Florida", "Obama", "Barack", "Family"]}
{"pub_date": "2014-03-08T07:07:09Z", "headline": "4 Nations Urge US Gas Exports Amid Ukraine Crisis", "lead_paragraph": "Four Central European nations are urging the United States to boost natural gas exports to Europe as a hedge against the possibility that Russia could cut off its supply of gas to Ukraine.", "keywords": ["Ukraine", "Russia", "United States", "Europe", "European", "United", "States", "State", "Nations", "Central", "Crisis"]}
{"pub_date": "2014-03-08T07:09:50Z", "headline": "Crimean PM Says 'No One' Can Cancel Referendum on Joining Russia", "lead_paragraph": "The pro-Russia prime minister of Ukraine's Crimea peninsula has defended a decision to hold a referendum on whether the region should join Russia, saying on Saturday that \"no one\" could cancel the voting.", "keywords": ["Ukraine", "Russia", "Crimea", "Crimean"]}
{"pub_date": "2014-03-08T08:08:14Z", "headline": "Warning Shots Fired to Turn Monitors Back From Crimea", "lead_paragraph": "Shots were fired in Crimea to warn off an unarmed international team of monitors and at a Ukrainian observation plane, as the standoff between occupying Russian forces and besieged Ukrainian troops intensified.", "keywords": ["Russia", "Crimea"]}
{"pub_date": "2014-03-08T08:09:06Z", "headline": "Warning Shots Fired to Turn Monitors Back From Crimea", "lead_paragraph": "Shots were fired in Crimea to warn off an unarmed international team of monitors and at a Ukrainian observation plane, as the standoff between occupying Russian forces and besieged Ukrainian troops intensified.", "keywords": ["Russia", "Crimea"]}
{"pub_date": "2014-03-08T09:24:56Z", "headline": "For Obama, a Last Stab at Improving Ties With Hill", "lead_paragraph": "In late December, President Barack Obama's new legislative affairs team sent him more than a dozen recommendations for ways to improve his strained relations with Capitol Hill. The president responded with a few ideas of his own, including a request for more social events with lawmakers at the White House.", "keywords": ["Obama", "Barack", "House", "White"]}
{"pub_date": "2014-03-08T11:52:19Z", "headline": "Arms Ship Captured by Israeli Navy Arrives at Port", "lead_paragraph": "A captured ship Israel says carried advanced rockets from Iran bound for Gaza militants arrived to port Saturday, where authorities prepared its cargo for a public display Israel hopes will step up pressure on world powers as they negotiate with Tehran over its nuclear program.", "keywords": ["Israel", "Iran", "Israeli"]}
{"pub_date": "2014-03-08T11:58:02Z", "headline": "France Lines Up With Obama on Ukraine Issue", "lead_paragraph": "French President Francois Hollande agrees with President Barack Obama that Russia must take steps toward pulling out troops sent into Ukraine's Crimean peninsula or face worse relations with the world community.", "keywords": ["Ukraine", "Russia", "Crimea", "Obama", "Barack", "Crimean"]}
{"pub_date": "2014-03-08T12:41:29Z", "headline": "Obama Calls Six World Leaders About Ukraine Crisis: White House", "lead_paragraph": "President Barack Obama made a series of phone calls on Saturday to world leaders about the ongoing crisis in Ukraine, including British Prime Minister David Cameron, French President Francois Hollande, and Italian Prime Minister Matteo Renzi the White House said.", "keywords": ["Ukraine", "Obama", "Barack", "House", "White", "David", "Cameron", "World", "Crisis"]}
{"pub_date": "2014-03-08T12:52:09Z", "headline": "Obama Continues Telephone Outreach on Ukraine", "lead_paragraph": "Vacationing in Florida, President Barack Obama continued his telephone consultations with world leaders on Ukraine, speaking one on one Saturday with the leaders of three European powers and collectively with the heads of the three Baltic states, White House said.", "keywords": ["Ukraine", "Europe", "Florida", "European", "Obama", "Barack", "House", "White"]}
{"pub_date": "2014-03-08T13:54:27Z", "headline": "Kerry Urges Russia to Exercise Utmost Restraint in Ukraine's Crimea", "lead_paragraph": "U.S. Secretary of State John Kerry warned Russia on Saturday that any steps to annex Ukraine's Crimea region would close the door to diplomacy, a U.S. State Department official said.", "keywords": ["Ukraine", "Russia", "State Department", "Crimea", "State", "Department", "Kerry", "Secret"]}
{"pub_date": "2014-03-08T14:07:38Z", "headline": "President Obama to Introduce 'Cosmos' Debut Sunday", "lead_paragraph": "The Fox TV network says President Barack Obama will introduce the debut episode of the science series \"Cosmos: A Spacetime Odyssey.\"", "keywords": ["Obama", "Barack"]}
{"pub_date": "2014-03-08T14:53:40Z", "headline": "Central Europeans Want U.S. Gas to Cut Dependence on Russia", "lead_paragraph": "Four central European countries have asked the U.S. Congress to make it easier for them to import natural gas from the United States and reduce their dependence on supplies from Russia, the Czech Foreign Ministry said on Saturday.", "keywords": ["Russia", "United States", "Europe", "European", "United", "States", "State", "Central", "Foreign"]}
{"pub_date": "2014-03-08T15:17:59Z", "headline": "Sunday Breakfast Menu, March 9", "lead_paragraph": "Ukraine and the Crimea region continue to dominate the headlines and will drive the conversation on the Sunday shows, with guests set to discuss the tense relationship between the United States and Russia.", "keywords": ["Ukraine", "Russia", "United States", "Crimea", "United", "States", "State", "Breakfast"]}
{"pub_date": "2014-03-08T17:00:41Z", "headline": "Immigrant Detainees on Hunger Strike in Washington State", "lead_paragraph": "Hundreds of detainees at an immigration holding center in Tacoma have gone on hunger strike to demand better conditions at the facility and an end to U.S. deportations, their attorney said on Saturday.", "keywords": ["Detainees", "State", "Washington"]}
{"pub_date": "2014-03-08T18:00:26Z", "headline": "Kerry, Cruz and Crist Poke Fun at Gridiron Dinner", "lead_paragraph": "Politicians poked fun at adversaries and themselves Saturday night at the annual Gridiron dinner, a gathering of journalists and public figures.", "keywords": ["Kerry"]}
{"pub_date": "2014-03-08T18:43:04Z", "headline": "Rand Paul Wins Again in Conservative Republican Poll", "lead_paragraph": "Senator Rand Paul of Kentucky came out the favorite for the second straight year among Republican conservative activists voting for the candidate they would like to see in the White House next.", "keywords": ["Kentucky", "House", "Republican", "White", "Republic", "Conservative"]}
{"pub_date": "2014-03-08T20:14:07Z", "headline": "Obama to Preserve California Federal Lands", "lead_paragraph": "President Barack Obama will expand the California Coastal National Monument to include the Point Arena-Stornetta Public Lands, a White House official said Saturday.", "keywords": ["California", "National", "Obama", "Barack", "House", "White", "Calif", "Public", "Federal"]}
{"pub_date": "2014-03-08T20:39:41Z", "headline": "Obama to Expand National Monument on California Coast: White House", "lead_paragraph": "President Barack Obama will expand a national monument in California this week to add about 1,665 acres of Pacific shoreline, the White House said on Saturday.", "keywords": ["California", "National", "Obama", "Barack", "House", "White", "Calif", "Pacific"]}
{"pub_date": "2014-03-08T21:36:47Z", "headline": "Rising Star Among California Democrats Takes Stage at Convention", "lead_paragraph": "California Attorney General Kamala Harris sought to engage and energize fellow Democrats on Saturday and warned them not to become complacent with their domination of state politics.", "keywords": ["California", "Calif", "General", "Harris"]}
