Obama,20140301,20140320
{"pub_date": "2014-03-01T00:00:00Z", "headline": "Top Ukrainians Accusing Russia of an Invasion", "lead_paragraph": "Ukraine's fragile new government accuses Russia of trying to provoke a military conflict by invading the Crimean region; American officials do not directly confirm series of public statements by Ukrainian officials that Russian troops were being deployed to Crimea but Pres Obama does refer to Russian military movements there and issues stern warning to Kremlin about respecting Ukraine's sovereignty.", "keywords": ["Defense and Military Forces", "Ukraine", "Putin, Vladimir V", "Yanukovych, Viktor F", "Crimea (Ukraine)", "Russia", "Airports"]}
{"pub_date": "2014-03-01T00:00:00Z", "headline": "Why Israel No Longer Trusts Europe", "lead_paragraph": "If the recent rancor remains, hopes for a European role in a final Mideast peace deal will be dashed.", "keywords": ["European Union", "Israel", "Israeli Settlements"]}
{"pub_date": "2014-03-01T00:00:00Z", "headline": "Thousands of Clinton White House Papers Released", "lead_paragraph": "Nearly 4,000 pages of internal memos are being made public, offering possible insights into both a past president and, perhaps, a future one.", "keywords": ["Clinton, Bill", "Archives and Records", "Clinton, Hillary Rodham", "Clinton, William Jefferson, Presidential Library", "United States Politics and Government", "National Archives and Records Administration"]}
{"pub_date": "2014-03-01T00:00:00Z", "headline": "Clinton Memos Offer Window Into Past and Fodder for 2016", "lead_paragraph": "National Archives release of previously withheld memos, transcripts and other papers from Clinton White House underscores what a pivotal force Hillary Clinton was, intimately involved in the politics that shaped Washington in the 1990s; memos offer rare and more detailed look at the machinations from an era that are now of acute interest, as Clinton possibly gears up for presidential run in 2016.", "keywords": ["Clinton, Bill", "Archives and Records", "Clinton, William Jefferson, Presidential Library", "National Archives and Records Administration", "Presidential Election of 2016", "United States Politics and Government", "Clinton, Hillary Rodham"]}
{"pub_date": "2014-03-01T00:00:00Z", "headline": "For Coke, Challenge Is Staying Relevant", "lead_paragraph": "James B Stewart Common Sense column examines challenges facing Coca-Cola, which reigned for years as No 1 brand worldwide, but has recently had trouble staying relevant; says that very idea that Coke brand may be in trouble is startling, given that product has thrived for 127 years, surviving countless passing health fads.", "keywords": ["Company Reports", "Coca-Cola Company", "Soft Drinks"]}
{"pub_date": "2014-03-01T00:00:00Z", "headline": "Obama Warns Russia Not to Use Force in Ukraine", "lead_paragraph": "President Obama warned Russia on Friday that it should not intervene militarily in Ukraine, saying the United States will stand with the world to condemn a violation of Ukraine's sovereignty.", "keywords": ["Ukraine", "Russia", "United States", "United", "States", "Obama", "State"]}
{"pub_date": "2014-03-01T00:00:00Z", "headline": "Transcript of Obama's Remarks on Ukraine", "lead_paragraph": "'It would be a clear violation of Russia's commitment to respect the independence and sovereignty and borders of Ukraine,' President Obama said.", "keywords": ["Obama, Barack", "Ukraine", "Russia", "Crimea (Ukraine)"]}
{"pub_date": "2014-03-01T00:00:00Z", "headline": "Health Security and Infectious Disease", "lead_paragraph": "Experts in infectious diseases and veterinary medicine respond to an editorial.", "keywords": ["SARS (Severe Acute Respiratory Syndrome)", "Preventive Medicine", "Epidemics"]}
{"pub_date": "2014-03-01T00:00:00Z", "headline": "Using Cyberweapons", "lead_paragraph": "A security expert warns of the possible consequences of a cyberattack against Syria.", "keywords": ["Syria", "Cyberattacks and Hackers", "Obama, Barack", "Cyberwarfare", "United States Defense and Military Forces"]}
{"pub_date": "2014-03-01T00:00:00Z", "headline": "New Health Fix Offers Subsidies for Insurance Policies Bought Outside Exchanges", "lead_paragraph": "Obama administration says it will allow some people to receive federal subsidies for health insurance purchased in the private market outside of health insurance exchanges; shift is latest in series of policy changes, extensions and clarifications by federal officials trying to help beneficiaries and minimize political damage to Democrats in this election year.", "keywords": ["Oregon", "Obama, Barack", "Kitzhaber, John", "Health Insurance and Managed Care", "Patient Protection and Affordable Care Act (2010)", "States (US)"]}
{"pub_date": "2014-03-01T00:00:00Z", "headline": "Preparing Teachers for the Common Core", "lead_paragraph": "Editorial calls on New York State legislature and Gov Andrew Cuomo to provide funds to shore up new Common Core learning standards that have been met with resistance and confusion by some districts and teachers; holds essential step will be to end conference-based training sessions for teachers in favor of continuous instruction by master educators who observe teachers and give feedback.", "keywords": ["Reading and Writing Skills (Education)", "Cuomo, Andrew M", "Editorials", "Education (K-12)", "New York State"]}
{"pub_date": "2014-03-01T00:00:00Z", "headline": "What Is Russia's Aim in Ukraine?", "lead_paragraph": "Editorial holds that Russian Pres Vladimir Putin has been outrageously provocative in response to crisis in Ukraine, organizing war games near border and giving ousted Pres Viktor Yanukovych safe harbor; supports Pres Obama in his warning against any Russian military intervention, and calls upon Russia and the West to cooperate peacefully to stabilize country and resolve its economic crisis.", "keywords": ["International Relations", "Putin, Vladimir V", "Editorials", "Yanukovych, Viktor F", "Russia", "Obama, Barack", "Ukraine", "Crimea (Ukraine)", "Defense and Military Forces"]}
{"pub_date": "2014-03-01T00:00:00Z", "headline": "Fathers' Sons and Brothers' Keepers", "lead_paragraph": "Charles M Blow Op-Ed column praises Pres Obama for his My Brother's Keepers initiative, social program aimed at bettering outcomes for nation's young men of color; holds absentee and emotionally uninvolved fathers, especially among black men, are a key contributor to impulsive and dangerous behavior in young men, but problem deserves sympathy rather than condemnation.", "keywords": ["Hispanic-Americans", "Blacks", "Men and Boys", "Parenting", "Social Conditions and Trends"]}
{"pub_date": "2014-03-01T00:00:00Z", "headline": "End of an Era? Clinton Media Strategy May Be Due for an Overhaul", "lead_paragraph": "Political Memo; Hillary Clinton's press strategy will have a critical bearing on her political fortunes, especially as she faces earlier and more extensive coverage than any potential candidate in history; reporters at a raft of publications are treating her as a given, exceptional development for an undeclared candidate two years out from an election.", "keywords": ["Reines, Philippe I", "Presidential Election of 2016", "Clinton, Bill", "State Department", "United States Politics and Government", "Clinton, Hillary Rodham", "News and News Media"]}
{"pub_date": "2014-03-01T00:00:00Z", "headline": "Obama Vows Aggressive Campaign for the Party's Congressional Candidates", "lead_paragraph": "Pres Obama tells members of the Democratic National Committee that he vows to wage aggressive political campaigns this year on behalf of Democratic congressional candidates; finds fate of his agenda, and his legacy, at stake.", "keywords": ["Democratic Party", "Elections, House of Representatives", "Obama, Barack", "United States", "United States Politics and Government", "Democratic National Committee", "Republican Party"]}
{"pub_date": "2014-03-01T00:00:00Z", "headline": "Sartorial Pluck Has No Place in the City of Fancy Fridays", "lead_paragraph": "Politicians who work inside the Beltway abide by one of the strictest dress codes in the country; each branch, department and agency that falls under the direction of the federal government has an unwritten standard for what is acceptable work attire; code is enforced either by behind-the-back whispers or forced exits.", "keywords": ["Washington (DC)", "White House Building (Washington, DC)", "Suits (Apparel)", "Defense Department", "United States Politics and Government", "Fashion and Apparel"]}
{"pub_date": "2014-03-01T00:00:00Z", "headline": "After Arrest, Pastor Linked to Mayor Is Under Scrutiny for Tangled Finances", "lead_paragraph": "Bishop Orlando Findlayter, pastor in East Flatbush, Brooklyn, who shares close relationship with Mayor Bill de Blasio, has come under scrutiny for series of financial missteps and for series of run-ins with police; February traffic-related arrest of Findlayter prompted call from de Blasio to police, raising questions about mayor's judgement.", "keywords": ["Clergy", "Flatbush (Brooklyn, NY)", "New York City", "Findlayter, Orlando", "de Blasio, Bill", "Police Department (NYC)"]}
{"pub_date": "2014-03-01T00:00:00Z", "headline": "Politics at the Oscars", "lead_paragraph": "From Michelle Obama to Michael Moore to Marlon Brando (or not Marlon Brando), the Oscars have a long political history.", "keywords": ["Academy Awards (Oscars)", "Movies"]}
{"pub_date": "2014-03-01T01:12:07Z", "headline": "Rain Soaks California Causing Floods, but Won't End Drought", "lead_paragraph": "A large winter storm brought much-needed relief to parched California on Friday, boosting depleted reservoirs and the Sierra Nevada's mountain snowpack, but officials said the precipitation would be too little to offset years of drought.", "keywords": ["California", "Drought", "Rain", "Calif"]}
{"pub_date": "2014-03-01T01:14:07Z", "headline": "Putin Ready to Invade Ukraine; Kiev Warns of War", "lead_paragraph": "Russian President Vladimir Putin demanded and won his parliament's approval on Saturday to invade Ukraine, where the new government warned of war, put its troops on high alert and appealed to NATO for help.", "keywords": ["Ukraine", "Russia", "Putin", "Vladimir"]}
{"pub_date": "2014-03-01T01:15:32Z", "headline": "Obama Warns Putin Against Military Intervention in Ukraine", "lead_paragraph": "U.S. President Barack Obama has warned Russia against any military intervention in Ukraine after the country's new leaders accused Moscow of deploying forces in the Crimea region.", "keywords": ["Ukraine", "Russia", "Military", "Putin", "Crimea", "Obama", "Barack", "Moscow"]}
{"pub_date": "2014-03-01T03:28:06Z", "headline": "Clinton Advisers Sought to Soften Her Image", "lead_paragraph": "Hillary Rodham Clinton's advisers sought to \"humanize\" what they saw as her stern, defensive public image during her husband's White House days and as she embarked on her groundbreaking Senate campaign in New York.", "keywords": ["Senate", "Clinton", "Hillary", "Rodham", "House", "White"]}
{"pub_date": "2014-03-01T03:32:33Z", "headline": "US Calls on Russia to Withdraw Forces From Ukraine", "lead_paragraph": "President Barack Obama on Saturday called on Russian President Vladimir Putin to de-escalate the tense atmosphere in Ukraine by pulling his forces back to bases in the country's Crimean region and to refrain from interfering elsewhere in the former Soviet republic.", "keywords": ["Ukraine", "Russia", "Forces", "Putin", "Vladimir", "Crimea", "Obama", "Barack", "Crimean", "Soviet"]}
{"pub_date": "2014-03-01T03:54:30Z", "headline": "Obama Revs Up Dems as Election Year Encroaches", "lead_paragraph": "If President Barack Obama and Democrats have their way, voters will see this year's midterm elections as a stark choice: Republicans pushing failed policies from a bygone era versus Democrats advocating for freedom and opportunity for all Americans.", "keywords": ["Election", "Obama", "Barack", "Republican", "American", "Americans", "Republic", "America"]}
{"pub_date": "2014-03-01T04:07:39Z", "headline": "Will 'Zero Option' in Afghanistan Cause Chaos?", "lead_paragraph": "If President Barack Obama were to decide to leave no military advisory force in Afghanistan next year, would Afghan security unravel to the point of enabling a civil war, a Taliban takeover and a return of al-Qaida in such numbers as to pose a 9/11-type threat?", "keywords": ["Afghanistan", "Taliban", "Obama", "Barack"]}
{"pub_date": "2014-03-01T05:26:13Z", "headline": "Putin Ready to Invade Ukraine; Kiev Warns of War", "lead_paragraph": "Russian President Vladimir Putin demanded and won his parliament's approval on Saturday to invade Ukraine, where the new government warned of war, put its troops on high alert and appealed to NATO for help.", "keywords": ["Ukraine", "Russia", "Putin", "Vladimir"]}
{"pub_date": "2014-03-01T06:02:10Z", "headline": "Obama Challenges Congress to Help Create Jobs", "lead_paragraph": "President Barack Obama is challenging Congress to help him create jobs and rebuild the nation's infrastructure.", "keywords": ["Obama", "Barack"]}
{"pub_date": "2014-03-01T06:57:50Z", "headline": "West Voices Alarm on Crimea, Urges Russia to Respect Ukraine Sovereignty", "lead_paragraph": "The West expressed alarm on Saturday over fast-moving developments in Ukraine's Crimea, urging all sides to avoid further escalation and calling on Russia to respect Ukraine's sovereignty.", "keywords": ["Ukraine", "Russia", "Crimea"]}
{"pub_date": "2014-03-01T09:36:04Z", "headline": "For Obama, an Election-Year Budget Without Drama", "lead_paragraph": "Six years into his presidency, President Barack Obama is sending Congress a budget that for once does not herald a partisan legislative showdown.", "keywords": ["Election", "Obama", "Barack", "Budget"]}
{"pub_date": "2014-03-01T10:21:44Z", "headline": "Obama focuses on jobs in weekly address", "lead_paragraph": "U.S. President Barack Obama calls on Congress to back plans to boost jobs. Deborah Lutterbeck reports.", "keywords": ["Obama", "Barack", "Deborah"]}
{"pub_date": "2014-03-01T10:51:10Z", "headline": "Long Waits Frustrate Callers to Health Exchanges", "lead_paragraph": "For those trying to enroll through online health exchanges, help has long been advertised as just a phone call away.", "keywords": ["Health", "Exchange"]}
{"pub_date": "2014-03-01T11:44:12Z", "headline": "March 1 Updates on Ukraine Crisis", "lead_paragraph": "The Lede is following events in Ukraine and Russia on Saturday, following a unanimous vote in the upper house of the Russian Parliament approving a request from President Vladimir Putin to send a military force to Ukraine.", "keywords": ["Putin, Vladimir V", "Ukraine", "Russia", "Crimea (Ukraine)"]}
{"pub_date": "2014-03-01T13:01:32Z", "headline": "To See U.S. Wealth Gap, Look No Further Than Washington", "lead_paragraph": "President Barack Obama is making income inequality an issue in midterm elections, and proof of the gap between rich and poor is close at hand right outside the White House.", "keywords": ["Obama", "Barack", "House", "Washington", "White"]}
{"pub_date": "2014-03-01T13:11:20Z", "headline": "U.S., Russian Defense Chiefs Talk Amid Russian Moves on Crimea", "lead_paragraph": "U.S. Defense Secretary Chuck Hagel spoke on Saturday with his Russian counterpart, a U.S. official told Reuters, as Russian President Vladimir Putin secured his parliament's authority to invade Ukraine.", "keywords": ["Ukraine", "Russia", "Defense", "Putin", "Vladimir", "Crimea", "Secret"]}
{"pub_date": "2014-03-01T13:38:01Z", "headline": "Analysis: Limited US, European Options in Ukraine", "lead_paragraph": "Despite blunt warnings about costs and consequences, President Barack Obama and European leaders have limited options for retaliating against Russia's military intervention in Ukraine, the former Soviet republic now at the center of an emerging conflict between East and West.", "keywords": ["Ukraine", "Russia", "Europe", "European", "Obama", "Barack", "Soviet", "Options"]}
{"pub_date": "2014-03-01T13:49:53Z", "headline": "Think Back: Obama's Cold War", "lead_paragraph": "In addressing crises in Ukraine, Syria and elsewhere, President Obama seems to be drawing on the memory of old-time superpower struggles, says Sam Tanenhaus.", "keywords": ["Nixon, Richard Milhous", "Cold War Era", "Russia", "United States International Relations", "Reagan, Ronald Wilson", "Presidents and Presidency (US)", "Obama, Barack", "Eisenhower, Dwight David"]}
{"pub_date": "2014-03-01T14:58:11Z", "headline": "Rep. Cory Gardner Launches Senate Run", "lead_paragraph": "Republican Rep. Cory Gardner formally kicked off his Senate campaign on Saturday by tying his challenge to Democratic Sen. Mark Udall to the GOP's efforts to reverse its decade-long slide in this key political bellwether state.", "keywords": ["Senate", "Democratic", "Republican", "Republic", "Udall"]}
{"pub_date": "2014-03-01T15:00:27Z", "headline": "Charity Runners Prepare for Boston Marathon", "lead_paragraph": "Hundreds of runners dressed like superheroes raced down the final 18 miles of the Boston Marathon course Saturday, training for the world's oldest marathon a year after twin explosions killed three people and wounded more than 260 others.", "keywords": ["Boston"]}
{"pub_date": "2014-03-01T15:32:58Z", "headline": "Obama National Security Aides Discuss Policy Options for Ukraine", "lead_paragraph": "President Barack Obama's national security team met on Saturday for an update on the situation in Ukraine and to discuss potential policy options, a senior Obama administration official said.", "keywords": ["Ukraine", "National", "Obama", "Barack", "Options", "Security"]}
{"pub_date": "2014-03-01T17:00:24Z", "headline": "Obama to Push Minimum Wage Wednesday in Conn.", "lead_paragraph": "Striving to show momentum on a top legislative priority, President Barack Obama is appearing next week with Northeastern governors who back his push to raise the federal minimum wage to $10.10 an hour and will pledge to lift the earnings of the lowest-paid workers in their states to at least the same level.", "keywords": ["Minimum Wage", "Obama", "Barack", "North", "Minimum"]}
{"pub_date": "2014-03-01T17:33:13Z", "headline": "Obama Expresses Deep Concern to Putin on Ukraine", "lead_paragraph": "U.S. President Barack Obama told Russian President Vladimir Putin that Russia had committed a clear violation of Ukrainian sovereignty by sending forces into Crimea and warned of consequences.", "keywords": ["Ukraine", "Russia", "Putin", "Vladimir", "Crimea", "Obama", "Barack"]}
{"pub_date": "2014-03-01T18:29:57Z", "headline": "Obama, Wary of Foreign Crises, Faces East-West Standoff in Ukraine", "lead_paragraph": "As Russia deepened its military intervention in Ukraine's Crimea region on Saturday, ignoring Barack Obama's stern warning, the U.S. president faced a critical test of whether Washington has the leverage or the will to get Moscow to back down.", "keywords": ["Ukraine", "Russia", "Crimea", "Obama", "Barack", "Washington", "Moscow", "Foreign"]}
{"pub_date": "2014-03-01T18:31:36Z", "headline": "Obama Speaks to France's Hollande, Canada's Harper on Ukraine: White House", "lead_paragraph": "U.S. President Barack Obama spoke by phone on Saturday with French President Francois Hollande and Canadian Prime Minister Stephen Harper and they expressed grave concern about Russia's military intervention in Ukraine, the White House said.", "keywords": ["Ukraine", "Russia", "Canada", "Obama", "Barack", "House", "White", "Stephen"]}
{"pub_date": "2014-03-01T18:38:27Z", "headline": "Obama, Wary of Foreign Crises, Faces East-West Standoff in Ukraine", "lead_paragraph": "As Russia deepened its military intervention in Ukraine's Crimea region on Saturday, ignoring Barack Obama's stern warning, the U.S. president faced a critical test of whether Washington has the leverage or the will to get Moscow to back down.", "keywords": ["Ukraine", "Russia", "Crimea", "Obama", "Barack", "Washington", "Moscow", "Foreign"]}
{"pub_date": "2014-03-01T19:07:18Z", "headline": "Obama Expresses Deep Concern to Putin on Ukraine", "lead_paragraph": "U.S. President Barack Obama told Russian President Vladimir Putin on Saturday that Moscow's deployment of Russian forces into Crimea is a clear violation of Ukraine's sovereignty and warned of greater economic and political isolation if they are not withdrawn.", "keywords": ["Ukraine", "Russia", "Putin", "Vladimir", "Crimea", "Obama", "Barack", "Moscow"]}
{"pub_date": "2014-03-01T19:39:58Z", "headline": "Canada Says Recalling Ambassador From Russia for Consultations", "lead_paragraph": "Canada is recalling its ambassador to Russia for consultations about the crisis in Ukraine and is freezing preparations to take part in the Group of Eight summit in Sochi, Prime Minister Stephen Harper said on Saturday.", "keywords": ["Ukraine", "Russia", "Canada", "Group", "Sochi", "Stephen"]}
{"pub_date": "2014-03-01T20:00:51Z", "headline": "Canada Pulls Ambassador From Moscow Over Ukraine", "lead_paragraph": "Canada says it is pulling its ambassador from Moscow over the crisis in Ukraine.", "keywords": ["Ukraine", "Canada", "Moscow"]}
{"pub_date": "2014-03-01T20:35:04Z", "headline": "Clinton Files Show Internal Worries, Candor", "lead_paragraph": "The National Archives on Friday released about 4,000 pages of previously confidential documents involving former President Bill Clinton's administration. The documents included some revealing comments about the Clintons and their concerns.", "keywords": ["Clinton", "Archives", "National", "Internal"]}
{"pub_date": "2014-03-01T21:30:33Z", "headline": "Obamas Attend Dance Recital for Daughter Sasha", "lead_paragraph": "President Barack Obama and first lady Michelle Obama are attending their youngest daughter's dance recital at an arts center in the Maryland suburbs of the capital.", "keywords": ["Obama", "Barack", "Sasha", "Michelle"]}
{"pub_date": "2014-03-02T00:00:00Z", "headline": "'Everyone Has a Game Plan Until You Punch them in the Mouth'", "lead_paragraph": "Chris Lehane, political strategist who was shaped by his years in the Clinton White House, has found that his aggressive Beltway tactics work well in California; Lehane's roster of clients includes environmentalist billionaires and people and businesses who are in trouble, as well as a few whose interests are hard to defend.", "keywords": ["Presidential Election of 2000", "Sacramento (Calif)", "Lehane, Chris", "Political Advertising", "Politics and Government"]}
{"pub_date": "2014-03-02T00:00:00Z", "headline": "Writers on the Left", "lead_paragraph": "Michael Kazin reviews books Lillian Hellman: An Imperious Life by Dorothy Gallagher, The Expo Files: And Other Articles by the Crusading Journalist by Stieg Larsson and A Colossal Wreck: A Road Trip Through Scandal, Political Corruption and American Culture by Alexander Cockburn.", "keywords": ["Larsson, Stieg", "Books and Literature", "Cockburn, Alexander", "Gallagher, Dorothy"]}
{"pub_date": "2014-03-02T00:00:00Z", "headline": "Paperback Row", "lead_paragraph": "Paperback books of particular interest.", "keywords": ["Books and Literature"]}
{"pub_date": "2014-03-02T00:00:00Z", "headline": "Tussling Over Ukraine; Gains and Grave Setbacks for Gay Rights", "lead_paragraph": "Serge Schmemann Quick History column reflects on the news of the week, including events in Ukraine and the veto of Arizona law allowing businesses to decline services to singe-sex marriages.", "keywords": ["Amnesty International", "Arizona", "Human Rights and Human Rights Violations", "Ukraine", "Uganda", "Homosexuality", "Same-Sex Marriage, Civil Unions and Domestic Partnerships", "Law and Legislation"]}
{"pub_date": "2014-03-02T00:00:00Z", "headline": "Kremlin Deploys Military to Seize Crimea", "lead_paragraph": "Ukraine calls up its military reserves and warns Moscow against further incursions as Western powers scramble to find a response to Russia's move to seize control of Ukraine's Crimean Peninsula; Ukrainian government threatens war if Russia sends troops further into Ukraine.", "keywords": ["Defense and Military Forces", "Crimea (Ukraine)", "Putin, Vladimir V", "Turchynov, Oleksandr V", "Aksyonov, Sergei", "Russia", "Ukraine"]}
{"pub_date": "2014-03-02T00:00:00Z", "headline": "Russia to Pay? Not So Simple", "lead_paragraph": "News analysis; United States has few palatable options for punishing Russia's military intervention in Ukraine, despite Pres Obama's warning of consequences; recent history has shown that Russia has been willing to pay the price when it considers its interests are at stake.", "keywords": ["United States International Relations", "United States", "Ukraine", "Russia", "Obama, Barack"]}
{"pub_date": "2014-03-02T00:00:00Z", "headline": "Amid More Signs of Russian Force in Crimea, Delight Mixes With Dismay", "lead_paragraph": "Ethnic Russians in Crimea rejoiced, but the region's other populations, Muslim Tatars and Ukrainians, mourned a return to an era thought to have ended with the Cold War.", "keywords": ["Crimea (Ukraine)", "Ukraine", "Russia", "Tatars (Ethnic Group)", "Demonstrations, Protests, and Riots"]}
{"pub_date": "2014-03-02T00:00:00Z", "headline": "With Vacancies High, G.O.P. Primaries in Texas Set Up a Scramble to the Right", "lead_paragraph": "Shifts in Texas's political landscape, including departure of longtime Gov Rick Perry and rise of right-leaning Sen Ted Cruz, have led to high political turnover and agitated primary race; Cruz's victory has inspired other Texas Republicans to veer sharply right.", "keywords": ["Perry, Rick", "Cornyn, John", "Texas", "Primaries and Caucuses", "Elections, Governors", "Bush, George Prescott", "Republican Party", "Cruz, Ted"]}
