{"pub_date": "2014-03-04T17:07:05Z", "headline": "Financial Regulator Calls Obama Budget 'Woefully Insufficient'", "lead_paragraph": "Bart Chilton, a commissioner on the Commodity Futures Trading Commission, said President Obama's $280 million request for the agency in the next fiscal year was inadequate for the agency's expanded mission.", "keywords": ["Chilton, Bart", "Obama, Barack", "Ryan, Paul D Jr", "Wisconsin", "House of Representatives", "Securities and Exchange Commission", "Senate", "Commodity Futures Trading Commission", "Federal Budget (US)", "Dodd-Frank Wall Street Reform and Consumer Protection Act (2010)", "Regulation and Deregulation of Industry", "Futures and Options Trading", "Commodities"]}
{"pub_date": "2014-03-04T17:11:22Z", "headline": "U.S. Senate Tax Chief Looks to Tweak Code, No Reform Yet", "lead_paragraph": "The U.S. Senate's tax-writing committee will begin work as soon as April on restoring a small package of tax breaks and not try to overhaul the tax code, the committee's new chairman said on Tuesday.", "keywords": ["Senate", "Reform", "April"]}
{"pub_date": "2014-03-04T17:11:43Z", "headline": "Obama budget sets up election-year clash with Republicans", "lead_paragraph": "President Obama proposes new tax credits and job-training programs for U.S. workers in a 2015 budget that drew instant condemnation from Republicans. Mana Rabiee reports.", "keywords": ["Obama", "Republican", "Republic"]}
{"pub_date": "2014-03-04T17:19:05Z", "headline": "Obama Budget Sets Medicare Savings, Hospitals Seek Reprieve", "lead_paragraph": "President Barack Obama's budget plan for 2015 would save $402 billion from the Medicare and Medicaid government healthcare programs for the elderly and poor over the next 10 years, primarily due to reduced reimbursement to healthcare providers and drugmakers.", "keywords": ["Medicare", "Medicaid", "Obama", "Barack", "Budget"]}
{"pub_date": "2014-03-04T17:25:35Z", "headline": "Snowden to Speak on Government Spying at Texas Video-Conference", "lead_paragraph": "Former security contractor Edward Snowden, facing arrest if he steps foot on U.S. soil, will participate remotely in a panel discussion next week in Texas about governmental intrusion into privacy, conference organizers said on Tuesday.", "keywords": ["Texas", "Government", "Former", "Snowden", "Edward", "Conference"]}
{"pub_date": "2014-03-04T17:36:15Z", "headline": "Agency Spending Proposed by Obama for 2015", "lead_paragraph": "A glance at congressionally appropriated spending levels proposed by President Barack Obama for each federal agency in his fiscal 2015 budget, beginning next Oct. 1. Agency numbers represent budget authority. The figures do not include spending on automatic benefit and subsidy programs that together account for 70 percent of government spending. Figures for many of those programs were not provided by the White House Office of Management and Budget.", "keywords": ["Obama", "Barack", "House", "White", "Agency", "Management", "Budget", "Office"]}
{"pub_date": "2014-03-04T17:56:13Z", "headline": "Obama Budget's Major Spending, Revenue Categories", "lead_paragraph": "Summary of federal government spending programs and revenue sources in Obama's proposed budget for fiscal 2015. Figures are in billions of dollars.", "keywords": ["Obama", "Budget", "Revenue"]}
{"pub_date": "2014-03-04T18:11:43Z", "headline": "S&P 500 flies to record as Ukraine tensions ease", "lead_paragraph": "Summary: Wall St advances in biggest move of the year in a sign of investor relief over easing tensions between Russia and Ukraine; Dish, Disney in landmark deal; Obama delivers $3.9 trillion budget.  Conway G. Gittens reports.", "keywords": ["Ukraine", "Russia", "Obama"]}
{"pub_date": "2014-03-04T19:00:25Z", "headline": "Latino Group Leader: Obama Is 'Deporter in Chief'", "lead_paragraph": "The president of a prominent Latino advocacy group called President Barack Obama the \"deporter in chief,\" denouncing the administration's deportation of nearly 2 million immigrants.", "keywords": ["Obama", "Barack", "Group"]}
{"pub_date": "2014-03-04T19:17:49Z", "headline": "Obama, Germany's Merkel Discuss Potential Resolution to Ukraine Crisis", "lead_paragraph": "President Barack Obama spoke to German Chancellor Angela Merkel on Tuesday about a potential resolution to the crisis ignited by Russian intervention in Ukraine's Crimea region, a senior administration official said.", "keywords": ["Ukraine", "Russia", "Germany", "Crimea", "Obama", "Barack", "Merkel", "Angela", "Crisis"]}
{"pub_date": "2014-03-04T19:35:30Z", "headline": "Obama Eyes Boost in Space Taxi Spending, Jupiter Moon Mission", "lead_paragraph": "President Barack Obama's 2015 NASA budget plan includes funding for a robotic mission to an ocean-bearing moon of Jupiter and could help boost commercial ventures to fly astronauts to the International Space Station, NASA officials said on Tuesday.", "keywords": ["Obama", "Barack", "International"]}
{"pub_date": "2014-03-04T19:37:07Z", "headline": "Arkansas Lawmakers Vote to Fund State's Alternative to Obamacare", "lead_paragraph": "The Arkansas House of Representatives voted on Tuesday to fund the state's so-called \"Private Option\" medical insurance program that has drawn interest from lawmakers in other states as an alternative to Obamacare.", "keywords": ["House of Representatives", "Arkansas", "Obama", "State", "House", "Representatives", "Private"]}
{"pub_date": "2014-03-04T19:47:41Z", "headline": "Oops, Congress Asked to Fix Slip-Up in Myanmar Aid Bill", "lead_paragraph": "The Obama administration is asking Congress to fix a 2012 bill that left a World Bank agency out of a list of 12 international financial institutions that could receive U.S. support to promote development in Myanmar.", "keywords": ["Obama", "World"]}
{"pub_date": "2014-03-04T19:53:38Z", "headline": "White House Readies Health Insurance Renewal Extension: Sources", "lead_paragraph": "The Obama administration will allow consumers to extend health insurance plans that fail to comply with President Barack Obama's healthcare law beyond 2014, according to three people familiar with the matter.", "keywords": ["Insurance", "Obama", "Barack", "Health", "House", "White"]}
{"pub_date": "2014-03-04T19:55:04Z", "headline": "Obama Budget: a Boon Midterm Narrative for Democrats?", "lead_paragraph": "President Barack Obama's populist budget proposal, announced on Tuesday, is a pointed attempt to bolster ties with congressional Democrats ahead of high-stakes elections in November.", "keywords": ["Obama", "Barack", "Budget"]}
{"pub_date": "2014-03-04T20:10:47Z", "headline": "Obama: Dems Paid 'Dear Price' in 2010 Midterms", "lead_paragraph": "President Barack Obama says Democrats paid a \"dear price\" for not paying enough attention to the 2010 midterm elections and urged donors to not repeat the same mistakes this year.", "keywords": ["Obama", "Barack", "Price"]}
{"pub_date": "2014-03-04T21:02:40Z", "headline": "Market and Rates Helped Private Equity Chiefs Thrive Last Year ", "lead_paragraph": "Lucrative payouts were helped greatly by the combination of low interest rates and high stock prices, which was ideal for selling investments.", "keywords": ["Black, Leon D", "Schwarzman, Stephen A", "Kravis, Henry R", "Rubenstein, David M", "TPG Capital", "Carlyle Group LP", "Kohlberg Kravis Roberts & Co", "The Blackstone Group", "Apollo Global Management", "Private Equity", "Executive Compensation"]}
{"pub_date": "2014-03-04T21:31:46Z", "headline": "Obama Urges Democrats to Wake Up Ahead of Tough Midterm Elections", "lead_paragraph": "Democrats need to wake up and understand the stakes involved in holding on to control of the U.S. Senate in the November congressional elections, President Barack Obama told Democratic Party donors at a fundraiser on Tuesday.", "keywords": ["Democratic Party", "Senate", "Elections", "Election", "Obama", "Barack", "Democratic", "Party"]}
{"pub_date": "2014-03-04T21:57:07Z", "headline": "Longtime US Rep. Ralph Hall, 90, Faces Runoff", "lead_paragraph": "A conservative former U.S. attorney forced the oldest member of the U.S. House into a runoff election Tuesday night for the Republican nomination.", "keywords": ["House", "Republican", "Republic"]}
{"pub_date": "2014-03-05T00:00:00Z", "headline": "Citing 'Coup' in Ukraine, Putin Reserves Right to Use Force", "lead_paragraph": "President Vladimir V. Putin of Russia described events in Ukraine as an unconstitutional coup, expressed contempt toward the United States and called any potential use of military force 'a last resort.'", "keywords": ["Putin, Vladimir V", "Ukraine", "International Relations", "Defense and Military Forces", "Russia"]}
{"pub_date": "2014-03-05T00:00:00Z", "headline": "Aipac Is Good for America", "lead_paragraph": "The pro-Israel powerhouse is using its influence to promote U.S. engagement with the world, rather than isolation.", "keywords": ["Lobbying and Lobbyists", "Middle East", "Israel", "American Israel Public Affairs Committee"]}
{"pub_date": "2014-03-05T00:00:00Z", "headline": "Kerry Takes Offer of Aid to Ukraine and Pushes Back at Russian Claims", "lead_paragraph": "Secretary of State John Kerry visits Kiev, Ukraine, with offer of $1 billion in American loan guarantee and pledges of technical assistance, in demonstration of support for fledgling government and new swipe at Russia.", "keywords": ["Russia", "Ukraine", "Kerry, John"]}
{"pub_date": "2014-03-05T00:00:00Z", "headline": "Crimean Premier Says Ukrainian Military Units Have Started to Surrender", "lead_paragraph": "Crimean Prime Min Sergei Aksyonov says most Ukrainian military units on Crimean Peninsula have surrendered and pledged allegiance to his pro-Russian government, and that officials are working to speed referendum on independence from Ukraine; Ukrainian Defense Ministry denounces assertion of defections as false.", "keywords": ["Defense and Military Forces", "Ukraine", "Yanukovych, Viktor F", "Legislatures and Parliaments", "Aksyonov, Sergei", "Putin, Vladimir V", "Crimea (Ukraine)", "Russia", "Referendums"]}
{"pub_date": "2014-03-05T00:00:00Z", "headline": "Wheelies: The Corvette Resurrection Edition", "lead_paragraph": "The National Corvette Museum began rescuing the eight cars swallowed by a sinkhole last month; the E.P.A. issues rules for sulfur levels in gasoline.", "keywords": ["Bayerische Motorenwerke AG", "Auctions America", "Mazda Motor Corp", "Chevrolet Division of General Motors Corp", "Sinkholes", "Environmental Protection Agency", "Marchionne, Sergio", "Automobiles", "Greenhouse Gas Emissions", "Alfa Romeo Automobiles"]}
{"pub_date": "2014-03-05T00:00:00Z", "headline": "Obama's Budget Is Populist Wish List and an Election Blueprint", "lead_paragraph": "Pres Obama sends Congress a $3.9 trillion budget request that stands as a platform for Democrats to run on in the election year; budget is full of policies intended to invite contrasts with Republicans rather than offering the compromises he included in 2013 budget without success.", "keywords": ["United States", "House of Representatives", "United States Politics and Government", "Federal Budget (US)", "Obama, Barack", "Senate"]}
{"pub_date": "2014-03-05T00:00:00Z", "headline": "Driver's License Program in California Hits a Snag", "lead_paragraph": "Advocates of California program to offer driver's licenses to undocumented residents are confronting formidable obstacle of deep and longstanding mistrust of American government among illegal immigrant population; many immigrants who are in country illegally are reluctant to apply for licenses, fearing government might use documentation to establish their identities and deport them.", "keywords": ["California", "Drivers Licenses", "Department of Motor Vehicles", "Deportation", "Illegal Immigration"]}
{"pub_date": "2014-03-05T00:00:00Z", "headline": "Cuomo Vows to Defend Charter Schools, Setting Up Another Battle With de Blasio", "lead_paragraph": "Gov. Andrew M. Cuomo, at a rally in Albany, offered a sharply different vision for charter schools than Mayor Bill de Blasio, who has vowed to slow the growth of such schools.", "keywords": ["Success Academy Charter Schools", "Cuomo, Andrew M", "Charter Schools", "Education (K-12)", "New York City", "de Blasio, Bill", "New York State"]}
{"pub_date": "2014-03-05T00:00:00Z", "headline": "A Miami Congressman Adamantly Defends Isolating Cuba", "lead_paragraph": "Representative Mario D\u00edaz-Balart says American policy toward Cuba should focus on human rights, not on using private enterprise to move Cuba away from dictatorship.", "keywords": ["Castro, Raul", "Ladies in White", "Embargoes and Economic Sanctions", "Human Rights and Human Rights Violations", "Cuban-Americans", "Castro, Fidel"]}
{"pub_date": "2014-03-05T00:00:00Z", "headline": "N.S.A. Director Says Leaks Hamper Defense Efforts", "lead_paragraph": "Gen Keith B Alexander, director of National Security Agency, says leaks by former contractor Edward J Snowden have slowed the effort to protect the country against cyberattacks on Wall Street and other civilian targets.", "keywords": ["Surveillance of Citizens by Government", "Cyberwarfare", "Cyberattacks and Hackers", "Alexander, Keith B", "National Security Agency", "Snowden, Edward J"]}
{"pub_date": "2014-03-05T00:00:00Z", "headline": "Time to Try Compassion, Not Censure, for Families", "lead_paragraph": "Eduardo Porter Economic Scene column praises Obama administration proposal to expand the earned-income tax credit to include workers who do not care for children, calling it a potential turning point in the battle against poverty; argues that 50-year effort to reshape poor families and punish absentee fathers has been a failure, and that stripping moral condemnation out of social policy is an essential step toward success.", "keywords": ["Labor and Jobs", "Tax Credits, Deductions and Exemptions", "Income Inequality", "Parenting", "Federal Aid (US)", "Families and Family Life", "Children and Childhood", "Poverty"]}
{"pub_date": "2014-03-05T00:00:00Z", "headline": "Some Progress on Eating and Health", "lead_paragraph": "Let's be thankful for the decline in obesity rates, curbs on food marketing and transparency in packaged food -- and then let's push for more.", "keywords": ["Food", "Obama, Michelle", "United States", "Sugar", "Diet and Nutrition", "Regulation and Deregulation of Industry", "Labeling and Labels", "Food and Drug Administration", "Obesity"]}
{"pub_date": "2014-03-05T00:00:00Z", "headline": "Arkansas House Votes to Extend Health Insurance Program", "lead_paragraph": "Arkansas House of Representatives votes to allow state to keep taking federal money for expansion of Medicaid under Pres Obama's health care law and use it to buy private insurance for poor people.", "keywords": ["Patient Protection and Affordable Care Act (2010)", "State Legislatures", "Health Insurance and Managed Care", "Obama, Barack", "Arkansas", "Beebe, Mike", "Law and Legislation", "Medicaid"]}
{"pub_date": "2014-03-05T00:00:00Z", "headline": "Why Putin Doesn't Respect Us", "lead_paragraph": "Thomas L Friedman Op-Ed column scoffs at nonsense being written that Russian Pres Vladimir Putin has displayed more toughness than Pres Obama over Ukraine; contends that Putin's strength is greatly exaggerated while America's is vastly underestimated; asserts that United States could most frighten Putin by undercutting Russia's oil and gas exports.", "keywords": ["Crimea (Ukraine)", "Putin, Vladimir V", "Natural Gas", "United States International Relations", "Oil (Petroleum) and Gasoline", "Ukraine", "Russia", "Obama, Barack"]}
{"pub_date": "2014-03-05T00:00:00Z", "headline": "The What-Might-Have-Been Budget", "lead_paragraph": "Editorial contends that Pres Obama's 2015 budget proposal is an important illustration of how many national goals could be achieved if Congress would end unnecessary and unfair tax breaks for the rich; underscores importance of the proposed expansion of the earned-income tax credit; laments that the budget will not survive Republican opposition in Congress.", "keywords": ["Income Inequality", "Editorials", "Tax Credits, Deductions and Exemptions", "Federal Taxes (US)", "United States Politics and Government", "United States", "Obama, Barack", "Republican Party", "Poverty", "Federal Budget (US)"]}
{"pub_date": "2014-03-05T00:00:00Z", "headline": "A Rational Response to Ukraine's Crisis", "lead_paragraph": "Editorial dismisses criticism of Pres Obama's approach to crisis in the Ukraine; contends that Obama has reacted coolly and rationally, and is so far on the right track; maintains that the United States and its European allies must prepare contingency plans for any escalation of Russian aggression.", "keywords": ["Ukraine", "Editorials", "Defense and Military Forces", "Crimea (Ukraine)", "Russia", "Embargoes and Economic Sanctions", "Europe", "International Relations", "Obama, Barack", "Putin, Vladimir V", "United States", "United States International Relations"]}
{"pub_date": "2014-03-05T00:00:00Z", "headline": "No Easy Way Out", "lead_paragraph": "News analysis; Pres Vladimir V Putin's assurance that Russia does not plan for now to seize eastern Ukraine suggests possible path forward in the geopolitical crisis; development presents conundrum for Pres Obama and his European allies about what to do about Russia's occupation of the Crimean Peninsula.", "keywords": ["Ukraine", "United States International Relations", "Obama, Barack", "Russia", "Putin, Vladimir V", "Crimea (Ukraine)"]}
{"pub_date": "2014-03-05T00:00:00Z", "headline": "Group Close to President Says It Erred on Donation", "lead_paragraph": "Organizing for Action, political advocacy group backed by Pres Obama, acknowledges that its executive director had set up White House meeting for New Jersey businessman entangled in lawsuit with federal agency, who then pledged to raise $100,000 for group; also says that on three occasions its fund-raisers or other employees had tried to steer potentially controversial donations to allied liberal groups that did not disclose their donors.", "keywords": ["Ethics (Institutional)", "Organizing for Action", "Carson, Jon", "Maltzman, Samantha", "Campaign Finance", "Kazmir, Munr", "Obama, Barack"]}
{"pub_date": "2014-03-05T00:00:00Z", "headline": "C.I.A. Inquiry Is Set in Clash on Detentions", "lead_paragraph": "Protracted battle between the Central Intelligence Agency and the Senate Intelligence Committee over defunct detention and interrogation program has become a dispute over the separation of powers and congressional oversight of American spy agencies; committee has investigated program for years, and CIA's attempt to keep details about program secret has lead to investigation by its internal watchdog into conduct of agency employees.", "keywords": ["Brennan, John O", "Espionage and Intelligence Services", "Senate", "Feinstein, Dianne", "Senate Committee on Intelligence", "Udall, Mark", "Interrogations", "Detainees", "Central Intelligence Agency"]}
{"pub_date": "2014-03-05T00:00:00Z", "headline": "Netanyahu Promotes Efforts Toward a Peace Deal", "lead_paragraph": "Israeli Prime Min Benjamin Netanyahu makes an uncharacteristically enthusiastic pitch for a peace accord with Palestinians, day after meeting with Pres Obama, in a speech to the American Israel Public Affairs Committee.", "keywords": ["Israel", "Netanyahu, Benjamin", "Palestinians", "Kerry, John", "American Israel Public Affairs Committee"]}
{"pub_date": "2014-03-05T00:00:00Z", "headline": "U.S. Takes Training Role in Africa as Threats Grow and Budgets Shrink", "lead_paragraph": "Pentagon is helping Niger and other African countries to combat rising Islamist militancy by providing advice and training African troops to deal with terrorists on their own; strategy represents marked shift from direct involvement in conflicts, as American defense budget shrinks and citizens lose appetite for intervening in foreign wars.", "keywords": ["Nigeria", "Boko Haram", "Defense and Military Forces", "Terrorism", "Al Qaeda", "Africa", "United States Defense and Military Forces", "Niger"]}
{"pub_date": "2014-03-05T00:30:25Z", "headline": "Japan's Embrace of Russia Under Threat With Ukraine Crisis", "lead_paragraph": "Russia's incursion into Ukraine is setting off alarm bells in Tokyo, where officials worry that any push by Japan's Western allies to impose economic penalties will undermine its drive to improve relations with Moscow.", "keywords": ["Ukraine", "Russia", "Moscow", "Crisis"]}
{"pub_date": "2014-03-05T00:30:47Z", "headline": "Alameel, Rogers Advance to Texas Senate Runoff", "lead_paragraph": "Dallas dental mogul David Alameel and frequent candidate Kesha Rogers have advanced to a runoff to decide the Democratic U.S. Senate nomination.", "keywords": ["Texas", "Senate", "Democratic", "David", "Roger", "Rogers"]}
{"pub_date": "2014-03-05T00:40:17Z", "headline": "Israel's Prime Minister Visits Hollywood for Premiere of Tourism Film", "lead_paragraph": "Israeli Prime Minister Benjamin Netanyahu visited Hollywood on Tuesday for the premiere of a film to promote tourism to the Holy Land, shifting the spotlight away from his frequent focus on dangers facing his country.", "keywords": ["Israel", "Israeli", "Netanyahu", "Benjamin"]}
{"pub_date": "2014-03-05T00:48:01Z", "headline": "Big Power Talks on Ukraine Crisis Make Little Progress", "lead_paragraph": "High-level diplomatic efforts to resolve the crisis in Ukraine made little apparent headway at talks in Paris on Wednesday, with Moscow and Washington at odds and Russia's foreign minister refusing to recognize his Ukrainian counterpart.", "keywords": ["Ukraine", "Russia", "Washington", "Moscow", "Crisis"]}
{"pub_date": "2014-03-05T00:56:44Z", "headline": "Big Power Talks on Ukraine Crisis Make Little Progress", "lead_paragraph": "High-level diplomatic efforts to resolve the crisis in Ukraine made little apparent headway at talks in Paris on Wednesday, with Moscow and Washington at odds and Russia's foreign minister refusing to recognise his Ukrainian counterpart.", "keywords": ["Ukraine", "Russia", "Washington", "Moscow", "Crisis"]}
{"pub_date": "2014-03-05T03:05:15Z", "headline": "Russia, West Try to Hammer Out Ukraine Diplomacy", "lead_paragraph": "The United States and Western diplomats failed to bring Russian and Ukrainian foreign ministers together Wednesday for face-to-face talks on the confrontation in Crimea, even as U.S. Secretary of State John Kerry voiced optimism that an exit strategy was possible. \"I'd rather be where we are today than where we were yesterday,\" he said.", "keywords": ["Ukraine", "Russia", "United States", "Crimea", "United", "States", "State", "Kerry", "Secret"]}
{"pub_date": "2014-03-05T03:14:34Z", "headline": "In Populist Appeal, Obama Spotlights Minimum Wage", "lead_paragraph": "Mounting a show of support from like-minded governors, President Barack Obama put a spotlight Wednesday on a minimum wage push that Democrats hope will appeal to economically squeezed voters in November's midterm elections.", "keywords": ["Minimum Wage", "Obama", "Barack", "Minimum"]}
{"pub_date": "2014-03-05T03:16:03Z", "headline": "Court Weighs Securities Fraud Case Changes", "lead_paragraph": "The Supreme Court on Wednesday seemed open to the possibility of making it harder for investors to join together to sue corporations for securities fraud &#8212; but maybe not as hard as companies that have to defend such lawsuits would like.", "keywords": ["Changes", "Securities", "Change", "Supreme", "Court"]}
{"pub_date": "2014-03-05T03:17:53Z", "headline": "Agency-By-Agency Summary of Obama Budget", "lead_paragraph": "An agency-by-agency summary of President Barack Obama's proposed budget for fiscal 2015, beginning next Oct. 1.", "keywords": ["Obama", "Barack", "Agency", "Budget"]}
{"pub_date": "2014-03-05T03:20:08Z", "headline": "Obama Budget's Major Spending, Revenue Categories", "lead_paragraph": "Summary of federal government spending programs and revenue sources in Obama's proposed budget for fiscal 2015. Figures are in billions of dollars:", "keywords": ["Obama", "Budget", "Revenue"]}
{"pub_date": "2014-03-05T03:27:08Z", "headline": "GOP Pans Obama's $3.9T Budget as Campaign Warm-Up", "lead_paragraph": "Republicans are dismissing President Barack Obama's new $3.9 trillion budget as nothing more than a Democratic manifesto for this fall's congressional campaigns, but the fiscal plan is taking hits from another quarter too &#8212; anti-deficit groups.", "keywords": ["Obama", "Barack", "Democratic", "Republican", "Campaign", "Budget", "Republic"]}
{"pub_date": "2014-03-05T03:28:57Z", "headline": "Analysts: Russia Unlikely to Pull Back in Crimea", "lead_paragraph": "Russia is unlikely to pull back its military forces in Ukraine's Crimean peninsula, analysts and former Obama administration officials say, forcing the United States and Europe into a more limited strategy of trying to prevent President Vladimir Putin from making advances elsewhere in the former Soviet republic.", "keywords": ["Ukraine", "Russia", "United States", "Europe", "Putin", "Vladimir", "Crimea", "United", "States", "Obama", "State", "Crimean", "Soviet"]}
{"pub_date": "2014-03-05T03:32:38Z", "headline": "Analysis: Obama Budget Tries to Have It Both Ways", "lead_paragraph": "President Barack Obama is trying to have it both ways with an election-year budget that pays faint lip service to reducing federal deficits while piling on about $1 trillion in tax increases and hundreds of billions in higher spending designed to appeal to economically squeezed voters rather than congressional foes of red ink.", "keywords": ["Obama", "Barack", "Budget"]}
